video_id,title,publishedAt,channelId,channelTitle,categoryId,duration,dimension,definition,is_trending,time_retrieved,tags,view_count,likes,dislikes,comment_count,thumbnail_link,comments_disabled,ratings_disabled,description
"5AwdkGKmZ0I","Apple Event — November 10","2020-11-10T18:52:28Z","UCE_M8A5yxnLfW0KghEeajjw","Apple","28","PT49M","2d","hd","True","2020-11-10T18:59:06Z","Apple|Apple Event|Apple Keynote|Apple Special Event|November|Introducing|Mac Event|Mac|MacBook|MacBook Air|Mac mini|MacBook Pro|No fan|silent design|Apple Silicon|Apple chip|M1|CPU|GPU|Thunderbolt|Unified Memory|SSD|iPad apps|iOS|longest battery life|machine learning|Neural Engine|Rosetta|universal apps|Big Sur|macOS|Safari|app developers|Apple’s lightest notebook|Retina display|Magic keyboard|Touch ID|USB 4|Steven Harrington|Finneas","5837088","244887","5476","0","https://i.ytimg.com/vi/5AwdkGKmZ0I/default.jpg","True","False","Watch the special Apple Event and learn about the next generation of Mac. Now with the Apple M1 chip, the new MacBook Air, 13-inch MacBook Pro, and Mac mini each take a huge leap forward.To watch the event interpreted in American Sign Language (ASL), please click here: https://youtu.be/vaqwCqB-EZI00:00 Introduction04:39 Apple Silicon14:00 macOS Big Sur22:45 MacBook Air29:50 Mac Mini35:06 MacBook Pro'Fly Away' by Tones & I 'Take Back The Power' by Raury http://apple.co/TakeBackThePower'Music To Clean The House To' by Nick Leng http://apple.co/MusicToCleanTheHouseTo'Playing Your Game, Baby' by Barry White http://apple.co/PlayingYourGameBaby'Ya Ya Power' by KingupingU http://apple.co/YaYaPower'Bring The Drums Back' by Noisy http://apple.co/BringTheDrumsBack'Wave' by Whethan http://apple.co/Wave'Back It Up' by Alison Wonderland X AWE http://apple.co/BackItUp'Show Me How' by Beacon 'Alright With Me' by Memba & Ricky James http://apple.co/AlrightWithMe"
"xBe-36v3lQo","UFC Golf Battle","2020-11-09T23:00:05Z","UCRijo3ddMTht_IHyNSNXpNQ","Dude Perfect","17","PT15M32S","2d","hd","True","2020-11-10T18:59:06Z","dude perfect|dude perfect stereotypes|dude perfect water bottle flip|bottle flip|water bottle flip|dude perfect bottle flip|dude perfect basketball|dp|dude perfect world record|edition|nerf|trick shots|trick shot|family|ping pong|bowling|clean|family friendly|bubble wrap|soccer|football|spinner|spinners|fidget spinners|dude|UFC|Golf|Football|Basketball|Paintball|Gokart|Cart|Doris|Burke|Xbox|Game pass|EA|play|Sparky|Battle|Funny|Trending|Comedy|Family","4910645","264514","4792","13478","https://i.ytimg.com/vi/xBe-36v3lQo/default.jpg","False","False","Who knew combining sports could be so fun!Thanks to Xbox Game Pass Ultimate for sponsoring this video! Click HERE to check out Xbox Game Pass Ultimate: https://bit.ly/3n7IN6S► Thanks for subscribing! - http://bit.ly/SubDudePerfect► Click HERE to watch the Behind The Scenes video: https://youtu.be/P627ONn-vHIEA Play is available with Xbox Game Pass Ultimate on November 10, arriving just in time for the launch of the new Xbox Series X | S. Discover your next favorite game with Xbox Game Pass and enjoy EA titles like Battlefield, Madden, Need for Speed and more. Click the link to learn more.Special Thanks to Prosper Independent School District and Children's Health Stadium!NEXT LEVEL STUFF -------------------------------------------🎒 NEW Merch - http://bit.ly/DPStore🎮 Play our FREE iPhone game! - http://smarturl.it/DudePerfect2📱 Text us - (469) 205-7005🔔 Hit the bell next to Subscribe so you don't miss a video!👨🏻‍💻 Watch our newest vids! - http://bit.ly/NewDPVids📕 Read our Book - Go Big - http://amzn.to/OYdZ2sFollow our Instagrams so we can be best friends -------------------------------------------🏆 http://Instagram.com/DudePerfect🧔🏻 http://Instagram.com/TylerNToney👱🏻‍♂️ http://Instagram.com/Cody_Jones_🙋🏻‍♂️ http://Instagram.com/CobyCotton👨‍🦰 http://Instagram.com/GarrettHilbert⛹🏻‍♂️ http://Instagram.com/CoryCotton-------------------------------------------Bonus points if you're still reading this! Comment: Which sports should we combine next??Click here to learn more about Dude Perfect:http://bit.ly/AboutDudePerfectAs always...Go Big and God Bless!- Your friends at Dude PerfectBusiness or Media, please contact us at: Dude@DudePerfect.com------------5 Best Friends and a Panda.If you like Sports + Comedy, come join the Dude Perfect team!Best known for trick shots, stereotypes, battles, bottle flips, ping pong shots and all-around competitive fun, Dude Perfect prides ourselves in making the absolute best family-friendly entertainment possible! Welcome to the crew! Pound it 👊🏻 Noggin 🙇🏻‍♂️ - Dude Perfect"
"pqHzqObnAz0","Dead by Daylight | A Binding of Kin | Reveal Trailer","2020-11-10T15:45:03Z","UCaSgsFdGbwjfdawl3rOXiwQ","Dead by Daylight","20","PT1M9S","2d","sd","True","2020-11-10T18:59:06Z","dead by daylight|dbd|behaviour interactive|bhvr|slasher game|survival horror|a binding of kin|dead by daylight d a binding of kin|the twins|elodie rakoto|dbd a binding of kin|a binding of kin reveal trailer|dead by daylight reveal trailer|dead by daylight chapter 18|dead by daylight new killer|dead by daylight new chapter|dead by daylight trailer|the twins trailer|a binding of kin trailer|dead by daylight killer trailers","577434","41933","637","5680","https://i.ytimg.com/vi/pqHzqObnAz0/default.jpg","False","False","Good things come in pairs.  A Binding of Kin is the next Chapter in Dead by Daylight. The Twins - Charlotte and Victor Deshayes - formed an emotional bond like none other. After a life of hardship and suffering, The Entity has twisted their love for one another into something truly terrifying. The new Survivor is Élodie Rakoto. Cunning, smart, and resolute, Élodie spent her life trying to uncover the mystery of her parents’ disappearance. Grief-stricken and guilt-ridden, she turned to the occult to find the answers she was looking for. COMING SOON. Dead by Daylight is an asymmetrical multiplayer horror game where one player takes on the role of a brutal Killer and the other four play as Survivors. As a Killer, your goal is to sacrifice as many Survivors as possible. As a Survivor, your goal is to escape and avoid being caught and killed.  BUY GAME: https://deadbydaylight.com/ Join the official forum: https://forum.deadbydaylight.com/en/  Like and follow us on our official Social Media Channels:  - Facebook: https://www.facebook.com/DeadByDaylight/  - Twitter: https://twitter.com/deadbybhvr  - Instagram: https://instagram.com/deadbydaylight #deadbydaylight #dbd #ABindingofKin"
"9P4bMIDpWXw","IT'S MY BIRTHDAY SO YOU HAVE TO CLICK ON THIS VIDEO","2020-11-09T23:45:38Z","UCiYcA0gJzg855iSKMrX3oHg","CoryxKenshin","20","PT6M45S","2d","hd","True","2020-11-10T18:59:06Z","its|my|birthday|so|you|have|to|click|on|this|video|coryxkenshin|cory|kenshin|28|th|samurai|subscribers|love","1738238","671291","2462","144900","https://i.ytimg.com/vi/9P4bMIDpWXw/default.jpg","False","False","For real though, thank you all so much for the support through the years. You've watched me grow up and witnessed the glow up (heheh) and I appreciate all the love you've made me feel today...Instagram: https://www.instagram.com/coryxkenshinTwitter: https://twitter.com/CoryxKenshin"
"vJYL4Osyipc","Biden Victory Cold Open - SNL","2020-11-08T06:34:11Z","UCqFzWxSCi39LnW1JKFR3efg","Saturday Night Live","24","PT8M7S","2d","hd","True","2020-11-10T18:59:06Z","snl|saturday night live|season 46|snl 46|snl cold open|cold open|election 2020|joe biden|Donald trump|kamala harris|presidential election|election snl|Saturday night live election|2020 election results|2020 presidential election|s46|s46e6|episode 6|live|new york|comedy|sketch|funny|hilarious|late night|host|music|guest|laugh|impersonation|actor|musician|Dave Chappelle|stand up|comedian|Chappelles show|vice president","13110317","255642","25326","27208","https://i.ytimg.com/vi/vJYL4Osyipc/default.jpg","False","False","Joe Biden (Jim Carrey) and Donald Trump (Alec Baldwin) give speeches after the conclusion of the 2020 presidential election.Saturday Night Live.  Stream now on Peacock: https://bit.ly/3j1IRUkSubscribe to SNL: https://goo.gl/tUsXwMStream Current Full Episodes: http://www.nbc.com/saturday-night-live WATCH PAST SNL SEASONSGoogle Play - http://bit.ly/SNLGooglePlayiTunes - http://bit.ly/SNLiTunes SNL ON SOCIALSNL Instagram: http://instagram.com/nbcsnlSNL Facebook: https://www.facebook.com/snlSNL Twitter: https://twitter.com/nbcsnlSNL Tumblr: http://nbcsnl.tumblr.com/SNL Pinterest: http://www.pinterest.com/nbcsnl/ GET MORE NBCLike NBC: http://Facebook.com/NBCFollow NBC: http://Twitter.com/NBCNBC Tumblr: http://NBCtv.tumblr.com/YouTube: http://www.youtube.com/nbcNBC Instagram: http://instagram.com/nbc #SNL #DaveChappelle #FooFighters #SNL46"
"E1KkQrFEl2I","How Large Can a Bacteria get? Life & Size 3","2020-11-10T15:00:26Z","UCsXVk37bltHxD1rDPwtNM8Q","Kurzgesagt – In a Nutshell","27","PT11M5S","2d","hd","True","2020-11-10T18:59:06Z","[none]","1348637","123237","939","5838","https://i.ytimg.com/vi/E1KkQrFEl2I/default.jpg","False","False","The first 1000 people to use this link will get a free trial of Skillshare: https://skl.sh/kurzgesagt9Get our new beautiful Ocean Explorer Notebook:https://shop.kurzgesagt.org/Sources & further reading: https://sites.google.com/view/sourceslifeandsize3 In and out, in and out. Staying alive is about doing things. This very second, your cells are combusting glucose molecules with oxygen to make energy available, which keeps you alive for another precious moment. To get the oxygen to your cells you are breathing.Breathing is an answer to a very hard problem: How do you get the resources that your cells need to survive, from the outside, to the inside of your cells? Every living thing has to solve this problem and the solution is surprisingly different depending on one of the most important regulators of life: Size.OUR CHANNELS▀▀▀▀▀▀▀▀▀▀▀▀▀▀▀▀▀▀▀▀▀▀▀▀▀▀German Channel: https://kgs.link/youtubeDESpanish Channel: https://kgs.link/youtubeESHOW CAN YOU SUPPORT US?▀▀▀▀▀▀▀▀▀▀▀▀▀▀▀▀▀▀▀▀▀▀▀▀▀▀This is how we make our living and it would be a pleasure if you support us!Get Merch designed with ❤ from https://kgs.link/shop  Join the Patreon Bird Army 🐧 https://kgs.link/patreon  DISCUSSIONS & SOCIAL MEDIA▀▀▀▀▀▀▀▀▀▀▀▀▀▀▀▀▀▀▀▀▀▀▀▀▀▀Reddit:            https://kgs.link/redditInstagram:     https://kgs.link/instagramTwitter:           https://kgs.link/twitterFacebook:      https://kgs.link/facebookDiscord:          https://kgs.link/discordNewsletter:    https://kgs.link/newsletterOUR VOICE▀▀▀▀▀▀▀▀▀▀▀▀▀▀▀▀▀▀▀▀▀▀▀▀▀▀The Kurzgesagt voice is from Steve Taylor:  https://kgs.link/youtube-voiceOUR MUSIC ♬♪▀▀▀▀▀▀▀▀▀▀▀▀▀▀▀▀▀▀▀▀▀▀▀▀▀▀700+ minutes of Kurzgesagt Soundtracks by Epic Mountain:Spotify:            https://kgs.link/music-spotifySoundcloud:   https://kgs.link/music-soundcloudBandcamp:     https://kgs.link/music-bandcampYoutube:          https://kgs.link/music-youtubeFacebook:       https://kgs.link/music-facebookThe Soundtrack of this video:Soundcloud:   https://bit.ly/36hTooOBandcamp:     https://bit.ly/38jHFJb 🐦🐧🐤 PATREON BIRD ARMY 🐤🐧🐦▀▀▀▀▀▀▀▀▀▀▀▀▀▀▀▀▀▀▀▀▀▀▀▀▀▀Many Thanks to our wonderful Patreons from http://kgs.link/patreon who support us every month and made this video possible:Vincent Mascio, Gabriel Sucia, Артем Ярошенко, Thomas Hradek, Nebual, Rodrigo Espinosa, Jacobo Loewen, Kirsten Mann, Matias Altalef, Renato Vassão, triger traiger, Richard Decal, SmokinBuddha, R D, William Lucca, John Teeslink, Yrjosmiel, Tomasz Stachowiak, WE1RD, ScorchedShadow, Zach Knibbs, jrinehimer, Michael, Conner Boltz, Sidong Fu, Jake Kish, Caeruleus, Gleb Radchenko, Kieren Quinn, Augustine, Che Tao, Biken Gurung, Adelina Bakieva, Alex Ellis, Trevor Shackelford, Graham Gersdorff, Aditya Taday, Chaitali Sura, Rhys Clark, Trymian Cassidy, Anton Vietrov, Samuel Blanchard, libor riska, Julia VS, Stoney Bair, Nika Chkhartishvili, Erwin Ritua, Nicholas Roth, Mark Pickenheim, Haaxor1689, Niklas, Sean K Reynolds, Mark Gubatan, Caleb Biasco, MoeMoep, Edmund Sang Fontaine, Silquetoast, Randy Cully, Joseph Schadler, Matt Cameron, x yxy, Elie & Mary-Anne, Alaina Kramer, Memes, Dragon's Demize, Caleb Whitaker, KushrenadaT, Andrei, Daniel Suzuki, Jett Thomas, Laszlo Steinhoff, Alexander Brown, Braden Culbert, Sarah, Corey Austen, Gosia Rychlik, Евген Останинов, Neo Martin, Anonimas, Nicolas Sepulveda, Nicole de Vries, Maryam Sheybanifard, John Forbes, ertojo, Zaten the Changeling, Dmytro Haranzha, Matt Clarkson, G Crockett, Brennen Schott, Mirek Novak, Pedro Lozano, Oskar Syahbana, Robin, Porky Hontas, Sebastien J, Eileen Kirschner, Peyton Groshart, Martin, Jan Ryklikas, Dr. Daniel Lehmann, Le plus Luc de tous les Luc, yeapea [Andi], Ansgar Rust, Jan Karsten, Hichem Moussa VoulezVouloz, Morbeyn, Sjoerd Smit, Julian Hiorns, The Wanton Dogfish, Alice Whiteway, Jordan Lake, Whitney Warren, Moses Holmström, Morgan"
"3lzuoTarQjs","Jon Rahm skips to a hole-in-one on No. 16 | Masters Tuesday","2020-11-10T18:33:05Z","UCSZxaHGo1OEs06vQumIooug","The Masters","17","PT49S","2d","hd","True","2020-11-10T18:59:06Z","Masters|Tournament|Golf|Augusta|National|Club","337685","4215","85","320","https://i.ytimg.com/vi/3lzuoTarQjs/default.jpg","False","False","From pond to pin! Jon Rahm skips to a hole-in-one on No. 16 on Tuesday at the Masters.--- Stay updated on complete coverage of the 84th Masters Tournament: Visit Masters.com for comprehensive news, live video, scoring and more.Follow @themasters on Instagram: https://www.instagram.com/themasters/Follow @TheMasters on Twitter: https://twitter.com/themastersFollow @TheMasters on Facebook: https://www.facebook.com/TheMasters/Download the official Masters app for iPhone and iPad: https://apps.apple.com/us/app/the-masters-tournament/id309025938Download the official Masters app for Android phone and tablet: https://play.google.com/store/apps/details?id=com.ibm.events.android.masters ---Access additional content:Subscribe to The Masters daily email newsletter: https://www.masters.com/en_US/newsletter/index.htmlFollow the official Masters Podcast, “Fore Please! Now Driving…”: https://www.masters.com/en_US/news/articles/2020-11-02/2020-11-02_the_official_masters_podcast_2020.html ---How to Watch the Masters Tournament (all times Eastern):TV:Round 1 - Thursday, Nov. 12: Live, 1-5:30 p.m., ESPN.Round 2 - Friday, Nov. 13: Live, 1-5:30 p.m., ESPN.Round 3 - Saturday, Nov. 14: 1-5 p.m., CBS.Final Round - Sunday, Nov. 15: 10 a.m.-3 p.m., CBS.Masters.com & official Masters app:Round 1 - Thursday, Nov. 12: Live, 1-5:30 p.m.Round 2 - Friday, Nov. 13: Live, 1-5:30 p.m.Round 3 - Saturday, Nov. 14: 1-5 p.m.Final Round - Sunday, Nov. 15: 10 a.m.-3 p.m."
"uLRZoJa9elg","Thank You For Everything, Alex | JEOPARDY!","2020-11-10T01:00:05Z","UCnxxhf9PSA3VJ4Q80pWJoow","Jeopardy!","24","PT1M7S","2d","hd","True","2020-11-10T18:59:06Z","Alex Trebek (TV Personality)|double jeopardy!|exclusive jeopardy|Jeopardy questions|think music|Jeopardy! best moments|tv program|Merv Griffin|Official Jeopardy!|let's play|Game Show (TV Genre)|reality games|play jeopardy|Jeopardy! (TV Program)|jeopardy!","657217","28397","281","2073","https://i.ytimg.com/vi/uLRZoJa9elg/default.jpg","False","False","Today we honor Alex Trebek. For over three decades he brought integrity, humor and intelligence to his duties as host of Jeopardy! He will be in our hearts forever.Thank you, Alex. Love from us all. 💜Thank you, Alex: Cold Open 11/09/2020 from Mike Richards, executive producer of Jeopardy!Subscribe to Jeopardy! for exclusive content: http://bit.ly/JSubscribe_YT The official home for video from Jeopardy! and Jeopardy.com. Subscribe for the best-of-Jeopardy! moments, big wins, great gameplay, behind-the-scenes snippets, and (of course!) Alex Trebek. Want to be on the show? It all starts with the Jeopardy! Anytime Test! Take the Jeopardy! Test here: http://bit.ly/Jeopardy-TestConnect with Jeopardy!:Facebook: http://bit.ly/2AuJ6kX Twitter: http://bit.ly/2kjdBq8 Instagram: http://bit.ly/2AKTpnq Website: https://www.jeopardy.com/#Jeopardy! #AlexTrebek More Jeopardy!:Find Your Station: http://bit.ly/2BIOtxc Play J!6: http://bit.ly/2AtJVdTPlay Jeopardy! World Tour on Google Play: https://t.co/J2P6b0JLdT Play Jeopardy! World Tour on iTunes: http://apple.co/2ASWeU1Play Jeopardy! on Drivetime: http://bit.ly/Download-Drivetime"
"j2gOU4o1jsQ","THE GREATEST AMONG US CROSSOVER OF ALL TIME (Logic, Dream, PewDiePie, Mr Beast)","2020-11-08T23:25:24Z","UCFNTq9XKHDNy_1-2lL0kqCg","Corpse Husband","24","PT32M35S","2d","hd","True","2020-11-10T18:59:06Z","Among Us|CORPSE Among Us|among us corpse|funny among us|best among us|among us funny moments|among us gameplay|among us imposter|among us IQ|among us best|pewdiepie among us|jacksepticeye among us|disguised toast among us|sykkuno among us|valkyrae among us|dream among us|logic among us|mrbeast among us","5165784","350569","3358","15455","https://i.ytimg.com/vi/j2gOU4o1jsQ/default.jpg","False","False","And it was beautifulListen 2 my new song: https://www.youtube.com/watch?v=ra-XCs6LHAMPewDiePie: http://www.youtube.com/pewdiepieJacksepticeye: https://www.youtube.com/jacksepticeyeLogic: https://www.twitch.tv/logicMrBeast: https://www.youtube.com/user/MrBeast6000Sykkuno: https://www.twitch.tv/sykkunoToast: https://www.youtube.com/channel/UCUT8RoNBTJvwW1iErP6-b-AValkyrae: https://www.youtube.com/channel/UCWxlUwW9BgGISaakjGM37awDream: https://www.youtube.com/user/DreamTrapsRhymestyle: https://www.youtube.com/rhymestylePokimane: https://www.twitch.tv/pokimaneEdited by: https://twitter.com/nogooddavisThumbnail by: https://twitter.com/chryseuswitch"
"vzD1lZvrOpU","Surprise Pregnancy Announcement to Husband","2020-11-10T16:24:14Z","UCpbnSmsoOMbEyiBVgypT3jg","farahdhukai","26","PT8M7S","2d","hd","True","2020-11-10T18:59:06Z","farah dhukai|sal ali|pregnancy|pregnancy announcement|telling my husband i'm pregnant|pregnancy announcement to husband|infertility journey|pregnancy reveal|pregnancy reveal to husband|surprise pregnancy announcement to husband|pregnant reveals|husband reaction to pregnancy|farsali","462203","47573","178","3089","https://i.ytimg.com/vi/vzD1lZvrOpU/default.jpg","False","False","This was my husband's reaction to finding out that I was pregnant. I had to keep him guessing, because he's good at figuring things out... so I took him on an emotional roller coaster ride.Finding Out I'm Pregnant: https://youtu.be/-jSrpBVbtCs9 Year Anniversary Surprise: https://youtu.be/M4gbC47pAWkForest Picnic Surprise: https://youtu.be/YIGq1GBWLNEFollow us on Instagram:FARAH: http://www.instagram.com/farahdhukaiSAL: http://www.instagram.com/lifeofsal"
"hLQGsWA6ST8","I tried to beat Minecraft with CallMeCarson","2020-11-08T19:03:22Z","UCGwu0nbY2wSkW8N-cghnLpA","Jaiden Animations","1","PT18M3S","2d","hd","True","2020-11-10T18:59:06Z","jaiden|animations|jaidenanimation|jaidenanimations|Minecraft|Minecraft jaiden animation|Minecraft jaidenanimation|CallMeCarson","6138134","526780","3017","54320","https://i.ytimg.com/vi/hLQGsWA6ST8/default.jpg","False","False","very equal team, no anchors hereCarson's video! https://youtu.be/VRimnuj_I-8Carson's channel! https://www.youtube.com/user/TheBlueCrewPros♥ The Team ♥Atrox: https://twitter.com/AtroxChobatsuDavidBaronArt: https://twitter.com/DavidBaronArtDee Helm: https://twitter.com/DeeRedHelmDenny: https://twitter.com/90PercentDennyDevon: https://www.instagram.com/devonkong/Duckdee: https://twitter.com/duckdeeArtJaystarz: https://www.youtube.com/xjaystarzxJRFMotiny: https://www.youtube.com/channel/UCHimPYk1csmmOSGKF4pKelgPivots: https://www.youtube.com/user/ThePivotsXXD------------------------------------------------------------------------------------SUBSCRIBE for more animations!https://www.youtube.com/c/jaidenMERCH:https://jaidenanimations.com/TWITTER:https://twitter.com/JaidenAnimationINSTAGRAM:https://instagram.com/jaiden_animationsIf you're an animator, artist, gamer, or entertainer, then join us at Channel Frederator Network: https://frdr.us/JaidenWanna Send Fanart?You can send it to me through Twitter or Instagram (links above)------------------------------------------------------------------------------------Music:Heartwarming- Pokemon Mystery DungeonGuildmaster Wigglytuff- Pokemon Mystery DungeonDriftveil City- Pokemon Black/WhiteChampion Cynthia Battle- Pokemon Black/White------------------------------------------------------------------------------------minecraft amirite"
"-isY3iRyF-8","First Look: 90 Day Fiancé Season 8!","2020-11-10T18:00:01Z","UCgIWIkGWCV9knhMvK3Q8usA","90 Day Fiancé","24","PT3M18S","2d","hd","True","2020-11-10T18:59:06Z","tlc|tlc shows|tlc full episodes|90 Day Fiancé|reality tv series|foreign love|international dating|marriage tv show|green card marriage|visa|90 day fiance|90 day fiance clips|90 day fiance videos|90 day fiance full episodes|before the 90 days|the other way|happily ever after|just landed|darcey & stacey|the family chantel|pillow talk","173581","3229","76","723","https://i.ytimg.com/vi/-isY3iRyF-8/default.jpg","False","False","90 Day Fiancé season 8 premieres Sunday, December 6 at 8PM ET/PT!Stream Full Episodes of 90 Day Fiancé:https://www.tlc.com/tv-shows/90-day-fiance/Subscribe to 90 Day Fiancé:https://bit.ly/Subscribe90DayFianceJoin Us on Facebook:https://www.facebook.com/90DayFiance/Follow Us on Twitter:https://twitter.com/90DayFianceWe're on Instagram!https://instagram.com/90DayFiance"
"6qREk4UcxQU","SKATEBOARDING WITH TONY HAWK!!! | Addison Rae","2020-11-09T18:57:37Z","UCsjVdwXJydmlSLVT2zDuwpQ","Addison Rae","22","PT8M21S","2d","hd","True","2020-11-10T18:59:06Z","skateboarding|tonyhawk","984241","70813","1504","4624","https://i.ytimg.com/vi/6qREk4UcxQU/default.jpg","False","False","Check out Tony’s foundation, The Skatepark Project!  https://skatepark.org/about/ Shop ITEM Beauty!!!https://www.itembeauty.com/  Subscribe to me: https://www.youtube.com/channel/UCsjVdwXJydmlSLVT2zDuwpQ Follow me: TikTok: https://www.tiktok.com/@addisonre?lang=enInstagram: https://www.instagram.com/addisonraee/?hl=enTwitter: https://twitter.com/whoisaddison Merch:https://shopaddisonrae.com/"
"OgQcWwBoI6Y","Behind the Scenes of My Leopard Collection Video Shoot","2020-11-10T01:47:31Z","UCWkYXtnAuu7VTLPwUcRSB6A","Kylie Jenner","22","PT7M18S","2d","hd","True","2020-11-10T18:59:06Z","[none]","1162517","0","0","2743","https://i.ytimg.com/vi/OgQcWwBoI6Y/default.jpg","False","True","Come behind the scenes with me on the set of my new leopard collection video shoot."
"fL0my9B3PnA","WE'RE MOVING! packing up the old house... (moving ep. 1) | Nicole Laeno","2020-11-10T15:00:38Z","UCr1nLIQFpNV5DxD22qxGsyQ","Nicole Laeno","26","PT17M14S","2d","sd","True","2020-11-10T18:59:06Z","[none]","278832","36901","175","0","https://i.ytimg.com/vi/fL0my9B3PnA/default.jpg","True","False","SURPRISE! WE’RE MOVINGcan’t wait to take you guys along during this new journey. feeling so grateful for all the blessings in my life, including all of you. stay tuned for more episodes!✰ SOCIALS ✰instagram: @nicolelaenosnapchat: @nicolelaenotwitter: @nicolelaenotik tok: @nicolelaenospotify: nicole laeno✰ BUSINESS EMAIL ✰lindalaeno@yahoo.com✰ MUSIC ✰carter vail - love-15 https://thmatc.co/?l=AFF19F4Fmark generous - meet me at the ferris wheel https://thmatc.co/?l=10888103mark generous - i still love you https://thmatc.co/?l=83D1343Emark generous - meganne https://thmatc.co/?l=B0F46BB6ninjoi - acceptance https://thmatc.co/?l=B8A06B0ninjoi - purple rain https://thmatc.co/?l=3D88D17Aninjoi - where do i go https://thmatc.co/?l=E372558A✰ FAQ ✰how old are you? → 14what grade are you in? → 9thethnicity? → filipino + vietnamesecameras? → canon m50 + canon g7xediting software? → final cut pro xsub count: 969kstay positive!xoxo, nicole"
