video_id,title,publishedAt,channelId,channelTitle,categoryId,duration,dimension,definition,is_trending,time_retrieved,tags,view_count,likes,dislikes,comment_count,thumbnail_link,comments_disabled,ratings_disabled,description
"ScwflrlPH_4","I'm Pregnant!!","2020-11-07T16:15:03Z","UCeBnbqt4VRhotq2TQjkIi2A","LaurenzSide","22","PT18M16S","2d","hd","True","2020-11-10T18:59:06Z","laurenzside|Laurenzside of Gaming|funny girl gamer|pregnant|pregnancy|pregnancy announcement|surprise|big announcement|i'm pregnant|we're pregnant|finding out i'm pregnant|having a baby|announcement","3364365","322320","3245","173444","https://i.ytimg.com/vi/ScwflrlPH_4/default.jpg","False","False","SURPRISE! I'm Pregnant!! We're so excited to finally be able to share the news with you all! Watch the whole video before you start asking questions in the comments because we most likely answered it in the video!Things I referenced in the video:My Twitch (will be streaming at 3PM EST today to chat): http://www.twitch.tv/laurenzsideMy Instagram: http://instagram.com/laurenzsideMy Twitter: https://twitter.com/LaurenzSideVlog 2nd Channel: https://www.youtube.com/laurenzothersidezLive Highlights Channel: https://www.youtube.com/LaurenzLIVEsideMERCH ► https://shop.3blackdot.com/collections/lauren-z-sideBECOME A CHANNEL MEMBER HERE ► https://www.youtube.com/channel/UCeBnbqt4VRhotq2TQjkIi2A/joinSUBSCRIBE HERE ► (http://bit.ly/10uru1W) Become a Z-Sider!LIKE, SHARE, and/or FAVORITE this Video if You Enjoyed it!It Really Helps Me Out!! Thanks for Watching!! ❤----------------------------------------­-----------------------------------My Gaming Chair:http://www.needforseatusa.com/Use code ZSIDE for free shippingMy Headset & Mouse: http://steelseries.7eer.net/c/193844/181780/2390----------------------------------------­-----------------------------------Follow Me Everywhere Else!! ❤TIK TOK: https://www.tiktok.com/@laurenzsideytFACEBOOK: https://www.facebook.com/LaurenzsideDISCORD: https://discordapp.com/invite/Uk3q2T6"
"5b_lIKhvThM","芋头的一生，辣椒…是送的The life of taro…and pepper is today’s treat丨Liziqi Channel","2020-11-08T13:21:14Z","UCoC47do520os_4DBMEFGg4A","李子柒 Liziqi","26","PT19M59S","2d","hd","True","2020-11-10T18:59:06Z","liziqi|liziqi vlogger|中國美食|中華傳統文化|Chinese food|饮食文化|中国风|田园|美食|ly tu that|李子柒|lý tử thất|李子柒最新|李子柒更新|李子柒 红薯|红薯 芋头|红糖芋圆蛋|烤芋儿|芋儿鸡|李子柒 花","4020313","195958","2982","12075","https://i.ytimg.com/vi/5b_lIKhvThM/default.jpg","False","False","Please  subscribe to 【李子柒 Liziqi 】Liziqi Channel on YouTube if you like my videos: https://goo.gl/nkjpSx #李子柒#Liziqi#ChineseCuisine #ChineseFood小时候我爷爷教过一句让我很疑惑的顺口溜：“红薯芋头本姓张，煮的没有烧的香”…虽然到现在也想不明白为啥一定要姓“张”但一点也不妨碍我爱吃它！年初在前院大门口种了几排毛芋儿后门那多种了香芋，刚好也到了能下嘴的季节。芋儿鸡、烤芋儿、红糖芋圆蛋…你们呢？最喜欢怎么吃芋头啊？When I was little, grandpa taught me a rather puzzling jingle: “Sweet potato and taro are surnamed Zhang, better roasted than boiled for long.” Even today I still haven’t figured out why on earth they had anything to do with the surname Zhang, but I love them anyway! At the beginning of the year, several rows of taro were planted at the gate of the front yard, and water yam at the back door. Now it’s just the time to feast on them. Taro with chicken stew, roasted taro, eggs with taro balls in brown sugar…And you? How do you like your taro best? 【李子柒 Liziqi 】 https://goo.gl/nkjpSx--------------------------------------------------------------------liziqi李子柒更多精彩视频推荐/More wonderful video recommendations：liziqi李子柒精选视频/decent video selection：https://is.gd/qe9xuc李子柒●花开有声 | Soud of blooming flowers： https://is.gd/tyr1ja李子柒 ●饮食以节 | Chinese festival food： https://is.gd/3LsFnu李子柒 ●适时而食 | Seasonal diet： https://is.gd/JmLJH3东方非遗传承 | Oriental intangible cultural heritage ： https://is.gd/atatyo传统工艺 | Traditional handicraft： https://is.gd/FPl4dfSpring 春之卷：https://is.gd/EBwo2nSummer 夏之卷：https://is.gd/i1jJ46Autumn 秋之卷：https://is.gd/YBVeL2Winter 冬之卷：https://is.gd/3JqW8D#李子柒 #liziqi"
"7-h8qMTWufk","Whatever You Make With Macaroni, I'll Pay For | ZHC Crafts","2020-11-08T02:09:32Z","UCPAk4rqVIwg1NCXh61VJxbg","ZHC Crafts","26","PT8M37S","2d","hd","True","2020-11-10T18:59:06Z","[none]","1422417","45675","1530","4161","https://i.ytimg.com/vi/7-h8qMTWufk/default.jpg","False","False","Whatever You Make With Macaroni, I'll Pay For | ZHC CraftsSubscribe To Help Fund ZHC's Expensive Videos  @ZHC  Follow The TeamIG - @zhcomicartIG - @munchie.michelleIG - @itsviveeIG - @leomahaloIG - @zhccrafts"
"DVIjMW0-770","NoCap - Free Draco (Official Audio)","2020-11-08T02:05:23Z","UCvfat4DPrM3BM-xZ2zn5ruQ","NoCap","10","PT3M2S","2d","hd","True","2020-11-10T18:59:06Z","[none]","377057","25264","229","1341","https://i.ytimg.com/vi/DVIjMW0-770/default.jpg","False","False",""
"Am1lDj2mUVY","I Let The Instagram Shop Tab Pick My Outfits","2020-11-07T05:07:41Z","UCbAwSkqJ1W_Eg7wr3cp5BUA","Safiya Nygaard","22","PT38M40S","2d","hd","True","2020-11-10T18:59:07Z","i let the instagram shop tab pick my outfits|the instagram shop tab|internet haul|instagram ads|buying an outfit from instagram ads|i bought 3 outfits from the instagram shop tab|i let instagram pick my outfits|safiya instagram|safiya internet made me buy it|safiya|safia|safiya nygaard|safiya and tyler|instagram shop tab|instagram|instagram shop","3542707","208321","2639","16495","https://i.ytimg.com/vi/Am1lDj2mUVY/default.jpg","False","False","You can download Honey for FREE today! ▸ http://joinhoney.com/safiya Honey finds coupons with the click of a button. A big thank you to Honey for sponsoring today's video!Hello friends! Today, I return to the land of internet hauls and social media targeted recommendations - with a deep dive into the Instagram shop tab! Previously, I have bought things recommended to me via targeted ads on Facebook, Instagram, YouTube, and Snapchat - and when the shop tab was rolled out - peeking its lil head out from behind the explore page - I was instantly intrigued. So I spent an evening perusing the shop tab, finding 3 different common themes of what Instagram wanted me to buy, and then purchasing those things, and trying them out. It was a WILD ride, as Instagram recommended me everything from full-on historical costumes to trendy e-girl fashion. Which outfit was your favorite? What's on your shop tab?Safiya's Instagram: https://www.instagram.com/safiyany/MUSICVia AudioNetwork"
"BmzFSKGwx54","Mike WiLL Made-It - What That Speed Bout?! (feat. Nicki Minaj & YoungBoy Never Broke Again)","2020-11-06T05:00:02Z","UCVF2-EboCFl1f05Oq2z3SMQ","Mike Will","22","PT3M31S","2d","hd","True","2020-11-10T18:59:07Z","Mike WiLL Made-It|Mike Will Made It|Mike Will|Mike WiLL Made-It What That Speed Bout?!|What That Speed Bout?!|Mike WiLL Made-It What That Speed Bout?! Nicki Minaj YoungBoy Never Broke Again|Producer|Atlantic|Atlantic Records|Hip Hop|Rap|Ear Drummer|Black Beatles|Nicki Minaj|YoungBoy Never Broke Again|NBA YoungBoy|YoungBoy NBA|Mike Will Nicki YoungBoy|Mike Will YoungBoy NBA|Mike Will Nicki Minaj|What That Speed Bout|Mike WiLL Made-It What That Speed Bout","8546662","417793","11724","34529","https://i.ytimg.com/vi/BmzFSKGwx54/default.jpg","False","False","Mike WiLL Made-It - What That Speed Bout?! (feat. Nicki Minaj & YoungBoy Never Broke Again)Stream/Download: http://mikewillmadeit.lnk.to/WhatThatSpeedBoutID Directed by: Edgar Esteves & Austin McCrakenCommissioner: Joseph BoydProducer: Andres GarciaEditor: Joan Pabon  Follow Mike WiLL Made-It:https://www.instagram.com/MikeWiLLMad...https://www.facebook.com/MikeWillMadeIthttps://www.twitter.com/MikeWiLLMadeIt#MikeWiLLMadeIt #WhatTheSpeedBout #OfficialMusicVideo #NickiMinaj #YoungBoyNeverBrokeAgain"
"H3lpFE19T78","'We did it, Joe!': Kamala Harris calls president-elect Biden to celebrate election victory","2020-11-07T17:44:32Z","UCIRYBXDze5krPDzAEOxFGVA","Guardian News","25","PT16S","2d","hd","True","2020-11-10T18:59:07Z","us|politics|us election 2020|kamala harris|joe biden|harris calls biden|harris phones biden|harris biden phonecall|harris biden call|kamala harris joe biden phone call|call|phone call|you did joe|you're president|president biden|president|biden wins|biden 2020|biden victory|trump loser|trump loses|trump|donald trump|2020|guardian|kamala harris calls joe biden|joe biden phone call|winner|winning|biden harris call|we did it joe|trump out|trump fired","864411","12256","6109","3273","https://i.ytimg.com/vi/H3lpFE19T78/default.jpg","False","False","Kamala Harris shared a video of her calling to congratulate Joe Biden after the US presidential election was called for the Democratic candidate. 'We did it Joe,' Harris says, while apparently out on a walk with her husband. 'You're going to be the next president of the United States.'Subscribe to Guardian News on YouTube ► http://bit.ly/guardianwiressubJoe Biden beats Donald Trump to win 2020 US election – live updates ► https://www.theguardian.com/us-news/live/2020/nov/06/us-election-joe-biden-donald-trump-result-latest-who-is-winning-live-2020-updates?page=with:block-5fa6cfa88f083df739ba61c1#block-5fa6cfa88f083df739ba61c1Support the Guardian ► https://support.theguardian.com/contributeToday in Focus podcast ► https://www.theguardian.com/news/series/todayinfocusThe Guardian YouTube network:The Guardian ► http://www.youtube.com/theguardianGuardian Football ► http://is.gd/guardianfootballGuardian Sport ► http://bit.ly/GDNsportGuardian Culture ► http://is.gd/guardianculture"
"4fDnjA7GNtc","AMONG US, but with 1001 PLAYERS","2020-11-06T22:44:38Z","UClarhNTgYk5wuztsunOx2Cw","The Pixel Kingdom","20","PT3M23S","2d","hd","True","2020-11-10T18:59:07Z","Among us|1001 players|animation|funny|hack|cheat|victory|impostor|pet|bedcrab","14373073","387485","11681","17495","https://i.ytimg.com/vi/4fDnjA7GNtc/default.jpg","False","False","Love is the one thing that transcends time and space. lul. 🌠🎵 Featured Music: CG5 - Show Yourselfhttps://www.youtube.com/watch?v=6yvfU8xK_VQ🥳 Thank you so much Charlie! Keep up the great work!👑 Play Among Us: http://www.innersloth.com/Don't reupload! 🚨 Thanks! 🥰Actually 359 Players (in the cafeteria). 🤥The idea was to add 1001 players this time, but then you wouldn't have been able to read the usernames of the individual players. Since this was more important to me, I changed the amount of players. Almost all usernames are your submissions! Thank you! 🥰For the first time I measured the time It took me to animate this video.I was curious, because I quickly underestimate the sense of time.So this one took me 75 hours (without audio). 😲It took me 62 hours to beat Dark Souls 1and 86,2 hours to beat The Witcher 3.Thanks for reading, have a nice day! 😁✌️Oh.. and Ping: 1100101 - /watch?v=hXkY_ETVf7Q"
"kUok7mvWgjk","PS5 & Xbox Series X Unboxing! (it's my birthday..)","2020-11-08T18:17:11Z","UCS5Oz6CHmeoF7vSad0qqXfw","DanTDM","20","PT12M7S","2d","hd","True","2020-11-10T18:59:07Z","dantdm|dan tdm|gaming|ps5|xbox series x|unboxing","1853009","296194","2015","93710","https://i.ytimg.com/vi/kUok7mvWgjk/default.jpg","False","False","sub pls : http://bit.ly/TxtGm8Twitch : http://www.twitch.tv/dantdmNEW MERCH : http://www.dantdmshop.comFollow Me : 🐦 http://www.twitter.com/DanTDM 📷 http://www.instagram.com/DanTDMUnboxing starts: 0:00PS5 Unboxing: 1:13Xbox Series X Unboxing: 4:32Comparison: 8:25Massive thanks to Playstation and Xbox for sending these to me."
"yjetoy-RKQ8","[PREVIEW] BTS (방탄소년단) '2021 SEASON’S GREETINGS' SPOT (BTS GOES RETRO)","2020-11-09T15:00:00Z","UCLkAepWjdylmXSltofFvsYQ","BANGTANTV","10","PT1M45S","2d","hd","True","2020-11-10T18:59:07Z","방탄소년단|BTS|BANGTAN|HIPHOP|알엠|RM|슈가|SUGA|제이홉|jhope|지민|JIMIN|뷔|정국|JUNGKOOK|진|JIN","4677707","1315828","4500","73015","https://i.ytimg.com/vi/yjetoy-RKQ8/default.jpg","False","False","Connect with BTS: https://ibighit.com/bts http://twitter.com/BTS_bighithttp://twitter.com/BTS_twt http://www.facebook.com/bangtan.official https://www.youtube.com/user/BANGTANTV http://instagram.com/BTS.bighitofficial https://channels.vlive.tv/FE619 https://www.tiktok.com/@bts_official_bighithttps://weverse.onelink.me/qt3S/94808190https://www.weibo.com/BTSbighithttps://www.weibo.com/BTSmembers http://i.youku.com/btsofficial http://btsblog.ibighit.com"
"CrsOl5EW740","Donald Trump poses with bride at golf course after losing election to Joe Biden","2020-11-07T21:35:42Z","UCshwRhftzkiov5wKR7M_LsQ","The Independent","25","PT1M46S","2d","hd","True","2020-11-10T18:59:07Z","donald trump|joe biden|us election|2020 election","570801","4586","2272","3746","https://i.ytimg.com/vi/CrsOl5EW740/default.jpg","False","False","Donald Trump posed with a bride at his Virginia golf club on Saturday shortly after it was declared that he had lost the presidential election.The president got off his golf cart and stood for a photo with the wedding party, saying afterwards, “Have a great life”. He did not offer any comment on the election result.The president has refused to concede the election despite being soundly beaten by Joe Biden once Pennsylvania — and its 20 electoral college votes — was called for the Democrat on Saturday morning.Read the full story: https://www.independent.co.uk/news/world/americas/us-election-2020/trump-golf-biden-election-lose-b1678731.htmlLike us on Facebook: https://www.facebook.com/TheIndependentOnlineFollow us on Twitter: https://twitter.com/IndependentFollow us on Instagram: https://www.instagram.com/the.independentSubscribe to Independent Premium for exclusive content and live events: https://bit.ly/2MiOONB"
"zI26PQY5BrQ","Der Klassiker THRILLER! Lewandowski & Bayern Munich down Dortmund | ESPN FC Bundesliga Highlights","2020-11-07T19:35:01Z","UC6c1z7bA__85CIWZ_jpCK-Q","ESPN FC","17","PT8M6S","2d","hd","True","2020-11-10T18:59:07Z","Der Klassiker|Bayern Munich vs. Borussia Dortmund|Bayern Dortmund|Bayern Munich|Bayern|Robert Lewandowski|Lewandowski|Robert Lewandowski goals|Der Klassiker highlights|Bundesliga|David Alaba|Erling Haaland|Giovanni Reyna|Gio Reyna|Haaland|Hansi Flick|Marco Reus|Reus Dortmund|Marco Reus goal|Lewy|Der Klassiker today|Der Klassiker goals|Joshua Kimmich|Jude Bellingham|Soccer|Germany|Leroy Sane|Leroy Sane goal|Erling Haaland goal|Haaland goals","346203","4428","91","731","https://i.ytimg.com/vi/zI26PQY5BrQ/default.jpg","False","False","It's a Der Klassiker thriller to say the least! Robert Lewandowski appeared to give Bayern Munich the lead early, but VAR chalked off his goal. Dortmund took the lead through Marco Reus' calm finish, but it was David Alaba who's thunderous free kick quickly brought Hansi Flick's side level. Lewandowski's glancing header to start the second half restored Bayern's lead and Manuel Neuer was able to keep out Erling Haaland, Marco Reus and Giovanni Reyna on numerous occasions. Leroy Sane and Haaland exchange late goals, but it was Bayern who prevail to a 3-2 thrilling win against rivals Dortmund.#ESPNFC #Bundesliga #BayernMunich #BorussiaDortmund✔ Subscribe to ESPN+: http://espnplus.com/soccer/youtube✔ Subscribe to ESPN FC on YouTube: http://bit.ly/SUBSCRIBEtoESPNFC"
"vlk1z44sF18","Assassin's Creed Valhalla Review","2020-11-09T11:00:25Z","UCKy1dAqELo0zrOtPkf0eTMw","IGN","20","PT9M1S","2d","hd","True","2020-11-10T18:59:07Z","IGN|Xbox|Review|Action|Ubisoft|Adventure|Ubisoft Montreal|Assassin's Creed Valhalla|valhalla review|ac valhalla review|ac valhalla|assassin's creed valhalla|game review|assassin's creed review|assassin's creed","1129580","26790","1720","4260","https://i.ytimg.com/vi/vlk1z44sF18/default.jpg","False","False","Assassin's Creed Valhalla recreates the brutal, darker tones of the Viking way of life as you embark on adventure across a massive, stunningly beautiful open-world."
"crPL2Yniurw","Trying the Best Tik Tok TREND Filters","2020-11-07T20:30:01Z","UC6IijBsVf2PlWo_uq6P9wQw","Gloom","24","PT11M56S","2d","hd","True","2020-11-10T18:59:07Z","tiktok|gloom|gloomykassie|kassie|2020|tik tok|timewarp|time warp|time warp scan|time warp tiktok effect|time warp scan tiktok|tiktok scanner filter|tik tok 2020|tiktok memes|reacting to tiktok memes|best tiktok memes|tiktok compilation|tik tok mashup|freeze filters|best tiktok|best tik tok|tiktok challenge|challenge|trend|trends|trending","1160128","60541","747","4287","https://i.ytimg.com/vi/crPL2Yniurw/default.jpg","False","False","Here we go again. You loved the Freeze Filters. This time we're doing Timewarp/Freeze, Among Us, Anime, Harry Potter, did I forget one? I dunno. Hope you like it!SUBSCRIBE HERE: https://www.youtube.com/channel/UC6IijBsVf2PlWo_uq6P9wQw?sub_confirmation=1My INSTAGRAM: http://www.instagram.com/gloomykassieMy TWITTER: http://www.twitter.com/gloomykassieMy DISCORD SERVER (13 and up only): http://discord.gg/GLOOMMERCH: http://gloom.storeWATCH MY HORRIBLE BITLIVES: https://www.youtube.com/watch?v=-RcgvL6bKZQ&list=PLwbhb6Gu7AnXcLWpGMezpMHtPc6MZIfwYMy TIK TOK is @gloomdog, here's a link: http://vm.tiktok.com/JTHb8L/---------------------------------------------------------------------------I'm Kassie, also known as Gloom! I'm a variety gamer who does gameplay commentary on indie games and some bigger titles too. I also do silly sketches, challenges, Q&As, and whatever makes you goof balls giggle.---------------------------------------------------------------------------I do my best to upload at a few times a week (unless my life is a mess)."
"vMrxul4DMEo","ARK: Genesis Part 2 Teaser Trailer!","2020-11-07T19:30:52Z","UCEYfsfyne69mFfNTcZeZ6gw","ARK: Survival Evolved","20","PT2M24S","2d","hd","True","2020-11-10T18:59:07Z","ark|ark survival evolved|survival evolved|dinosaur game|xbox one|pc|steam","833155","43091","535","4118","https://i.ytimg.com/vi/vMrxul4DMEo/default.jpg","False","False","ARK: Genesis Part 2 introduces a vast contiguous world filled with strange new biomes, story missions, and exotic creatures! The final confrontation between the spritely HLN-A and the villainous Sir Edmund Rockwell occurs on a gigantic colony ship traveling through deep space. Players will need to draw on all their ARK experience to succeed. ARK's largest Expansion Pack yet has game-changing additions for every kind of Survivor: whether it's taking possession of enemies via brain-controlling Noglin creatures, zooming around doing radical tricks on the skateboard-like Hoversail, or managing and viewing your base remotely with security cameras, among tons of other new items and creatures!   This expansion pack also introduces new voiceover talent to the ARK universe with David Tennant (Doctor Who, Good Omens) playing the villainous Sir Edmund Rockwell, and Madeleine Madden (The Wheel of Time, Picnic at Hanging Rock, Dora and the Lost City of Gold) taking on the in-game robotic AI companion HLN-A/Helena Walker.But even with HLN-A's help, will your powerful skills, gear, and tames be sufficient to put a stop to Rockwell's demented plans once and for all? We're about to find out because The End is Near!Get a hold of the Genesis Season Pass today! http://playark.com/For the latest updates follow us on:Tweet us at https://www.twitter.com/survivethearkLike us on Facebook https://www.facebook.com/survivetheark/Visit the Website: http://playark.com Community Hub: http://www.survivetheark.comSubreddit: https://www.reddit.com/r/playarkInstagram: https://www.instagram.com/survivethearkPlus watch us tame and train leviathan creatures: https://www.twitch.tv/survivetheark"
"RnGLMCOFjFQ","Pooh Shiesty - Back In Blood (feat. Lil Durk) [Official Audio]","2020-11-06T05:00:04Z","UCTBIIbIs83IBsy4E1BQxYBw","Pooh Shiesty","10","PT3M5S","2d","hd","True","2020-11-10T18:59:07Z","pooh shiesty|pooh sheisty|pooh|shiesty|atlanta pooh shiesty|atlanta|1017 records|1017 artist|1017 pooh|1017|rap|hip hop|atlanta rap|back in blood|lil durk|pooh shiesty back in blood|lil durk back in blood","2017592","58729","1311","3735","https://i.ytimg.com/vi/RnGLMCOFjFQ/default.jpg","False","False","Pooh Shiesty - Back In Blood (feat. Lil Durk)Listen/download: https://poohshiesty.lnk.to/BackInBloodSubscribe for more official content from POOH SHIESTY:https://poohshiesty.lnk.to/YoutubeFOLLOW POOH SHIESTYInstagram: https://poohshiesty.lnk.to/InstagramTwitter: https://poohshiesty.lnk.to/TwitterFacebook: https://poohshiesty.lnk.to/FacebookLISTEN TO POOH SHIESTYApple: https://poohshiesty.lnk.to/AppleMusicSpotify: https://poohshiesty.lnk.to/SpotifySoundcloud: https://poohshiesty.lnk.to/SoundcloudAudiomack: https://poohshiesty.lnk.to/Audiomack The official YouTube channel of 1017 Records artist POOH SHIESTY. Subscribe for the latest music videos, performances, and more.#BackInBlood #PoohShiesty #LilDurk #TheNew1017"
"LIU-tAquSnI","Joe Biden Wins 2020 Presidential Election: Watch His Road to Victory | WSJ","2020-11-07T17:53:35Z","UCK7tptUDHh-RYDsdxO1-5QQ","Wall Street Journal","25","PT9M14S","2d","hd","True","2020-11-10T18:59:07Z","Election results|Donald Trump|Joe Biden|2020 election|Florida|Pennsylvania|winner|polls|arizona|nevada|georgia|delaware|scranton|vice president|president|white house|electoral college|associated press|voting|senate|iowa|caucuses|south carolina|primaries|healthcare|supreme court|criminal justice|immigration|democrat|Kamala Harris|Barack Obama|Hillary Clinton|Beau Biden|Bernie Sanders|Jim Clyburn|George Floyd|Amy Coney Barrett|president-elect|transition","950616","16212","5371","13866","https://i.ytimg.com/vi/LIU-tAquSnI/default.jpg","False","False","Joe Biden, on his third run for the presidency, defeated President Donald Trump, the Associated Press reports. WSJ’s Jason Bellini reports on his path to victory. Photo: Rick Loomis/Getty ImagesMore from the Wall Street Journal:Visit WSJ.com: http://www.wsj.comVisit the WSJ Video Center: https://wsj.com/videoOn Facebook: https://www.facebook.com/pg/wsj/videos/On Twitter: https://twitter.com/WSJOn Snapchat: https://on.wsj.com/2ratjSM#WSJ #Biden #Election2020"
