video_id,title,publishedAt,channelId,channelTitle,categoryId,duration,dimension,definition,is_trending,time_retrieved,tags,view_count,likes,dislikes,comment_count,thumbnail_link,comments_disabled,ratings_disabled,description
"m_2aSHgDxAw","TRYING TO COOK ENCHILADAS!! | Louie's Life","2020-11-11T23:30:02Z","UCZDdF_p-L88NWVpzF0vjvMQ","Louie's Life","24","PT16M39S","2d","hd","True","2020-11-14T18:20:21Z","trying to make|diy|cook|cocinar|trying to cook|cooking|cooking video|wife|wifey material|enchiladas|mexican dish|bomb|bomb af|delicious|easy|quick|fast|how to|how to make enchiladas|simple|recipe|ingrediants|race|vs|competition|the best enchiladas|deliciosas|cook off|funny|comedy|chistoso|laugh|spanglish|latino|latina|louie|castro|louies life|louie castro|quinceanera|the baddest perra|laura mellado|lauras boutique|louies boyfriend|couples|couple goals","817252","61571","1019","4215","https://i.ytimg.com/vi/m_2aSHgDxAw/default.jpg","False","False","For this weeks video we did a little compitioin with our hombres to see who could make the best enchiladas! We wanted to prove our selves to be wifey material!! We both had no idea how to make enchiladas so we had to work with our partner to make our own recipe! Let's just say, we did not expect the results.. Hope you guys enjoyed the video and got a good laugh!!———————————————————————————Watch my previous videos:-FUNNY AF HALLOWEEN COSTUMES!!:https://youtu.be/GPDJMbYF4fs-TAPATIO X HIPDOT HONEST REVIEW!!!:https://youtu.be/MG8TMtgLARc-MOVING IN TO OUR NEW HOME!!:https://youtu.be/Xdot3qTN864———————————————————————————Social Media:Instagram: @louiecasttroTwitter: @louiecasttroSnapchat: thehamielouie———————————————————————————Business Email: louiecasttro@yahoo.com———————————————————————————LOVE YOU PERRAS!"
"iVVObU2mHQw","LIGHTSABER vs DIAMOND PLAY BUTTON!","2020-11-12T21:00:04Z","UCjgpFI5dU-D1-kh9H1muoxQ","Hacksmith Industries","28","PT16M37S","2d","hd","True","2020-11-14T18:20:23Z","thehacksmith|hacksmith|lightsabe|diamond play button|whats inside diamond play button|diamond play button unboxing|broken diamond play button|lightsaber vs play button|lightsaber vs|light saber vs playbutton|cutting a play button|10 million subscribers|hacksmith industries|hacksmith industries lightsaber|hacksmith industries history|extendable lightsaber|superheated lightsaber|real lightsaber|plasma lightsaber|retractable lightsaber|youtube diamond play button","2032667","167209","2952","18222","https://i.ytimg.com/vi/iVVObU2mHQw/default.jpg","False","False","Own a piece of Hacksmith History  ► https://www.etsy.com/ca/shop/HacksmithIndustriesBecome a Hacksmith member get exclusive perks, including 50% off a mini diamond play button! ► https://www.youtube.com/channel/UCjgpFI5dU-D1-kh9H1muoxQ/join►Early video access ►Project design files (solidworks)►Merch Discounts ►Collaborate with us on our videos Channel History Playlist ►https://www.youtube.com/watch?v=108BaHo5xz4&list=PLbncXbXlaNQffbMH5Rimsh9wyGyp7IZjVCHAPTERS:0:00 Teaser0:23 History and Future of Hacksmith Industries10:13 Cooking With The Hacksmith12:22 Cutting the Diamond Playbutton15:44 Until next time!SOCIALWebsite ► http://www.hacksmith.techFacebook ► http://www.facebook.com/thehacksmithInstagram ► http://www.instagram.com/thehacksmithTwitter ► http://twitter.com/thehacksmithPatreon ► http://www.patreon.com/thehacksmithDiscord ► https://discordapp.com/invite/thehacksmith Merch ► https://www.hacksmith.storeMUSIC IN ORDER OF APPEARANCE:1440 Sunset A Day by Mountain Range Licensed from Triple Scoop Music ►https://triplescoopmusic.com/Upon The Hill by DPLicensed from Triple Scoop Music ►https://triplescoopmusic.com/All Star Wars music provided by Samuel Kimhttps://www.youtube.com/c/samuelkimmusic https://twitter.com/samuelkimmusic https://www.instagram.com/samuelkimmusicSOFTWARE:PCB Design ► https://www.altium.com/yt/TheHacksmithVideo Review / Collaboration ► http://r.frame.io/pZq3NVideo Editing ► Adobe Premiere VFX ► https://productioncrate.grsm.io/HacksmithCAD ► Solidworks CAM ► Autodesk HSM http://bit.ly/HSMworksCAMERA GEAR:Highspeed Cam - Chronos 1.4 ► http://bit.ly/chronosCamMain shooter - Panasonic GH5s ► https://bhpho.to/2Fjd80N Phone - Samsung S10  ► https://bhpho.to/2N8FOh8Camcorder - Sony Handycam ► https://bhpho.to/2FDnq81 Action Cam - GoPro ► https://bhpho.to/2FxXDC4 Steadicam - Removu K1 ► https://bhpho.to/2N9lDQq Main mic - Sennheiser ► https://bhpho.to/2DsR8ecBendy Tripod ► https://bhpho.to/2FyLNb0 Main Tripods - old second hand Manfrotto tripods no longer sold. Studio Light - Luxli ► https://bhpho.to/2N9SPavTOOLS / MACHINES: CNC Waterjet Cutter ► http://bit.ly/wazerJetCNC Plasma Cutter ► http://bit.ly/EMTplasma3d Printers ► http://bit.ly/H1PrinterCNC Mill ►  http://bit.ly/PCNC440CNC Lathe ► http://bit.ly/15LSlantProLaser Cutter - Gweike LG900N 80W ► http://lmgtfy.com/?q=lg900n 3d Scanner ► http://amzn.to/2pwbvTuDrills, drivers, grinders, saws, etc ► http://amzn.to/2p9SPJ3 Mig Welder ► http://bit.ly/MP250iWelderTig Welder ► http://bit.ly/Tig200WelderQuiet Air Compressor ► http://bit.ly/38zVKzBDesktop PC ► https://youtu.be/gSbt3LK8hCs Purchases made through some store links may provide some compensation to Hacksmith.WARNING: THESE VIDEOS ARE FOR ENTERTAINMENT PURPOSES ONLY. PERSONAL USE OF VIDEO CONTENT IS AT YOUR OWN RISK. THE HACKSMITH IS A TRAINED PROFESSIONAL WHO KNOWS EXACTLY WHAT HE'S DOING. EXCEPT WHEN HE DOESN'T. DO NOT ATTEMPT TO RECREATE OR RE-ENACT ANYTHING SHOWN IN THESE VIDEOS.#lightsaber #diamondplaybutton #whatsinside"
"fWl7kHhCwHw","Boosie on Mike Tyson & His Daughter Confronting Him Over Trans Comments (Part 1)","2020-11-11T22:30:03Z","UCg7lal8IC-xPyKfgH4rdUcA","djvlad","24","PT7M35S","2d","hd","True","2020-11-14T18:20:23Z","[none]","672846","12281","762","4258","https://i.ytimg.com/vi/fWl7kHhCwHw/default.jpg","False","False","Part 2: https://youtu.be/kBwn2UVIlvY--------Boosie came through for another VladTV interview, and this time around, he spoke about his experience sitting down with Mike Tyson for an interview. Boosie explained that he jumped at the opportunity to sit down with Mike Tyson, where he was asked about his comments on the LGBTQ community. Boosie added that Tyson's daughter confronted him after the interview, and she ended up walking out because they didn't see eye to eye. to hear more, including Boosie's thoughts on the interview being weird, hit the above clip."
"bNI1POQ9Nu8","Dan + Shay, Justin Bieber - 10,000 Hours (CMA Awards 2020)","2020-11-12T14:16:30Z","UCx8v-goujcpBVF7QKALgp3g","Dan And Shay","10","PT2M47S","2d","hd","True","2020-11-14T18:20:23Z","danandshay|dan n shay|dan + shay|dan and shay|country music|pop music|music|hit song|music video","481814","33535","245","1473","https://i.ytimg.com/vi/bNI1POQ9Nu8/default.jpg","False","False","LISTEN EVERYWHERE:http://wmna.sh/10kHours"
"lAEfsz5_8XY","Keith Finds The Best Burger EVER","2020-11-14T16:00:14Z","UCpi8TJfiA4lKGkaXs__YdBA","The Try Guys","23","PT16M2S","2d","hd","True","2020-11-14T18:20:23Z","try guys|keith|ned|zach|eugene|habersberger|fulmer|kornfeld|yang|buzzfeedvideo|buzzfeed|ariel|ned & ariel|comedy|education|funny|try|learn|fail|experiment|test|tryceratops|eat the menu|best burger|keith eats|keith and freinds|burger|cheeseburger|vegan burger|impossible burger|vegan cheese|monty's good burger|good burger|chef|cooking|eating|food competition|best|worst|popular|most popular|food recommendations","353557","20836","170","1217","https://i.ytimg.com/vi/lAEfsz5_8XY/default.jpg","False","False","Welcome back to Tailgate Debate! This week Keith and friends are hitting the road to find the best burger joint in LA! Shop our brand new Try Guys ROYAL Color Line Sweats available on https://tryguys.com now! And get Keith's burger + chicken sauce at https://keithschickensauce.com!Are you a business looking to work with The Try Guys? Reach out to us at 2ndtrybusiness@gmail.com for all business inquiries! 🎧THE TRYPOD 🎧: watch our new podcast at https://youtube.com/trypod or listen at https://tryguys.com/podcast📘THE HIDDEN POWER OF F*CKING UP 📘: check out our new book at https://tryguys.com/bookGet your official Try Guys color hoodies and phone cases at https://tryguys.com/collections/color-line 💙❤️💚💜Support us! http://www.patreon.com/tryguys. Join our Patreon to get videos a day early, plus, live streams, chatrooms, BTS footage, exclusive merchandise, and more!SUBSCRIBE TO AND FOLLOW THE TRY GUYS http://www.youtube.com/c/tryguyshttp://www.facebook.com/tryguys  http://www.twitter.com/tryguyshttps://www.instagram.com/tryguysFOLLOW THE GUYShttp://www.Instagram.com/keithhabshttp://www.Instagram.com/nedfulmerhttp://www.Instagram.com/korndiddyhttp://www.instagram.com/eugeneleeyang http://www.twitter.com/keithhabshttp://www.twitter.com/nedfulmer http://www.twitter.com/korndiddyhttp://www.twitter.com/eugeneleeyang THE TRY GUYSThe #TryGuys is the flagship channel of 2ND TRY, LLC. Tune in twice a week for shows from Keith, Ned, Zach and Eugene, the creators and stars of The Try Guys.FEATURING Garrick Bernard@GarrickBernard Rashawn Scott@rashawnscottEDITED BYIan Wittenber MUSICLicensed from AudioNetworkSFXLicensed from AudioblocksVIDEOLicensed from VideoblocksOfficial Try Guys Photos By Mandee Johnson Photography | @mandeephoto2nd Try, LLC STAFFExecutive Producer - Keith HabersbergerExecutive Producer - Ned FulmerExecutive Producer - Zach KornfeldExecutive Producer - Eugene Lee YangProducer - Rachel Ann ColeProducer - Nick RufcaAssociate Producer - Alexandria HerringEditor - Devlin McCluskeyEditor - YB ChangEditor - Elliot DickerhoofAssistant Editor - Will WitwerPodcast Producer - Miles BonsignoreCamera Operator/Assistant Production Coordinator - Jonathan KirkSound Operator Assistant Production Coordinator - Sam JohnsonContent Strategist - Kaylin BurkeSpecial Thanks To! Thanks to all of our Gold Level Patrons! AJ S., Amy Fleming, Ana Camba, Cat Hicks, Elisa Proust, Emma Godfrey, Erica Rao, Jared Aarons, Kelsey Bock, Kourtney Wong, Loretta Wen, Matthew Tadros, Miha, Paulus, Sarah Waxman, Traci Lew, Wendy Tran, Lily"
"H5KCHzVnyFQ","Ariana Grande - R.E.M. Fragrance Commercial (Official Video)","2020-11-12T22:59:40Z","UC9CoOnJkIBMdeijd9qYoT_g","Ariana Grande","10","PT1M35S","2d","hd","True","2020-11-14T18:20:23Z","ariana grande|rem|r.e.m.|fragrance|commercial|ulta|beauty","1398184","287504","1878","17839","https://i.ytimg.com/vi/H5KCHzVnyFQ/default.jpg","False","False","The official R.E.M. fragrance commercial by Ariana Grandehttp://ArianaGrande.lnk.to/remfragrance Directed by OLIVIER LESCOT Ariana Grande R.E.M. fragrance is available at:Ulta Beauty (US)Shoppers Drug Mart (Canada)Boots (UK)Douglas (Germany)My Chemist Warehouse (Australia) Liverpool (Mexico)"
"NB2rQvW3SCk","Life After Losing My Husband","2020-11-11T21:26:19Z","UCq3QBWXCKvMnltjwqWuB5bQ","Cam&Fam","22","PT20M35S","2d","hd","True","2020-11-14T18:20:23Z","cam and fam|camandfam|cam fam|teen mom|camfam|teen pregnancy|cam|teen parents|camily|teen moms|teenage pregnancy|teenage mom|moms|teen|teen mom vlog|teen mom vlogs|vlog|day in my life|motherhood|family|baby|family vlogers|family vlogs|family channel|teen mom of 2|pregnant teen mom|pregnant again at 18|16 and pregnant|Landon clifford|Landon clifford wife|camryn clifford","1434958","122224","1410","0","https://i.ytimg.com/vi/NB2rQvW3SCk/default.jpg","True","False","Shop Our Merch!https://teespring.com/stores/camandfamFollow Our Other Social Medias!My Instagram: https://www.instagram.com/camandfam/Collette's Instagram: https://www.instagram.com/collette_briar_clifford/Delilah's Instagram: https://www.instagram.com/baby.delilahrose/My Twitter: https://twitter.com/camandfam1Addi's Channel: https://www.youtube.com/channel/UCwErhojElMivMGP15wjL-TgAddi's Instagram: https://www.instagram.com/addidanielle/Contact Me! (Business Inquiries Only)Email: coastroadMGT@gmail.com"
"9mH-VPxKBs4","Rich The Kid & Young Boy Never Broke Again - Bankroll (Official Video)","2020-11-11T18:05:39Z","UCvTEOPrdg8f_mufsqH3VGQw","Rich The Kid","10","PT3M8S","2d","hd","True","2020-11-14T18:20:23Z","[none]","908332","50921","672","2189","https://i.ytimg.com/vi/9mH-VPxKBs4/default.jpg","False","False","Listen to the single Bankroll. Out now!Stream: https://music.empi.re/bankroll.oydDirector: RambinoExecutive Producer: Chris ArguetaProduction: MirrorBoxLTD#RichTheKid #YoungBoyNBA #BankrollOfficial music video by Rich The Kid & Young Boy Never Broke Again - Bankroll © 2020 Rich Forever Music / EMPIRE"
"Y7u3AIJ0tr4","Sony PLAYSTATION 5 Digital Edition UNBOXING & PS5 GIVEAWAY","2020-11-12T15:22:31Z","UCwMbSEgxhmOB5dXcxRTKHJQ","Seth","28","PT20M35S","2d","sd","True","2020-11-14T18:20:23Z","[none]","282978","10032","413","3130","https://i.ytimg.com/vi/Y7u3AIJ0tr4/default.jpg","False","False","To Enter the Sony Playstation 5 Digital Edition Giveaway: 1. SUBSCRIBE to this channel! 2. Follow me on IG @RealSethFowler https://www.instagram.com/realsethfowler/3. Comment DONE under the Giveaway picture on IG https://www.instagram.com/p/CHft7AklCHO/Giveaway ends Wednesday November 25th 2020 and the prize is the Sony Playstation 5 Digital Edition shown in the video! Grab a Sony Playstation 5 on Amazon: https://amzn.to/2IsYeYiToday I'm unboxing the new Sony Playstation 5 Digital Edition! The Sony PS5 Digital Edition had a release date of November 12th 2020 and a retail price of $399. The PS5 is the latest playstation console to release and comes in a wild new look. Check out my full Playstation 5 Unboxing, Review and Giveaway to learn more! Check out my main channel: https://www.youtube.com/c/sethfowlerFollow meIG - https://www.instagram.com/realsethfowler/TWITCH - https://www.twitch.tv/sethfowlerTwitter - https://twitter.com/realsethfowlerFacebook - https://www.facebook.com/RealSethFowler/Check out my Unboxing Channel: https://youtu.be/nawKCqiE9KYCheck out what I use to film: https://www.amazon.com/shop/sethfowlerThe Drop Front Sneaker Boxes I Use: https://bit.ly/2wl9e0tMy SecretLab Gaming Chair: http://bit.ly/2S0oDzB#SethFowler #Playstation5 #PS5—————————————————————————————————Unless specifically stated, there are no paid product endorsements in this video. There may be affiliate links in the description."
"u4gtYE864_w","Boosie Badazz Explodes On Twitter Following Mo3's Passing","2020-11-12T04:41:41Z","UCIETeoNRPdEhPDslmyDIXvQ","HipHopDX","10","PT1M14S","2d","hd","True","2020-11-14T18:20:23Z","boosie badazz mo3|boosie badazz mo3 everybody|boosie badazz mo3 one of them days|boosie badazz mo3 mop wit it|boosie badazz mo3 got me like|boosie badazz mo3 album|boosie badazz mo3 apartments|boosie badazz mo3 badazz smoke|boosie badazz mo3 ride with me|boosie badazz mo3 i remember|boosie badazz mo3 ghetto|boosie badazz mo3 vouch|boosie badazz mo3 hold ya head|boosie badazz mo3 interview|mo3 shot|mo3 boosie badazz one of them days|mo3 boosie badazz everybody","171466","1312","174","381","https://i.ytimg.com/vi/u4gtYE864_w/default.jpg","False","False","#BOOSIEBADAZZ #MO3 #BADAZZSYNDICATEExecutive Produced By: Pro https://www.instagram.com/jaysnprolifiq/Voiceover: Alexandra Wursthttps://www.instagram.com/ayeeedubb/Video Edit: CT https://www.instagram.com/goodluckct/Subscribe to HipHopDX on Youtube:http://bit.ly/dxsubscribeCheck out more of DX here:http://www.hiphopdx.comhttps://twitter.com/hiphopdxhttps://www.facebook.com/hiphopdxhttp://instagram.com/hiphopdxFor over 17 years, HipHopDX has been at the forefront of Hip Hop culture online, featuring over 2.7 million readers per month. As one of the longest-standing Hip Hop websites, DX not only stays current on Hip Hop culture, but continues to influence it, encourage it, and simultaneously reflect on its past. Our insightful, honest editorials, unbiased reviews, premier audio and video sections, and original video content, draws one of the most loyal followings online. Check us out at http://www.hiphopdx.com"
"c43HnswBwA8","NLE Choppa - Done (Official Music Video) (From Dark To Light)","2020-11-11T17:11:03Z","UCWICXNlSLc7eeNazpzUZcLg","NLE CHOPPA","10","PT2M57S","2d","hd","True","2020-11-14T18:20:23Z","NLE Choppa|Bryson|From Dark To Light|Top Shotta|New Rap Music|New Hip Hop|XXL|Complex|Lyrical Lemonade|Rap Caviar|Tee Grizzley|Comethazine|Famous Dex|Roddy Ricch|Blueface|Mulatto|Chief Keef|Shotta Flow|Narrow Road|Walk Em Down|New Hip Hop Music|No Jumper|Adam 22|Top Shotta Don Dada|Big Sean|Moonlight|Picture Me|Body Catchers|Picture Me Grapin|2Pac|2pac sample|100 grapes|Done","1385252","113196","1516","13104","https://i.ytimg.com/vi/c43HnswBwA8/default.jpg","False","False","Listen to 'From Dark To Light':https://nlechoppa.lnk.to/fromdarktolightWatch “Bryson” Official Music Video:https://nlechoppa.lnk.to/brysonvideoMerch: https://warnerrecords.lnk.to/choppastore Txt: (901)245-5603https://nlechoppa.comhttps://nlechoppa.com/mailing-listhttps://instagram.com/nlechoppamusichttps://facebook.com/nlechoppamusichttps://twitter.com/nlechoppa1https://snapchat.com/add/nlechoppamusicTikTok: @NLEChoppaMusicTriller: @NLEChoppa#NLEChoppa #FromDarkToLight #BrysonLYRICS:Aye, done with the pills I throw away the roxiesDone with the bullshit I don't need nobodyI might just post up with a full clip right in front the projectsI seen the murder before it happened I'm a murder prophetI'm sitting, chillin, smokin, makin a killinTryna make sure they they listen but I don't think that they hearingEyes tearing, I'm not god fearing, I just hope that god's steeringDevil interfering but this glizzy in amiri’sThey won't kill me, they won't drill me, won't peel meSincerley, from a nigga with no pity, no biggieKillers killing without it wit me no MickeyIt aint no mouses that's runnin with meThey say Bryson trippin, say he changing, he acting differentKnow it's really fiction so I'm changing my chapter with youMight get in my feelings reminiscing bout past dealingsMeditating and infatuated with peace and real healingDrug dealing, real killing, we already witnessed itNew deal for a free mill, they asking how I'm feelingDont feel real, couple M's, she loving how I'm liveThe Shit unreal these hoes they fuccin on me just for thrillsI wish that I could get some time backMan I gotta rewind thatLotta shit that sent me back and knocked me off the wrong pathThuggin check my rough draftGive your ass a blood bathWe don't even play fairYou come here, you lay hereHard working young niggaThey don't understand I'm tired thoughBro like what you tired for you supposed to be alive broLotta shit that came to lightI was looking through blindfoldsLivin in the lies like we trapped up in a cycleTryna be rich like the white folks, my third eye wokethink I want a white ghost, matte black, or painted purpleGreen and blue cheese, geico, blue mike n ikes hoesOff white in the sunlight, can't forget the nikes thoughLiving on a tightrope, im balancing survivalThought the concrete grew a bright roseI'm on the right roadPotholes we dodge those and foreign whips not tahoesI'm in a rarri, rarri, goCalamari for the dish, while she give me deep throatLet me knowI'm in a rarri, rarri, goIn the car with this choppa and it came with a scopeThey like that's the boy from shotta flowAye, done with the pills I throw away the roxiesDone with the bullshit I don't need nobodyI might just post up with a full clip right in front the projectsI seen the murder before it happened I'm a murder prophetI'm sitting, chillin, smokin, makin a killinTryna make sure they they listen but I don't think that they hearingEyes tearing, I'm not god fearing, I just hope that god's steeringDevil interfering but this glizzy in amiri’s"
"YmVouDKyL48","A NIGHT IN OUR LIFE (4 MONTH OLD BABY)!!","2020-11-12T02:09:23Z","UCeNTdh4BSHHVqAXB-2D5P4Q","Elsy Guevara","24","PT16M53S","2d","hd","True","2020-11-14T18:20:23Z","[none]","396290","24104","375","3132","https://i.ytimg.com/vi/YmVouDKyL48/default.jpg","False","False","SIGN UP WITH CURRENT BELOW!https://www.current.com/Elsy WATCH MY LATEST VIDEO!https://youtu.be/10zkDQrd_3EFOLLOW ME ON MY SOCIAL MEDIAS. Instagramhttp://www.instagram.com/elsyguevaraTwitterhttp://www.twitter.com/elsyguevaraSnapchatelsyelizabeth. TikTokhttps://www.tiktok.com/@elsyguevara_Follow for OOTDs.http://www.instagram.com/ootdfashLashes im always wearing.http://www.thelashbarla.comSee you guys in my next bideooo!"
"vNdMB2drD7U","Savannah Dexter - Just Hold On ft. Adam Calhoun (Official Music Video)","2020-11-11T22:00:11Z","UCC_66Dd88p5EMqpR8Y4mUTw","SAVANNAH DEXTER","10","PT3M12S","2d","hd","True","2020-11-14T18:20:23Z","Savannah Dexter|Adam Calhoun|Just Hold On|Upchurch|Gottem Talking|Raise Hell|Country Rap|Country Love|Love Song|Jelly Roll|Struggle Jennings|Sinderella|Savannah Dexter Adam Calhoun|Just Hold On Official Music Video|Savannah Dexter Music Video","273592","24392","287","3930","https://i.ytimg.com/vi/vNdMB2drD7U/default.jpg","False","False","Mako Music GroupOfficial Music Video for Just Hold On by Savannah Dexter ft. Adam Calhoun All merchandise is available at: https://shop.makomusicgroup.com/MAKE SURE TO SUBSCRIBE FOR ALL NEW CONTENTWardrobe provided by Modish Wardrobehttps://www.instagram.com/shopmodishwardrobe/Savannah Dexter ContactFacebookhttps://www.facebook.com/savannahdextermusic/Instagramhttps://www.instagram.com/savannahdextermusic/Adam Calhoun Contact https://www.instagram.com/adamcalhoun1/Full Scope CinemaProduced By: Brinson SwannMixed by: Brinson SwannMastered by: EARGAWDWritten By: Savannah Dexter, Adam Calhoun#SavannahDexter #AdamCalhoun #JustHoldOn"
"zvgXz0us78M","Young Dolph - No Sense (Official Video) ft. Key Glock","2020-11-11T17:00:28Z","UCgcRU8TrT4cQpA6m5c6w_CQ","YoungDolphVEVO","10","PT2M24S","2d","hd","True","2020-11-14T18:20:23Z","Young|Dolph|Sense|(Official|Video)|Paper|Route|EMPIRE|Rap/Hip-Hop","472517","24178","258","1131","https://i.ytimg.com/vi/zvgXz0us78M/default.jpg","False","False","From the album Rich Slave. Out now! Stream: https://empire.ffm.to/richslave.oyd#YoungDolph #KeyGlock #NoSenseOfficial music video by Young Dolph ft. Key Glock performing No Sense © 2020 Paper Route EMPIREhttp://vevo.ly/dQzdtF"
"plE3Fw_p_bA","Sheff G - Lights On (Official Video)","2020-11-11T20:00:07Z","UCMMDLA6mpTI2R9S8uwoHz8w","SHEFFGVEVO","10","PT2M30S","2d","hd","True","2020-11-14T18:20:23Z","sheff g|winners circle|lights on|sheff g lights on|sleepy hallow|great john on the beat|tip toe|deep end|brooklyn drill 2020|tik tok songs of brooklyn|tik tok rap|no suburban|new york rap|lil tecca|polo g|eli fross|Hip Hop|Lights On|Sheff G|Winners Circle/RCA Records","352776","26447","322","2133","https://i.ytimg.com/vi/plE3Fw_p_bA/default.jpg","False","False","“Lights On” Available Now: https://smarturl.it/SheffGLightsOnDirected by Ryan LynchAdditional footage provided by @kirbykurve & @aylo_editFollow Sheff Ghttps://www.instagram.com/sheff_g/https://twitter.com/SheffG83https://www.facebook.com/OfficialSheffG#SheffG #LightsOn #WinnersCircle"
