video_id,title,publishedAt,channelId,channelTitle,categoryId,duration,dimension,definition,is_trending,time_retrieved,tags,view_count,likes,dislikes,comment_count,thumbnail_link,comments_disabled,ratings_disabled,description
"moOxq_8l_34","How Donald Trump, White House reacted to Joe Biden's projected election victory","2020-11-08T00:34:15Z","UCrp_UI8XtuYfpiqluWLD7Lw","CNBC Television","25","PT3M30S","2d","hd","True","2020-11-14T18:20:23Z","news with shepard smith|shepard smith|news|evening news|CNBC|business news|stock market|news station|breaking news|us news|world news|cable|cable news|presidential election|democrats|republicans|Joe Biden|Donald Trump|election day|election results|vote|Election Tracker 2020|latest polls|exit polls|live election coverage|who won the election today|battleground swing states|senate election|kamala harris","7700861","60056","14837","34024","https://i.ytimg.com/vi/moOxq_8l_34/default.jpg","False","False","CNBC's Kayla Tausche joins The News with Shepard Smith to discuss how President Donald Trump reacted to the news that Democratic nominee Joe Biden was projected to win the 2020 presidential election. For access to live and exclusive video from CNBC subscribe to CNBC PRO: https://cnb.cx/2NGeIvi » Subscribe to CNBC TV: https://cnb.cx/SubscribeCNBCtelevision» Subscribe to CNBC: https://cnb.cx/SubscribeCNBC» Subscribe to CNBC Classic: https://cnb.cx/SubscribeCNBCclassicTurn to CNBC TV for the latest stock market news and analysis. From market futures to live price updates CNBC is the leader in business news worldwide.The News with Shepard Smith is CNBC’s daily news podcast providing deep, non-partisan coverage and perspective on the day’s most important stories. Available to listen by 8:30pm ET / 5:30pm PT daily beginning September 30: https://www.cnbc.com/2020/09/29/the-news-with-shepard-smith-podcast.html?__source=youtube%7Cshepsmith%7Cpodcast  Connect with CNBC News OnlineGet the latest news: http://www.cnbc.com/Follow CNBC on LinkedIn: https://cnb.cx/LinkedInCNBCFollow CNBC News on Facebook: https://cnb.cx/LikeCNBCFollow CNBC News on Twitter: https://cnb.cx/FollowCNBCFollow CNBC News on Instagram: https://cnb.cx/InstagramCNBChttps://www.cnbc.com/select/best-credit-cards/ #CNBC#CNBCTV"
"fL0my9B3PnA","WE'RE MOVING! packing up the old house... (moving ep. 1) | Nicole Laeno","2020-11-10T15:00:38Z","UCr1nLIQFpNV5DxD22qxGsyQ","Nicole Laeno","26","PT17M14S","2d","sd","True","2020-11-14T18:20:23Z","[none]","619257","56450","392","0","https://i.ytimg.com/vi/fL0my9B3PnA/default.jpg","True","False","SURPRISE! WE’RE MOVINGcan’t wait to take you guys along during this new journey. feeling so grateful for all the blessings in my life, including all of you. stay tuned for more episodes!✰ SOCIALS ✰instagram: @nicolelaenosnapchat: @nicolelaenotwitter: @nicolelaenotik tok: @nicolelaenospotify: nicole laeno✰ BUSINESS EMAIL ✰lindalaeno@yahoo.com✰ MUSIC ✰carter vail - love-15 https://thmatc.co/?l=AFF19F4Fmark generous - meet me at the ferris wheel https://thmatc.co/?l=10888103mark generous - i still love you https://thmatc.co/?l=83D1343Emark generous - meganne https://thmatc.co/?l=B0F46BB6ninjoi - acceptance https://thmatc.co/?l=B8A06B0ninjoi - purple rain https://thmatc.co/?l=3D88D17Aninjoi - where do i go https://thmatc.co/?l=E372558A✰ FAQ ✰how old are you? → 14what grade are you in? → 9thethnicity? → filipino + vietnamesecameras? → canon m50 + canon g7xediting software? → final cut pro xsub count: 969kstay positive!xoxo, nicole"
"sLmLwgxnPUE","TWICE 「BETTER」 Music Video","2020-11-10T15:00:23Z","UCCRb6nYKaT8tzLA8CwDdUtw","TWICE JAPAN OFFICIAL YouTube Channel","10","PT3M47S","2d","hd","True","2020-11-14T18:20:23Z","TWICE|トワイス|トゥワイス|ナヨン|ジョンヨン|モモ|サナ|ジヒョ|ミナ|ダヒョン|チェヨン|ツウィ|K-POP|TT|Official Music Video|ONCE","6268585","580480","6032","40898","https://i.ytimg.com/vi/sLmLwgxnPUE/default.jpg","False","False","TWICE JAPAN 7th SINGLE『BETTER』  2020.11.18 Release! 【いい音楽で一度、素晴らしいパフォーマンスで二度魅了させる】と言う意味を持つ、Asia No.1最強ガールズグループTWICE。2020年11月18日（水）にJAPAN 7th SINGLE『BETTER』（読み：ベター）をリリース。普段人がいるはずの場所などに一人ぼっちでいる彼女たちが、そこから自力で抜け出して、みんなが一つでいられる世界に向かうなど、現代を反映したイメージと歌詞に合わせた世界観を表している。また今回は、「いつも一緒」という思いを込めた、9人一体のパフォーマンスも見どころ。Photos by Jung Minhee (Project Mu studio), JJeary『BETTER』特設サイト：https://www.twicejapan.com/feature/better---------------------------------TWICE OFFICIAL FANCLUB ONCE JAPANhttp://oncejapan.comTWICE JAPAN OFFICIAL SITEhttp://www.twicejapan.comTWICE JAPAN OFFICIAL TWITTERhttps://twitter.com/jypetwice_japanTWICE JAPAN OFFICIAL INSTAGRAMhttps://www.instagram.com/jypetwice_japan/TWICE JAPAN OFFICIAL YouTube Channelhttps://www.youtube.com/c/twicejapanofficialTWICE JAPAN OFFICIAL TikTokhttps://vt.tiktok.com/DkuM3k/---------------------------------"
"Oy1z3esprFA","Forgiveness","2020-11-10T15:28:14Z","UCA3-nIYWu4PTWkb6NwhEpzg","Ryan Reynolds","22","PT1M18S","2d","hd","True","2020-11-14T18:20:23Z","[none]","1413187","98961","797","3535","https://i.ytimg.com/vi/Oy1z3esprFA/default.jpg","False","False","An Australian and a Canadian walk into Sam's Club..."
"-I-whVtW50E","AEW Games 1.0 Special Event","2020-11-10T23:45:09Z","UCzXZbDPErhWzErj0iKy_Qrw","AEW Games","20","PT20M8S","2d","hd","True","2020-11-14T18:20:23Z","gaming|gamer|ps|xbox|fortnite|playstation|games|videogames|memes|game|core|retrogaming|xboxone|stream|win|aewgames|new games|AEW Games|AEW Video Games|AEW Mobile Games|AEW Game|AWE Video Game|AEW|All Elite Wrestling|AEWrestling|AEW Wrestling|#AEWGamesAEW Dynamite|#AEWDynamite|Kenny Omega|gamingchair|gamingheadset|playstationplus|sonyplaystation|playstationexperience|ps4|xboxlive|xboxcontroller|iPhone AEW Game|Yukes|WWE 2k18|Wrestling Video Games","191119","10231","365","1760","https://i.ytimg.com/vi/-I-whVtW50E/default.jpg","False","False","#AEWGames #AllEliteWrestling AEW Games 1.0 Special Event"
"R1G6-RUz3OA","Foo Fighters - Shame Shame (Official Video)","2020-11-10T15:00:11Z","UCGRjJrpD2bmk9Ilq6nq80qg","foofightersVEVO","10","PT4M2S","2d","hd","True","2020-11-14T18:20:23Z","foo fighters|shame shame|shame|foo fighters shame|foo fighters shame shame|shame shame official video|shame video|shame official video|foo fighters shame video|sofia butella|sofia butella video|new foo fighters|foos|new foos|foo fighters 2020|medicine at midnight|foos snl|foo fighters snl|foo fighters saturday night live|foo fighters medicine|foo fighters video|foo fighters medicine at midnight|medicine at midnight album","1520350","46303","1768","3124","https://i.ytimg.com/vi/R1G6-RUz3OA/default.jpg","False","False","Foo Fighters // “Shame Shame” // Out Now: http://foofighters.co/Shame Medicine At Midnight // The New Album Available Feb. 5 2021Pre-Order // Pre-Save: http://foofighters.co/MAM Featuring Sofia BoutellaDirector: Paola KudackiExecutive Producer: Liz SilverProducer: Matthew ShattuckDirector of Photography: Santiago GonzalezEditor: Peter JohnsonChoreographer: Nina McNeely Listen to Shame Shame:Apple Music: http://foofighters.co/Shame/applemusic Spotify: http://foofighters.co/Shame/spotify Amazon Music: http://foofighters.co/Shame/az YouTube Music: http://foofighters.co/Shame/youtubemusic iTunes: http://foofighters.co/Shame/itunes Pandora: http://foofighters.co/Shame/pandora Deezer: http://foofighters.co/Shame/deezer Tidal: http://foofighters.co/Shame/tidal  Subscribe for more videos from Foo Fighters: http://foofighters.co/SubscribeYT  Connect with Foo Fighters:Facebook: http://foofighters.co/followFB Instagram: http://foofighters.co/followIG Twitter: http://foofighters.co/followTW Website: http://foofighters.co/followW Spotify: http://foofighters.co/followSP  _____ Shame Shame If you want toI'll make you feel something real just to bother youNow I got youUnder my thumb like a drug I will smother youI'll be the oneBe the moon Be the sunBe the rain in your songGo and put that record onIf you want toI'll be the oneBe the tongue that will swallow youShame, shameShame, shame Another splinter under the skinAnother season of lonelinessI found a reason and buried itUnder a mountain of emptinessShame, shameShame, shame Who, what, where, whenJust move alongNothing wrong Until we meet againI'll be the endI'll be the war at your doorCome and let me inI'll be the oneBe the moon Be the sunBe the rain in your songGo and put that record onIf you want toI'll be the one be the tongue that will swallow you Another splinter under the skinAnother season of lonelinessI found a reason and buried itUnder a mountain of emptinessShame, shameShame, shame Another splinter under the skinAnother season of lonelinessI found a reason and buried itUnder a mountain of emptinessShame, shameShame, shame #FooFighters #ShameShame #MedicineAtMidnight"
"hLQGsWA6ST8","I tried to beat Minecraft with CallMeCarson","2020-11-08T19:03:22Z","UCGwu0nbY2wSkW8N-cghnLpA","Jaiden Animations","1","PT18M3S","2d","hd","True","2020-11-14T18:20:23Z","jaiden|animations|jaidenanimation|jaidenanimations|Minecraft|Minecraft jaiden animation|Minecraft jaidenanimation|CallMeCarson","9164068","632833","4095","65368","https://i.ytimg.com/vi/hLQGsWA6ST8/default.jpg","False","False","very equal team, no anchors hereCarson's video! https://youtu.be/VRimnuj_I-8Carson's channel! https://www.youtube.com/user/TheBlueCrewPros♥ The Team ♥Atrox: https://twitter.com/AtroxChobatsuDavidBaronArt: https://twitter.com/DavidBaronArtDee Helm: https://twitter.com/DeeRedHelmDenny: https://twitter.com/90PercentDennyDevon: https://www.instagram.com/devonkong/Duckdee: https://twitter.com/duckdeeArtJaystarz: https://www.youtube.com/xjaystarzxJRFMotiny: https://www.youtube.com/channel/UCHimPYk1csmmOSGKF4pKelgPivots: https://www.youtube.com/user/ThePivotsXXD------------------------------------------------------------------------------------SUBSCRIBE for more animations!https://www.youtube.com/c/jaidenMERCH:https://jaidenanimations.com/TWITTER:https://twitter.com/JaidenAnimationINSTAGRAM:https://instagram.com/jaiden_animationsIf you're an animator, artist, gamer, or entertainer, then join us at Channel Frederator Network: https://frdr.us/JaidenWanna Send Fanart?You can send it to me through Twitter or Instagram (links above)------------------------------------------------------------------------------------Music:Heartwarming- Pokemon Mystery DungeonGuildmaster Wigglytuff- Pokemon Mystery DungeonDriftveil City- Pokemon Black/WhiteChampion Cynthia Battle- Pokemon Black/White------------------------------------------------------------------------------------minecraft amirite"
"6qREk4UcxQU","SKATEBOARDING WITH TONY HAWK!!! | Addison Rae","2020-11-09T18:57:37Z","UCsjVdwXJydmlSLVT2zDuwpQ","Addison Rae","22","PT8M21S","2d","hd","True","2020-11-14T18:20:23Z","skateboarding|tonyhawk","1890491","97968","2496","5928","https://i.ytimg.com/vi/6qREk4UcxQU/default.jpg","False","False","Check out Tony’s foundation, The Skatepark Project!  https://skatepark.org/about/ Shop ITEM Beauty!!!https://www.itembeauty.com/  Subscribe to me: https://www.youtube.com/channel/UCsjVdwXJydmlSLVT2zDuwpQ Follow me: TikTok: https://www.tiktok.com/@addisonre?lang=enInstagram: https://www.instagram.com/addisonraee/?hl=enTwitter: https://twitter.com/whoisaddison Merch:https://shopaddisonrae.com/"
"-W95MRL09GA","Let's watch SpaceX static fire Starship SN-8!","2020-11-11T01:32:41Z","UC6uKrU_WqJ1R2HMTY3LIx5Q","Everyday Astronaut","28","PT3H12M48S","2d","hd","True","2020-11-14T18:20:24Z","SpaceX|Starship|SpaceX Starship|SN-8|Starship SN-8|SpaceX Starship SN-8|Elon Musk|Elon Musk SpaceX|SpaceX Rocket Launch|Elon Musk Rocket|Elon Musk Starship|Starship Launch|Starship Rocket|Starship Rocket Launch|Static Fire|SpaceX Static Fire|Starship Static Fire|15km Hop|Starship Hop|Starship Test|Boca Chica|Texas Rocket Launch|Boca Chica Rocket","416364","9346","322","487","https://i.ytimg.com/vi/-W95MRL09GA/default.jpg","False","False","Timestamps00:00 - Mostly Nothing2:22:00 - Static Fire2:23:00 - Mostly NothingTIME VERY SUBJECT TO CHANGE, stay tuned to twitter http://twitter.com/erdayastronaut for updatesGene and Rachel from Spadre [@SouthPadreIsle] are right at the edge of the exclusion zone with one of my slow motion cameras to catch SpaceX fuel up and static fire Starship SN-8!Follow my friends @SpacePadreIsle for all their hard work and help! - https://twitter.com/SpacePadreIsle-------------------Want to support what I do? Consider becoming a Patreon supporter for access to exclusive livestreams, our discord channel and subreddit! - http://patreon.com/everydayastronautOr become a YouTube member for some bonus perks as well! - https://www.youtube.com/channel/UC6uKrU_WqJ1R2HMTY3LIx5Q/joinThe best place for all your space merch needs!https://everydayastronaut.com/shop/All music is original! Check out my album Maximum Aerodynamic Pressure anywhere you listen to music (Spotify, iTunes, Google Play, Amazon, etc) or click here for easy links - http://everydayastronaut.com/musicI'm the cohost of an awesome podcast where we talk all about current technologies and how they shape our future! http://ourludicrousfuture.com or here on YouTube https://www.youtube.com/ourludicrousfuture"
"AHRM_QNvp9E","Sending an Attractive Lookalike to My High School Reunion","2020-11-09T20:00:01Z","UCn8zNIfYAQNdrFRrr8oibKw","VICE","24","PT22M36S","2d","hd","True","2020-11-14T18:20:24Z","documentary|documentaries|docs|interview|culture|world|exclusive|independent|underground|videos|journalism|vice guide|vice.com|vice magazine|vice mag|vice videos|film|short film|VWN|Vice World News|world news|news|Oobah Lookalikes: Skydive Oobah Butler|Prank|Lookalike|high school|school|band|trumpet|bullying|high school reunion|reunion|VICE|con|trick|blag|blagger","1339325","44939","1611","5497","https://i.ytimg.com/vi/AHRM_QNvp9E/default.jpg","False","False","Like many of us, Stephen didn’t have a good time at high school. He played saxophone in the band, got bullied and struggled a little. Having graduated ten years ago, he hasn’t seen any of his former classmates since. Now his high school reunion is coming up and he wants to settle some scores. So he enlisted the help of VICE's Oobah Butler via his app, Oobah.In the wake of sending doubles of himself to collect awards and be interviewed by media outlets around the world, Oobah auditioned lookalikes and sent a hotter, more successful but fake version of Stephen to attend his high school reunion to reinvent his image in front of his old classmates. But can he get away with it?Watch more:I Sent A Lookalike To Skydive With My Wife & She Didn’t Realisehttps://www.youtube.com/watch?v=_CLhLkcm9AoI Sent Fakes of Myself to Be on TV Around the Worldhttps://www.youtube.com/watch?v=zMZ7BsoUAG8 How to Become TripAdvisor’s #1 Fake Restauranthttps://www.youtube.com/watch?v=bqPARIKHbN8 How To Crash Paris Fashion Weekhttps://www.youtube.com/watch?v=jolbYvAMorYClick here to subscribe to VICE: http://bit.ly/Subscribe-to-VICEAbout VICE:The Definitive Guide To Enlightening Information. From every corner of the planet, our immersive, caustic, ground-breaking and often bizarre stories have changed the way people think about culture, crime, art, parties, fashion, protest, the internet and other subjects that don't even have names yet. Browse the growing library and discover corners of the world you never knew existed. Welcome to VICE.Connect with VICE:Check out our full video catalog: http://bit.ly/VICE-VideosVideos, daily editorial and more: http://vice.comMore videos from the VICE network: https://www.fb.com/vicevideoClick here to get the best of VICE daily: http://bit.ly/1SquZ6vLike VICE on Facebook: http://fb.com/viceFollow VICE on Twitter: http://twitter.com/viceFollow us on Instagram: http://instagram.com/viceThe VICE YouTube Network:VICE: https://www.youtube.com/VICEMUNCHIES: https://www.youtube.com/MUNCHIES VICE News: https://www.youtube.com/VICENewsVICELAND: https://www.youtube.com/VICELANDTVBroadly: https://www.youtube.com/BroadlyNoisey: https://www.youtube.com/NoiseyMotherboard: https://www.youtube.com/MotherboardTV VICE Sports: https://www.youtube.com/NOCi-D: http://www.youtube.com/iDmagazine Waypoint: https://www.youtube.com/Waypoint"
"OgQcWwBoI6Y","Behind the Scenes of My Leopard Collection Video Shoot","2020-11-10T01:47:31Z","UCWkYXtnAuu7VTLPwUcRSB6A","Kylie Jenner","22","PT7M18S","2d","hd","True","2020-11-14T18:20:24Z","[none]","1808459","0","0","3601","https://i.ytimg.com/vi/OgQcWwBoI6Y/default.jpg","False","True","Come behind the scenes with me on the set of my new leopard collection video shoot."
"F41cmUsuj3M","Emily In Paris doesn't make any sense...","2020-11-10T19:00:01Z","UCY6Ij8zOds0WJEeqCLOnqOQ","Alex Meyers","24","PT10M50S","2d","hd","True","2020-11-14T18:20:24Z","alex meyers|alex mayers|alex myers|emily in paris|emily in paris netflix|alex meyers netflix","706907","48335","497","3968","https://i.ytimg.com/vi/F41cmUsuj3M/default.jpg","False","False","Emily In Paris Animated Commentary ReactionDownload my game!https://apps.apple.com/us/app/id1527894025https://play.google.com/store/apps/details?id=games.b6.alexCheck out my Podcasthttps://www.youtube.com/channel/UCBgm0clEVtGjgUKGHbMrqIw/★☆★ Help Me Get to 3,000,000 Subscribers! http://bit.ly/1Iqsdaq★☆★Buy some Merch:  alexmeyers.teemill.com★☆★ Twitter: https://twitter.com/JudgeOfTheKings★☆★ Follow Charlie on Instagram:instagram.com/charlie_meets_pumpkin/@charlie_meets_pumpkin★☆★Join the Discord: https://discord.gg/njGTCsY★☆★PLEASE SHARE THIS VIDEO!!★☆★PREVIOUS VIDEOS:Work It is pretty dumb...https://youtu.be/k4m394M7ZGYThe Kissing Booth 2 is hilariously dumbhttps://youtu.be/xmQJGsyFPXALove Is Blind is the dumbest show I've ever seen...https://youtu.be/HoXBODN8pHAThank you so much for 2,000,000 subscribers.  If you like what you see, please share these videos with your friends to show support!"
"h58HkQV1gHY","Happiest Season - Trailer (Official) • A Hulu Original","2020-11-09T20:00:10Z","UCE5mQnNl8Q4H2qcv4ikaXeA","Hulu","24","PT2M29S","2d","hd","True","2020-11-14T18:20:24Z","hulu","5032968","21495","982","1386","https://i.ytimg.com/vi/h58HkQV1gHY/default.jpg","False","False","This holiday, everyone’s secrets are coming out. Happiest Season premieres November 25, only on Hulu.ABOUT HAPPIEST SEASONMeeting your girlfriend’s family for the first time can be tough. Planning to propose at her family’s annual Christmas dinner — until you realize that they don’t even know she’s gay — is even harder. When Abby (Kristen Stewart) learns that Harper (Mackenzie Davis) has kept their relationship a secret from her family, she begins to question the girlfriend she thought she knew. Happiest Season is a holiday romantic comedy that hilariously captures the range of emotions tied to wanting your family’s acceptance, being true to yourself, and trying not to ruin Christmas.SUBSCRIBE TO HULU’S YOUTUBE CHANNELClick the link to subscribe to our channel for the latest shows & updates: http://www.youtube.com/hulu?sub_confiSTART YOUR FREE TRIAL http://hulu.com/start FOLLOW US ON SOCIALhttps://www.instagram.com/happiestseason/https://twitter.com/HappiestSeasonhttps://www.facebook.com/HappiestSeason"
"2NxT64tVRf0","MY OFFICIAL HOUSE TOUR!!","2020-11-10T01:31:45Z","UCBsEkEerFAqKd2q3TxmQ7qg","Jackie Figueroa","22","PT15M9S","2d","sd","True","2020-11-14T18:20:24Z","[none]","428850","17690","11280","8274","https://i.ytimg.com/vi/2NxT64tVRf0/default.jpg","False","False","Hi mis amores, I'm really excited to show you more and more about me. Hope you guys enjoyed getting to see the home I currently live in! I also showed a sneak peak of my new home. Thank you for supporting, sending you love. XOwww.instagram.com/jfigggs"
"pH8mu6-FvE0","Morgan Wallen - 7 Summers (Short Film)","2020-11-09T16:00:11Z","UCiQtJ9wVv8R-x7GKHzgZu8A","MorganWallenVEVO","10","PT8M18S","2d","hd","True","2020-11-14T18:20:24Z","Morgan Wallen|7 Summers|7 Summers ago|Country Music|Nashville Country|Morgan Wallen Music|Nashville Music|Nashville Tennessee|Tennessee Country|YouTube|VEVO|MorganWallenVEVO|Big Loud|Male Artist|CMA Awards","1120595","20739","563","1395","https://i.ytimg.com/vi/pH8mu6-FvE0/default.jpg","False","False","Watch the 7 Summers (Short Film) now! Listen to 7 Summers here: https://morganwallen.ffm.to/7summers.oyd Get updates from Morgan Wallen here: https://bit.ly/2FRP7LK Text Morgan: 865-351-6290 Instagram: https://www.instagram.com/morganwallen/ Facebook: https://www.facebook.com/morgancwallen/ Twitter: https://twitter.com/MorganWallenTikTok: https://vm.tiktok.com/ZMJHVheG5/-- Lyrics: YEAH, YOU USED TO TALK ABOUT GETTIN’ EVEN FURTHER SOUTH SOMEWHERE WHERE THE SUMMER LASTED ALL YEAR ROUND PROBABLY GOT A BIG OLE DIAMOND ON YOUR HAND RIGHT NOW MAYBE A BABY OR A COUPLE BY NOW LONG DRIVEWAY TO A BIG WHITE HOUSEBUT I WONDER WHEN YOU’RE DRINKIN’ IF YOU FIND YOURSELF THINKIN’ ABOUT THAT BOY FROM EAST TENNESSEE AND I KNOW WE BOTH KNEW BETTER BUT WE STILL SAID FOREVER AND THAT WAS 7 SUMMERS A COKE AND SOUTHERN COMFORT WERE WE DUMB OR JUST YOUNGER, WHO KNOWS? BACK THEN YOU USED TO LOVE THE RIVER AND SIPPIN’ ON A SIXER WITH ME DOES IT EVER MAKE YOU SAD TO KNOW THAT WAS 7 SUMMERS AGO? YEAH, I BET YOUR DADDY’S SO PROUD HOW HIS LITTLE GIRL TURNED OUT THINK SHE DODGED A BULLET OF A GOOD OLE BOY LIKE ME CAUSE I STILL GO DRINKIN’ SAME FRIENDS ON FRIDAY BOUGHT A FEW ACRES, COUPLE ROADS OFF THE HIGHWAY GUESS YOU NEVER SAW THINGS MY WAY ANYWAY BUT I WONDER WHEN YOU’RE DRINKIN’ IF YOU FIND YOURSELF THINKIN’ ABOUT THAT BOY FROM EAST TENNESSEE AND I KNOW WE BOTH KNEW BETTER BUT WE STILL SAID FOREVER AND THAT WAS 7 SUMMERS A COKE AND SOUTHERN COMFORT WERE WE DUMB OR JUST YOUNGER, WHO KNOWS? BACK THEN YOU USED TO LOVE THE RIVER AND SIPPIN’ ON A SIXER WITH ME DOES IT EVER MAKE YOU SAD TO KNOW THAT WAS 7 SUMMERS AGO? 7 SUMMERS AGO 7 SUMMERS AGO YEAH, I WONDER WHEN YOU’RE DRINKIN’IF YOU FIND YOURSELF THINKIN’ ABOUT THAT BOY FROM EAST TENNESSEE AND I KNOW WE BOTH KNEW BETTER BUT WE STILL SAID FOREVER AND THAT WAS 7 SUMMERS A COKE AND SOUTHERN COMFORT WERE WE DUMB OR JUST YOUNGER, WHO KNOWS? BACK THEN YOU USED TO LOVE THE RIVER AND SIPPIN’ ON A SIXER WITH ME DOES IT EVER MAKE YOU SAD TO KNOW THAT WAS 7 SUMMERS AGO? 7 SUMMERS AGO 7 SUMMERS AGO#MorganWallen #7Summers"
"P627ONn-vHI","UFC Golf Battle (Behind the Scenes)","2020-11-09T23:02:49Z","UCmo9ZEJ3ipgaZdkiRRYtLAg","Dude Perfect Plus","22","PT6M35S","2d","hd","True","2020-11-14T18:20:24Z","dude|perfect|plus|bonus|bts|behind|the|scenes|extra|compilation|dp|editors|funny|bloopers|deleted|family|team|trick|shot|shots|battle|stereotype|overtime|sparky|tyler|cory|coby|cody|garrett|panda|chad|tim|derek|hashtag","750648","31960","356","1610","https://i.ytimg.com/vi/P627ONn-vHI/default.jpg","False","False","Everything you love about Dude Perfect.. plus even more!  Be sure to SUBSCRIBE for more behind the scenes, bloopers, and bonus content! ► CLICK HERE: http://bit.ly/DPplusSubscribe► Click HERE to watch the main video: https://youtu.be/xBe-36v3lQo► Click HERE to watch more Behind the Scenes on Dude Perfect Plus: https://www.youtube.com/watch?v=XBh4bnd51c4&list=PLC_fTveW0jTZ-jc2LqY4dvhpyYSuPgNB7&ab_channel=DudePerfectPlusNEXT LEVEL STUFF -------------------------------------------🎒 NEW Merch - bit.ly/DPStore🎮 Play our FREE iPhone game! - http://smarturl.it/DudePerfect2📱 Text us - (469) 205-7005🔔 Hit the bell next to Subscribe so you don't miss a video!👨🏻‍💻 Watch our newest vids! - http://bit.ly/NewDPVids📕 Read our Book - Go Big - http://amzn.to/OYdZ2sFollow our Instagrams so we can be best friends -------------------------------------------🏆 http://Instagram.com/DudePerfect🧔🏻 http://Instagram.com/TylerNToney👱🏻‍♂️ http://Instagram.com/Cody_Jones_🙋🏻‍♂️ http://Instagram.com/CobyCotton👨‍🦰 http://Instagram.com/GarrettHilbert⛹🏻‍♂️ http://Instagram.com/CoryCotton-------------------------------------------Bonus points if you're still reading this! Comment: R.I.P. DP Tripod & Derek's arm!Click here to learn more about Dude Perfect:http://bit.ly/AboutDudePerfectAs always...Go Big and God Bless!- Your friends at Dude PerfectBusiness or Media, please contact us at: Dude@DudePerfect.com------------5 Best Friends and a Panda.If you like Sports + Comedy, come join the Dude Perfect team!Best known for trick shots, stereotypes, battles, bottle flips, ping pong shots and all-around competitive fun, Dude Perfect prides ourselves in making the absolute best family-friendly entertainment possible! Welcome to the crew! Pound it 👊🏻 Noggin 🙇🏻‍♂️ - Dude Perfect"
