video_id,title,publishedAt,channelId,channelTitle,categoryId,duration,dimension,definition,is_trending,time_retrieved,tags,view_count,likes,dislikes,comment_count,thumbnail_link,comments_disabled,ratings_disabled,description
"vN0MP5BuXno","KHEA, Natti Natasha, Prince Royce - Ayer Me Llamó Mi Ex Remix ft. Lenny Santos (Official Video)","2020-11-06T00:00:09Z","UCLbGdCqw-hfCrWlqRwOM2-Q","KHEA","10","PT4M17S","2d","hd","True","2020-11-10T18:59:07Z","khea|ayer me llamo mi ex|amlme|khea ayer me llamo mi ex|Mami Lo Siento|ayer me llamo mi ex khea|nuevo khea|khea trapicheo|Duki|khea nuevo|donde estas khea|khea donde estas|khea 2020|donde estas|creo que|bizarrap|Lenny Santos|tini|loca|khea y tini|natti natasha|prince royce|official video|natti y khea|khea y natti|khea y prince royce|prince royce khea|natti natasha khea|natti khea|darte un beso|la mejor version de mi|quien sabe|que mal te fue","16878267","940602","24814","50356","https://i.ytimg.com/vi/vN0MP5BuXno/default.jpg","False","False","KHEA, Natti Natasha, Prince Royce - Ayer Me Llamó Mi Ex Remix ft. Lenny Santos (Official Video) #AMLMEREMIXBIENVENIDO A MI MUNDO!https://www.kheamusic.com/ Follow me:Instagram:   https://smarturl.it/KHEA_InstagramFacebook:   https://smarturl.it/KHEA_FacebookTwitter:        https://smarturl.it/KHEA_TwitterSpotify:        https://smarturl.it/KHEA_Spotify#KHEA #AyerMeLLamóMiEx  #AMLME #LennySantos Lyrics/LetraSé que no eres felizNo puedes engañarme a míVives en el ayer todavía con esa mentiraQue a tus amigos le dicesTú puedes negarlo pero sabes que es verdadÉl no te lo hace con esta habilidadÉl te hace perder la estabilidad Y es por eso que tú siempre me vuelve a llamarAyer me llamó mi ex y me dijo que el novio que tiene ahora es aburridoQue no puede sentir lo que sentía conmigoY yo me hago el duro, pero por nada la olvidoUn culito así en Ebay no lo consigoNos hicimos mal pero también bienLa hacía venir cada dos por tresPeleábamos y arreglábamos con sexAyer me llamó mi ex y me dijo que la novia que ahora tiene es aburridaQue no puede sentir lo que sentía conmigoY se hace el duro, pero por nada me olvidaUn culito como yo en Ebay no lo consigueNos hicimos mal pero también bienLo hacía venir cada dos por tresPeleábamos y arreglábamos con sexQué pasó, borraste casete o te fallo la memoriaVe y déjale ese papel de víctima a otra personaQue no te queda bien desde que te fuiste yo ya estoy bienEl celu tenía en el pantalón cuando la llamada se disparóQue es lo que tú crees boy, tú no viste a donde estoyTú eres un recuerdo que ya no recuerdo Por qué usaste mi corazón de toyTe deseo lo mejor porque gracias a ti, soy la mejor versión de míYeah, eh-eh-eh Y ahora me llama pa' que yo le déYeah, eh-eh-eh Quiere volver a ser mi mujerYeah, eh-eh-eh Y ahora me llama pa' que yo le déYeah, eh-eh-eh Quiere volverAyer me llamó mi ex y me dijo que el novio que tiene ahora es aburrido Que no puede sentir lo que sentía conmigoY yo me hago el duro, pero por nada la olvidoUna mami así en Ebay no la consigoNos hicimos mal pero también bienLa hacía venir cada dos por tres Peleábamos y lo arreglábamos con sexSabes que me piensas cuando tu duermes con élSolo con besar tus labios te desnudas de una vezMe quiere amarrar otra vezNo sé si de nuevo se deProbé una vez más me quitéMe queda mejor ser tu exYeah, eh-eh-ehTe dije me queda mejor ser tu exYeah, eh-eh-eh Quiere volver a ser mi mujerYeah, eh-eh-eh Te dije me queda mejor ser tu exYeah, eh-eh-eh Quiere volverAyer me llamó mi ex y me dijo que el novio que tiene ahora es aburridoQue no puede sentir lo que sentía conmigoY yo me hago el duro, pero por nada la olvidoUn culito así en Ebay no lo consigoNos hicimos mal pero también bienLa hacía venir cada dos por tresPeleábamos y arreglábamos con sexTengo lo video', eso' que grabábamo' Casi que ni creo lo bien que la pasábamo' Cuando acapella lo hacíamo' en el bañoY ahora que no estamo' junto' algo me resulta extraño Sin ti estoy mejor, no te vo'a meter engaño' Y no puedo negar que tu sexo lo extraño Pero tu amor me hizo mucho daño Ta-ta-ta , ra-ta-ta-ta Iba para tu casa y a vece' no estabasPor más que era mala, con lo bueno me quedabaSon incontables las veces que te perdonabaMe llamaba tu mamá porque estaba' deprimida No sabía' por qué, pero yo si lo sabía El único que podía sanarte la herida Baby, yo lo sé, tú lo sabé' todavía, yeahAyer me llamó mi ex y me dijo que el novio que tiene ahora es aburridoQue no puede sentir lo que sentía conmigoY yo me hago el duro, pero por nada la olvidoUn culito así en Ebay no lo consigoNos hicimos mal pero también bienLa hacía venir cada dos por tresPeleábamos y arreglábamos con sexRoyceKHEA Young FlexDimelo Snipe PrrrNatti NaNobeat What’s upNobeat Music"
"QoAZEK52zRc","PlayStation 5 Review","2020-11-06T13:00:05Z","UCKy1dAqELo0zrOtPkf0eTMw","IGN","28","PT12M52S","2d","hd","True","2020-11-10T18:59:07Z","Ps5|ps5 console|playstation 5 review|ign|ign game reviews|game reviews|top videos|ps5 review|playstation 5|ps5 controller|ps5 games|ps5 gameplay|sony ps5|playstation 5 unboxing|dualsense|ps5 reviews|playstation|ps5 hands on|sony playstation 5|gaming|ps5 news|ps5 specs|ign reviews|console reviews|ps5 console review ign|ign ps5 console review|ps5 dualsense|dualsense controller|PS5","1999591","47669","4586","6732","https://i.ytimg.com/vi/QoAZEK52zRc/default.jpg","False","False","Luke Reilly reviews Sony's PlayStation 5 console. Find out how what this colossus lacks in subtlety it makes up for in potential thanks to its rapid SSD and remarkable new DualSense controller.The IGN PS5 review will cover our first impressions of the PS5 console, the new PS5 UI, the PS5 controller—better known as the DualSense controller—and much much more.The PlayStation 5 console is easily one of the largest consoles ever, and you can’t really appreciate its size until you see it in person. Our review highlights our PS5 hands-on impressions, including the console’s look and feel in the flesh as well as potential ways it could fit in your home entertainment setup. The PlayStation 5 user interface (PS5 UI) will also be thoroughly discussed in the video and will highlight new navigation features like “cards.”While the video does have PS5 gameplay footage from Spider-Man Miles Morales, it’s merely used to talk about how the PS5 specs and PS5 SSD are going to revolutionize loading in next-gen games.Finally, the review will touch on the new DualSense controller. This new PS5 controller is shaping up to be one of the standout features of the PlayStation 5. For more on the DualSense, be sure to check out IGN’s separate in-depth review of the PS5 DualSense controller.We hope you Enjoyed our IGN PS5 console review. Be sure to stick around for more Playstation 5 coverage. And for all your PS5 news, PS5 gameplay videos, PS5 game reviews, and all next-gen console reviews stay tuned to IGN.#ign #gaming #ps5"
"IWYF0_dvG9w","Moneybagg Yo, Blac Youngsta - Birthplace (Official Music Video)","2020-11-05T15:00:03Z","UC7r-J2sPQVv9i3iNcte1u-A","MoneybaggYoVEVO","10","PT2M26S","2d","hd","True","2020-11-10T18:59:07Z","Moneybagg|Blac|Youngsta|Birthplace|N-Less|Entertainment/CMG|Enterprises/Epic|Records|division|Sony|Music|Entertainment|Hip|Hop|Moneybagg Yo|Blac Youngsta|Moneybagg Yo Blac Youngsta|moneybagg Blac Youngsta|Blac Youngsta Moneybagg Yo|code red|moneybagg code red|Moneybagg Yo code red|Blac Youngsta code red|moneybagg Blac Youngsta code red|Moneybagg Yo Blac Youngsta code red|code red mixtape","912648","28944","800","1416","https://i.ytimg.com/vi/IWYF0_dvG9w/default.jpg","False","False","Code Red out now: http://smarturl.it/CodeRedMixtapeFollow Moneybagg Yo:http://www.instagram.com/moneybaggyo/http://www.twitter.com/moneybaggyo/http://www.facebook.com/moneybaggyo/ Lyrics:Put he price on low I won’t pay thatIn the city only where I get hate atMake sure that shit real before you take thatTryin to do what I do can’t fake thatIm the shit without you and you know thatBitches made that I done bought my hoe thatFN when like when   gonna blow thatSteady stepping on shit free KodakHumble to a certain extent Jump off the jet the board the yachtLet youngster control the carPress the bread Im twisting zaAnd this shit here very highLondon Cake with berry pieGotta know smoke come with fireYou must not be scared to die Once I cut you off I don’t want you backYou my biggest hater thats a factYou know I can’t spare no pussy ratsThey put cases on me back to backI get money the fuck you thinkAll blue hundreds I don’t fuck with pinkFeds I the hood everyday a op dieChurch every Sunday in my Cuban link Ive bee hearing voices you gonna get extortedIm just telling you what the shooter thinkYou a pussy niggaEvery time you you wash your pussy you gonna have to use a sinkShe want a part of my heartIm trying to give that lil bitch a part of my safeI told that bitch from the startI aint trying to be in love with ya im just trying to go on dates She aint gotta ask meShe know where the stash beShe know when the ops come she better sprayI love her body, paid for the plasticEvery time I wanna hit  she gonna wanna layI get money the fuck you thinkSmoking za rule, Murder IncPoured up in a dirty drinkSipping with my sneaky linkHit her on the kitchen sinkShe hollering out energyTell her what she wanna hearShe be like you sending meLingo in my word playAll a nigga get is M’sRepresent my birthplaceHittas come thru with that yeaAt your top like hairsprayDo em in the worst wayHis niggas didn’t ride form emThey just got some shirts madeOnce I cut you off I don’t want you backYou my biggest hater thats a factYou know I can’t spare no pussy ratsThey put cases on me back to back#MoneybaggYo #BlacYoungsta #Birthplace #CodeRedMoneybagg Yo, Blac Youngsta - Birthplace (Official Music Video)Music video by Moneybagg Yo, Blac Youngsta performing Birthplace. © 2020 Be Great Music Group, LLC/N-Less Entertainment, LLChttp://vevo.ly/M79VAG"
"RjbNMogQw8s","TREASURE - ‘음 (MMM)’ M/V","2020-11-06T09:00:11Z","UCx9hXYOCvUYwrprEqe4ZQHA","TREASURE (트레저)","24","PT3M36S","2d","hd","True","2020-11-10T18:59:07Z","YG Entertainment|YG|와이지|K-pop|트레져|트레저|TREASURE|CHOI HYUN SUK|JIHOON|YOSHI|JUNKYU|MASHIHO|YOON JAE HYUK|ASAHI|BANG YE DAM|DOYOUNG|HARUTO|PARK JEONG WOO|SO JUNG HWAN|최현석|지훈|요시|준규|마시호|윤재혁|아사히|방예담|도영|하루토|박정우|소정환|TREASURE 음|음|THE FIRST STEP|CHAPTER THREE|트레저 음|트레저 MMM|TREASURE MMM|MMM|TREASURE 오렌지|TREASURE ORANGE|트레저 오렌지|THE FIRST STEP : CHAPTER THREE|트레저 ORANGE","12936428","1106290","17635","463851","https://i.ytimg.com/vi/RjbNMogQw8s/default.jpg","False","False","음 (MMM)Mmm Mmm MmmLet me treasure you, treasure you, treasure you깜짝이야!너를 보면 입이 벌어져 활짝 눈부신 빛에 눈이 멀어 내 팔자또 네 생각을 하고 있지 매일 밤 천국의 향기를 맡아 날아올라 모든 게 완벽한 오늘이 바로 D-day둘만의 비밀을 만들어보자 My babe자연스레 난 널 리드하는 리더가 돼 사실은 널 보면 떨려긴장해 날 굳어 버리게 만드는 메두사너만 보면 놀라 감탄해너의 곁으로 어디든 달려가Runnin’ runnin’ runnin’그래 나야겁먹을 필요 없잖아 내 손 잡아무조건 날 믿어 You know what I’m sayin’그래 지금 그 눈빛으로 나를 쳐다볼 때터질 것 같아 너 때매 Mmm 지금 내 심장이 Mmm 미친 것 같아 Mmm Let me treasure you, treasure you터질 것 같아 너 때매 Mmm 위험해 지금 Mmm비상사태 Mmm Let me treasure you, treasure you터질 것 같아 너 때매널 좀 더 원해 애원해 Want some moreYeah 넌 내 무릎이 땅에 닿게 만들어 유일해이 한 몸 바치고픈 여왕이야넌 마치 명작 같아 필터 따윈 필요 없지억 소리가 나와 그 값은 감정 불가너만 보면 놀라 감탄해너의 곁으로 어디든 달려가Runnin’ runnin’ runnin’그래 나야겁먹을 필요 없잖아 내 손 잡아무조건 날 믿어 You know what I’m sayin’그래 지금 그 눈빛으로 나를 쳐다볼 때터질 것 같아 너 때매 Mmm 지금 내 심장이 Mmm 미친 것 같아 Mmm Let me treasure you, treasure you터질 것 같아 너 때매 Mmm 위험해 지금 Mmm비상사태 Mmm Let me treasure you, treasure you너의 그 미소로 내 깊은 한숨을 날려줘 지금 이 느낌이 저 하늘에 닿을 때까지조금 더 높은 곳 구름 위를 걷고 싶어너를 볼 때마다 꿈에서 깨고 싶지 않아다른 여잔 쳐다도 안 봐 난내겐 오직 여잔 너 하나야앞만 보며 뛰는 경주마 난너만 보면 내 심장이 파파 파파파 파파 파파파FIRE내겐 오직 여잔 너 하나야불끈불끈 타오르는 내 맘  너만 보면 내 심장이 파파 파파파 파파 파파파FIRE  Albums Available @ YG SELECT : http://www.ygselect.com/ YG SELECT China : http://cn.ygselect.com/ YG SELECT Amazon(JP) : http://bit.ly/yg-amzn-jp YG SELECT Amazon(US) : http://bit.ly/yg-amzn-us YG SELECT Amazon(UK) : http://bit.ly/yg-amzn-uk YG SELECT Qoo10(SG) : https://www.qoo10.sg/shop/ygselect #TREASURE #트레저 #3rdSINGLEALBUM #THEFIRSTSTEP_CHAPTERTHREE #음 #MMM #MV #20201106_6PM #OUTNOW #YGMore about TREASURE @https://yg-treasure.comhttps://www.youtube.com/OfficialTreasurehttps://www.facebook.com/OfficialTreasurehttps://www.twitter.com/ygtreasuremakerhttps://www.instagram.com/yg_treasure_official"
"ehQal7cSIpE","Live 2020 Election Results","2020-11-05T22:27:47Z","UC6ZFN9Tx6xh-skXCuRHCDpQ","PBS NewsHour","25","P1DT19H12M20S","2d","sd","True","2020-11-10T18:59:07Z","[none]","5453917","26783","4079","0","https://i.ytimg.com/vi/ehQal7cSIpE/default_live.jpg","False","False","The country is still awaiting final results in the 2020 presidential election as a record number of mail-in and absentee ballots are counted in key battleground states. Neither President Donald Trump nor former Vice President Joe Biden has enough electoral college votes to win the presidency. A candidate must earn 270 electoral college votes to be declared the winner. Here's a look at the states still outstanding and where the tally stands.More updates can be found here: https://www.pbs.org/newshour/Results data provided by the Associated Press.Stream your PBS favorites with the PBS app: https://to.pbs.org/2Jb8twGFind more from PBS NewsHour at https://www.pbs.org/newshourSubscribe to our YouTube channel: https://bit.ly/2HfsCD6Follow us:Facebook: http://www.pbs.org/newshourTwitter: http://www.twitter.com/newshourInstagram: http://www.instagram.com/newshourSubscribe:PBS NewsHour podcasts: https://www.pbs.org/newshour/podcastsNewsletters: https://www.pbs.org/newshour/subscribe"
"qtR-twJOdUU","Can 4 Guys Beat A Professional Bowler?!","2020-11-07T16:00:07Z","UCpi8TJfiA4lKGkaXs__YdBA","The Try Guys","23","PT19M49S","2d","hd","True","2020-11-10T18:59:07Z","try guys|keith|ned|zach|eugene|habersberger|fulmer|kornfeld|yang|buzzfeedvideo|buzzfeed|ariel|ned & ariel|comedy|education|funny|try|learn|fail|experiment|test|tryceratops|bowling|4vs1|prow bowling|pro bowler|competition|competitive bowling|winner|loser|best|worst|how to bowl|learning to bowl|bowl|sports|trying new things|playing sports|bowling ball|games with friends|game|games|playing games|games to play","1446601","77872","531","4411","https://i.ytimg.com/vi/qtR-twJOdUU/default.jpg","False","False","4 vs. 1 is back and so are our Color Block hoodies for a limited time only!!! Watch us attempt to beat a professional bowler at her own game and then head over to https://tryguys.com to get your new Color Block suit before they're sold out! Are you a business looking to work with The Try Guys? Reach out to us at 2ndtrybusiness@gmail.com for all business inquiries! 🎧THE TRYPOD 🎧: watch our new podcast at https://youtube.com/trypod or listen at https://tryguys.com/podcast📘THE HIDDEN POWER OF F*CKING UP 📘: check out our new book at https://tryguys.com/bookGet your official Try Guys color hoodies and phone cases at https://tryguys.com/collections/color-line 💙❤️💚💜Support us! http://www.patreon.com/tryguys. Join our Patreon to get videos a day early, plus, live streams, chatrooms, BTS footage, exclusive merchandise, and more!SUBSCRIBE TO AND FOLLOW THE TRY GUYS http://www.youtube.com/c/tryguyshttp://www.facebook.com/tryguys  http://www.twitter.com/tryguyshttps://www.instagram.com/tryguysFOLLOW THE GUYShttp://www.Instagram.com/keithhabshttp://www.Instagram.com/nedfulmerhttp://www.Instagram.com/korndiddyhttp://www.instagram.com/eugeneleeyang http://www.twitter.com/keithhabshttp://www.twitter.com/nedfulmer http://www.twitter.com/korndiddyhttp://www.twitter.com/eugeneleeyang THE TRY GUYSThe #TryGuys is the flagship channel of 2ND TRY, LLC. Tune in twice a week for shows from Keith, Ned, Zach and Eugene, the creators and stars of The Try Guys.FEATURINGMissy Parkin - Professional Bowler, Team USA MemberInstagram: @Missy_ParkinFacebook: @MissyNParkinTwitter: @MissyParkinSpecial thanks to Oak Tree Lanes!https://www.oaktreelanes.net/EDITED BYMishelle MartinMUSICLicensed from AudioNetworkSFXLicensed from AudioblocksVIDEOLicensed from VideoblocksOfficial Try Guys Photos By Mandee Johnson Photography | @mandeephotoEXTERNAL CREWDP - Daryl GilmoreSwing Grip - Kevin Castro2nd Try, LLC STAFFExecutive Producer - Keith HabersbergerExecutive Producer - Ned FulmerExecutive Producer - Zach KornfeldExecutive Producer - Eugene Lee YangProducer - Rachel Ann ColeProducer - Nick RufcaAssociate Producer - Alexandria HerringEditor - Devlin McCluskeyEditor - YB ChangEditor - Elliot DickerhoofAssistant Editor - Will WitwerPodcast Producer - Miles BonsignoreCamera Operator/Assistant Production Coordinator - Jonathan KirkSound Operator Assistant Production Coordinator - Sam JohnsonContent Strategist - Kaylin BurkeSpecial Thanks To! Thanks to all of our Gold Level Patrons! AJ S., Amy Fleming, Ana Camba, Cat Hicks, Elisa Proust, Emma Godfrey, Erica Rao, Jared Aarons, Kelsey Bock, Kourtney Wong, Loretta Wen, Matthew Tadros, Miha, Paulus, Sarah Waxman, Traci Lew, Wendy Tran, Lily"
"42qP4Q8x-1s","Peanut Butter Filled Chocolate Lava Cake #Shorts","2020-11-04T20:01:00Z","UCX9RpgtsnCr77AsFRR1pFIA","FunFoods","26","PT52S","2d","hd","True","2020-11-10T18:59:07Z","lava cake|how to make a lava cake|peanut butter filled lava cake|homemade lava cake|diy lava cake|chocolate lava cake|chocolate peanut butter recipes|dessert|food|shorts|funfoods","800024","17375","1037","438","https://i.ytimg.com/vi/42qP4Q8x-1s/default.jpg","False","False","See how to make this peanut butter filled chocolate lava cake.  I have had bad luck in the past making lava cakes but this time it turned out great.🔴SUBSCRIBE: http://bit.ly/2JLEfyRMerch: https://shop.skyou.com/collections/funfoodsRecommended products from Amazon: https://www.amazon.com/shop/funfoodsytFollow me at:TIKTOK:  @officialfunfoods  https://www.tiktok.com/@officialfunfoodsTWITTER: https://twitter.com/FunFoodsytFACEBOOK: https://www.facebook.com/FunFoodsyt INSTAGRAM: http://instagram.com/funfoodsytPINTEREST: https://www.pinterest.com/FunFoodsytSNAPCHAT: FunFoodsytMY WEBSITES: http://www.FunFoodsYT.com                            http://jameslamprey.comSend Mail to: James LampreyPO BOX 2027GLEN BURNIE, MD 21060-2027*******************************************Filmed with this equipment:Main camera -   Canon 70D: http://amzn.to/2iLZ29tLens -  Canon Zoom EF-S 18-55mm: http://amzn.to/2iQ8lb8Overhead camera - Canon G7X: http://amzn.to/2iYxwp6Audio - Rode Mic: https://amzn.to/2Bpnmv2          - Comica Lav Mic: https://amzn.to/2U0MwWxLighting -  Limo Studio: http://amzn.to/2iM3nJL“James Lamprey (FunFoods, LLC) is a participant in the Amazon Services LLC Associates Program, an affiliate advertising program designed to provide a means for sites to earn advertising fees by advertising and linking to amazon.com.”The FunFoods Youtube Channel is hosted by James Lamprey.  New family friendly recipe videos are uploaded every Sunday at 2 pm EST.  Learn how to make quick and easy recipes that you can recreate in your own kitchen.  www.funfoodsyt.com"
"Obp-9BEZe1c","[OFFICIAL VIDEO] Amazing Grace - Pentatonix","2020-11-06T01:00:10Z","UCmv1CLT6ZcFdTJMHxaR9XeA","PTXofficial","10","PT4M41S","2d","hd","True","2020-11-10T18:59:07Z","Pentatonix|Penatonix|PTX|PTXofficial|Mitch Grassi|Kirstie Maldonado|Scott Hoying|Avi Kaplan|Matt|Sallee|Kevin|Olusola|K-O.|Cello|Cellobox|Beatbox|A Cappella|Harmony|Acapella|Acappela|Choir|Singing Competition|The Sing-Off|Sing-Off|Reality TV|Sing|Singing|Chorus|Sara Bareilles|Shawn Stockman|Ben Folds|The Voice|Voice|Pitch Perfect|holiday|christmas|amazing grace|hallelujah|xmas|religious music","1698129","122323","1026","6802","https://i.ytimg.com/vi/Obp-9BEZe1c/default.jpg","False","False","GET “AMAZING GRACE”: https://smarturl.it/PTXAmazingGrace“AMAZING GRACE” IS THE FIRST SINGLE FROM THE UPCOMING “WE NEED A LITTLE CHRISTMAS” ALBUM, AVAILABLE NOVEMBER 13, 2020. PRE-SAVE & PRE-ORDER AT https://smarturl.it/PTXWNALXMASTHE LUCKY ONES THE NEW ORIGINAL ALBUM WITH 11 NEW SONGS INCLUDING HAPPY NOW & BE MY EYES. AVAILABLE 2.12.21. PRE-ORDER NOW https://smarturl.it/PTXTHELUCKYONESJOIN OUR PATREON FAN PAGE!! http://www.patreon.com/pentatonixGET ‘AT HOME’ EP: BUY https://smarturl.it/PTXATHOME?IQid=yt STREAM https://smarturl.it/PTXATHOME?IQid=yt GET THE BEST OF PENTATONIX CHRISTMAS: BUY: https://smarturl.it/bestofPTXmas?IQid=yt STREAM: https://smarturl.it/bestofPTXmas?IQid=ytGET CHRISTMAS IS HERE! BUY http://smarturl.it/pTXmasIsHere?IQid=yt STREAM http://smarturl.it/pTXmasIsHere?IQid=yt GET A PENTATONIX CHRISTMAS (DELUXE) BUY http://smarturl.it/APTXmasDlxD?IQid=yt STREAM http://smarturl.it/APTXmasDlxD/spotify?Iqid=yt GET THAT'S CHRISTMAS TO ME (DELUXE) BUY http://smarturl.it/TCTMDlxiT?IQid=yt STREAM http://smarturl.it/TCTMDlxS?IQid=yt GET PTXMAS BUY http://smarturl.it/PTXmas?IQId=yt STREAM http://smarturl.it/PTXmas1Sp?IQid=yt GET PTX PRESENTS: TOP POP, VOL. 1 BUY http://smarturl.it/PTXTPV1?IQid=yt STREAM http://smarturl.it/PTXTPV1?IQid=yt GET PENTATONIX THE ALBUM BUY http://smarturl.it/PTXalbum?IQid=yt STREAM http://smarturl.it/PTXalbumS?IQid=yt GET PTX VOL. 4 - CLASSICS EP BUY http://smarturl.it/PTXVol4iT?IQid=yt STREAM http://smarturl.it/StreamPTXVol4?IQid=yt GET PTX VOL III BUY http://smarturl.it/PTXVol3?IQId=yt STREAM http://smarturl.it/PTXVol3Spot?IQid=yt GET PTX VOL II BUY http://smarturl.it/PTXVolume2?IQid=yt STREAM http://smarturl.it/PTXV2Spotify?IQid=yt GET PTX VOL I BUY http://smarturl.it/PTXVol1?IQid=yt STREAM http://smarturl.it/PTXV1Spotify?IQid=yt ON MY WAY HOME THE DOCUMENTARY | AVAILABLE NOW! ITUNES: http://smarturl.it/PTXOMWHi?IQid=yt AMAZON: http://smarturl.it/PTXOMWHDVD?IQid=yt http://www.ptxofficial.com http://www.twitter.com/ptxofficial @ptxofficial http://www.facebook.com/Pentatonix http://www.instagram.com/ptxofficial @ptxofficial https://www.tiktok.com/@pentatonix @pentatonixhttp://www.snapchat.com/add/PTXsnapLYRICS: Amazing graceHow sweet the soundThat saved a wretch like meI once was lost, but now I'm foundWas blind, but now I see 'Twas grace that taught my heart to fearAnd grace my fears relievedHow precious did that grace appearThe hour I first believed My chains are goneI've been set freeMy God, my Savior has ransomed meAnd like a flood His mercy rainsUnending love, Amazing grace The Lord has promised good to meHis word my hope securesHe will my shield and portion beAs long as life endures My chains are goneI've been set freeMy God, my Savior has ransomed meAnd like a flood His mercy rainsUnending love, Amazing grace The Earth shall soon dissolve like snowThe sun forbear to shineBut God, Who called me here belowWill be forever mine My chains are goneI've been set freeMy God, my Savior has ransomed meAnd like a flood His mercy rainsUnending love, Amazing grace I once was lost, but now I'm foundWas blind, but now I seeCREDITSDirector: Jimmy BatesProduction Company: Green Glow FilmsExecutive Producer: Stephen Wayne MallettHead of Production: Brooklynn Reeves-MallettProducer: Hans Boysen1st Assistant Director: Jeff Cobb Director of Photography: Timothy S. Jensen1st AC: Luis Suarez2nd AC: Joel MartinSteadicam Operator: Merlin ShowwaterDIT: Erick Wilczynski#Pentatonix #WeNeedALittleChristmas #AmazingGrace"
