video_id,title,publishedAt,channelId,channelTitle,categoryId,duration,dimension,definition,is_trending,time_retrieved,tags,view_count,likes,dislikes,comment_count,thumbnail_link,comments_disabled,ratings_disabled,description
"lAEfsz5_8XY","Keith Finds The Best Burger EVER","2020-11-14T16:00:14Z","UCpi8TJfiA4lKGkaXs__YdBA","The Try Guys","23","PT16M2S","2d","hd","True","2020-11-17T14:31:12Z","try guys|keith|ned|zach|eugene|habersberger|fulmer|kornfeld|yang|buzzfeedvideo|buzzfeed|ariel|ned & ariel|comedy|education|funny|try|learn|fail|experiment|test|tryceratops|eat the menu|best burger|keith eats|keith and freinds|burger|cheeseburger|vegan burger|impossible burger|vegan cheese|monty's good burger|good burger|chef|cooking|eating|food competition|best|worst|popular|most popular|food recommendations","806037","37650","343","1803","https://i.ytimg.com/vi/lAEfsz5_8XY/default.jpg","False","False","Welcome back to Tailgate Debate! This week Keith and friends are hitting the road to find the best burger joint in LA! Shop our brand new Try Guys ROYAL Color Line Sweats available on https://tryguys.com now! And get Keith's burger + chicken sauce at https://keithschickensauce.com!Are you a business looking to work with The Try Guys? Reach out to us at 2ndtrybusiness@gmail.com for all business inquiries! 🎧THE TRYPOD 🎧: watch our new podcast at https://youtube.com/trypod or listen at https://tryguys.com/podcast📘THE HIDDEN POWER OF F*CKING UP 📘: check out our new book at https://tryguys.com/bookGet your official Try Guys color hoodies and phone cases at https://tryguys.com/collections/color-line 💙❤️💚💜Support us! http://www.patreon.com/tryguys. Join our Patreon to get videos a day early, plus, live streams, chatrooms, BTS footage, exclusive merchandise, and more!SUBSCRIBE TO AND FOLLOW THE TRY GUYS http://www.youtube.com/c/tryguyshttp://www.facebook.com/tryguys  http://www.twitter.com/tryguyshttps://www.instagram.com/tryguysFOLLOW THE GUYShttp://www.Instagram.com/keithhabshttp://www.Instagram.com/nedfulmerhttp://www.Instagram.com/korndiddyhttp://www.instagram.com/eugeneleeyang http://www.twitter.com/keithhabshttp://www.twitter.com/nedfulmer http://www.twitter.com/korndiddyhttp://www.twitter.com/eugeneleeyang THE TRY GUYSThe #TryGuys is the flagship channel of 2ND TRY, LLC. Tune in twice a week for shows from Keith, Ned, Zach and Eugene, the creators and stars of The Try Guys.FEATURING Garrick Bernard@GarrickBernard Rashawn Scott@rashawnscottEDITED BYIan Wittenber MUSICLicensed from AudioNetworkSFXLicensed from AudioblocksVIDEOLicensed from VideoblocksOfficial Try Guys Photos By Mandee Johnson Photography | @mandeephoto2nd Try, LLC STAFFExecutive Producer - Keith HabersbergerExecutive Producer - Ned FulmerExecutive Producer - Zach KornfeldExecutive Producer - Eugene Lee YangProducer - Rachel Ann ColeProducer - Nick RufcaAssociate Producer - Alexandria HerringEditor - Devlin McCluskeyEditor - YB ChangEditor - Elliot DickerhoofAssistant Editor - Will WitwerPodcast Producer - Miles BonsignoreCamera Operator/Assistant Production Coordinator - Jonathan KirkSound Operator Assistant Production Coordinator - Sam JohnsonContent Strategist - Kaylin BurkeSpecial Thanks To! Thanks to all of our Gold Level Patrons! AJ S., Amy Fleming, Ana Camba, Cat Hicks, Elisa Proust, Emma Godfrey, Erica Rao, Jared Aarons, Kelsey Bock, Kourtney Wong, Loretta Wen, Matthew Tadros, Miha, Paulus, Sarah Waxman, Traci Lew, Wendy Tran, Lily"
"XfDP4V6_gmA","Pokémon the Movie: Secrets of the Jungle | First Look","2020-11-13T14:24:18Z","UCFctpiB_Hnlk3ejWfHqSm6Q","The Official Pokémon YouTube channel","20","PT1M33S","2d","hd","True","2020-11-17T14:31:12Z","[none]","332852","19357","424","0","https://i.ytimg.com/vi/XfDP4V6_gmA/default.jpg","False","False","Can’t get enough of Zarude? Neither can we.The Mythical Pokémon swings into action in Pokémon the Movie: Secrets of the Jungle—coming in 2021! Official site: https://www.pokemon.comShop: http://www.pokemoncenter.comFacebook: http://www.facebook.com/Pokemon Twitter: http://www.twitter.com/Pokemon Instagram: http://www.instagram.com/pokemon"
"yw154fh7UG8","WSM FINALS DAY 3 YOKE, DEADLIFT & KEGS | EDDIE HALL","2020-11-15T03:01:32Z","UCjQFLkJG0737sMibjcdKrsw","SHAWSTRENGTH","17","PT16M32S","2d","hd","True","2020-11-17T14:31:12Z","Brian Shaw|worlds strongest man|strongman|hafthor bjornsson deadlift|Larry wheels|history|mattdoesfitness|strength|strong|Arnold Schwarzenegger|martins licis|Logan Paul|fitness","528249","22717","185","2458","https://i.ytimg.com/vi/yw154fh7UG8/default.jpg","False","False","Programming & Giveaways- https://club.shawstrength.com/Supportive Gear- https://evolutionathleticsgear.com Shaw Strength Merch- https://shawstrength.comPersonalized videos: https://www.cameo.com/shawstrength?utm_source=share&utm_campaign=profile_share&utm_medium=ios_app&_branch_match_id=806194583262357949FOLLOW ME HERE:Instagram: https://www.instagram.com/shawstrength/Twitter: https://twitter.com/shawstrengthFacebook: https://www.facebook.com/wsmbrianshaw/My website: https://shawstrength.com/CHECKOUT MY SPONSORS:Trifecta Nutrition: https://www.trifectanutrition.com/brianshawRogue Fitness: https://www.roguefitness.com/?a_aid=599c9935cd23aNew Age Performance Mouthware: https://newageperformance.com/?rfsn=3117789.483dc0Filmed & Edited By- https://www.instagram.com/thatcoloradoguyish/?hl=en"
"iVVObU2mHQw","LIGHTSABER vs DIAMOND PLAY BUTTON!","2020-11-12T21:00:04Z","UCjgpFI5dU-D1-kh9H1muoxQ","Hacksmith Industries","28","PT16M37S","2d","sd","True","2020-11-17T14:31:12Z","thehacksmith|hacksmith|lightsabe|diamond play button|whats inside diamond play button|diamond play button unboxing|broken diamond play button|lightsaber vs play button|lightsaber vs|light saber vs playbutton|cutting a play button|10 million subscribers|hacksmith industries|hacksmith industries lightsaber|hacksmith industries history|extendable lightsaber|superheated lightsaber|real lightsaber|plasma lightsaber|retractable lightsaber|youtube diamond play button","2510682","196104","3641","20754","https://i.ytimg.com/vi/iVVObU2mHQw/default.jpg","False","False","Own a piece of Hacksmith History  ► https://www.etsy.com/ca/shop/HacksmithIndustriesBecome a Hacksmith member get exclusive perks, including 50% off a mini diamond play button! ► https://www.youtube.com/channel/UCjgpFI5dU-D1-kh9H1muoxQ/join►Early video access ►Project design files (solidworks)►Merch Discounts ►Collaborate with us on our videos Channel History Playlist ►https://www.youtube.com/watch?v=108BaHo5xz4&list=PLbncXbXlaNQffbMH5Rimsh9wyGyp7IZjVCHAPTERS:0:00 Teaser0:23 History and Future of Hacksmith Industries10:13 Cooking With The Hacksmith12:22 Cutting the Diamond Playbutton15:44 Until next time!SOCIALWebsite ► http://www.hacksmith.techFacebook ► http://www.facebook.com/thehacksmithInstagram ► http://www.instagram.com/thehacksmithTwitter ► http://twitter.com/thehacksmithPatreon ► http://www.patreon.com/thehacksmithDiscord ► https://discordapp.com/invite/thehacksmith Merch ► https://www.hacksmith.storeMUSIC IN ORDER OF APPEARANCE:1440 Sunset A Day by Mountain Range Licensed from Triple Scoop Music ►https://triplescoopmusic.com/Upon The Hill by DPLicensed from Triple Scoop Music ►https://triplescoopmusic.com/All Star Wars music provided by Samuel Kimhttps://www.youtube.com/c/samuelkimmusic https://twitter.com/samuelkimmusic https://www.instagram.com/samuelkimmusicSOFTWARE:PCB Design ► https://www.altium.com/yt/TheHacksmithVideo Review / Collaboration ► http://r.frame.io/pZq3NVideo Editing ► Adobe Premiere VFX ► https://productioncrate.grsm.io/HacksmithCAD ► Solidworks CAM ► Autodesk HSM http://bit.ly/HSMworksCAMERA GEAR:Highspeed Cam - Chronos 1.4 ► http://bit.ly/chronosCamMain shooter - Panasonic GH5s ► https://bhpho.to/2Fjd80N Phone - Samsung S10  ► https://bhpho.to/2N8FOh8Camcorder - Sony Handycam ► https://bhpho.to/2FDnq81 Action Cam - GoPro ► https://bhpho.to/2FxXDC4 Steadicam - Removu K1 ► https://bhpho.to/2N9lDQq Main mic - Sennheiser ► https://bhpho.to/2DsR8ecBendy Tripod ► https://bhpho.to/2FyLNb0 Main Tripods - old second hand Manfrotto tripods no longer sold. Studio Light - Luxli ► https://bhpho.to/2N9SPavTOOLS / MACHINES: CNC Waterjet Cutter ► http://bit.ly/wazerJetCNC Plasma Cutter ► http://bit.ly/EMTplasma3d Printers ► http://bit.ly/H1PrinterCNC Mill ►  http://bit.ly/PCNC440CNC Lathe ► http://bit.ly/15LSlantProLaser Cutter - Gweike LG900N 80W ► http://lmgtfy.com/?q=lg900n 3d Scanner ► http://amzn.to/2pwbvTuDrills, drivers, grinders, saws, etc ► http://amzn.to/2p9SPJ3 Mig Welder ► http://bit.ly/MP250iWelderTig Welder ► http://bit.ly/Tig200WelderQuiet Air Compressor ► http://bit.ly/38zVKzBDesktop PC ► https://youtu.be/gSbt3LK8hCs Purchases made through some store links may provide some compensation to Hacksmith.WARNING: THESE VIDEOS ARE FOR ENTERTAINMENT PURPOSES ONLY. PERSONAL USE OF VIDEO CONTENT IS AT YOUR OWN RISK. THE HACKSMITH IS A TRAINED PROFESSIONAL WHO KNOWS EXACTLY WHAT HE'S DOING. EXCEPT WHEN HE DOESN'T. DO NOT ATTEMPT TO RECREATE OR RE-ENACT ANYTHING SHOWN IN THESE VIDEOS.#lightsaber #diamondplaybutton #whatsinside"
"moOxq_8l_34","How Donald Trump, White House reacted to Joe Biden's projected election victory","2020-11-08T00:34:15Z","UCrp_UI8XtuYfpiqluWLD7Lw","CNBC Television","25","PT3M30S","2d","hd","True","2020-11-17T14:31:12Z","news with shepard smith|shepard smith|news|evening news|CNBC|business news|stock market|news station|breaking news|us news|world news|cable|cable news|presidential election|democrats|republicans|Joe Biden|Donald Trump|election day|election results|vote|Election Tracker 2020|latest polls|exit polls|live election coverage|who won the election today|battleground swing states|senate election|kamala harris","7756837","60396","14907","34447","https://i.ytimg.com/vi/moOxq_8l_34/default.jpg","False","False","CNBC's Kayla Tausche joins The News with Shepard Smith to discuss how President Donald Trump reacted to the news that Democratic nominee Joe Biden was projected to win the 2020 presidential election. For access to live and exclusive video from CNBC subscribe to CNBC PRO: https://cnb.cx/2NGeIvi » Subscribe to CNBC TV: https://cnb.cx/SubscribeCNBCtelevision» Subscribe to CNBC: https://cnb.cx/SubscribeCNBC» Subscribe to CNBC Classic: https://cnb.cx/SubscribeCNBCclassicTurn to CNBC TV for the latest stock market news and analysis. From market futures to live price updates CNBC is the leader in business news worldwide.The News with Shepard Smith is CNBC’s daily news podcast providing deep, non-partisan coverage and perspective on the day’s most important stories. Available to listen by 8:30pm ET / 5:30pm PT daily beginning September 30: https://www.cnbc.com/2020/09/29/the-news-with-shepard-smith-podcast.html?__source=youtube%7Cshepsmith%7Cpodcast  Connect with CNBC News OnlineGet the latest news: http://www.cnbc.com/Follow CNBC on LinkedIn: https://cnb.cx/LinkedInCNBCFollow CNBC News on Facebook: https://cnb.cx/LikeCNBCFollow CNBC News on Twitter: https://cnb.cx/FollowCNBCFollow CNBC News on Instagram: https://cnb.cx/InstagramCNBChttps://www.cnbc.com/select/best-credit-cards/ #CNBC#CNBCTV"
"6ReLB0JZB-E","Eliminatorias | Bolivia vs Ecuador | Fecha 3","2020-11-12T22:31:55Z","UCzU8-lZlRfkV3nj0RzAZdrQ","CONMEBOL","17","PT8M55S","2d","hd","True","2020-11-17T14:31:12Z","fútbol|pelota|gol|copa|libertadores|sudamericana|eliminatorias|mundial","2142150","0","0","4216","https://i.ytimg.com/vi/6ReLB0JZB-E/default.jpg","False","True","Ecuador se hace fuerte en La Paz.🇧🇴 2-3 🇪🇨⚽️ 🇧🇴  (37') Arce⚽️ 🇪🇨 (46') Caicedo⚽️ 🇪🇨 (55') Mena⚽️ 🇧🇴 (60') Moreno ⚽️ 🇪🇨 (88') Gruezo Suscríbete I Inscreva-se I Subscribe: http://bit.ly/CONMEBOLFacebook: facebook.com/CONMEBOLInstagram: instagram.com/conmebol/Twitter: twitter.com/CONMEBOL"
"P0X42kFqCQU","George thinks he has Dream cornered (he's wrong)","2020-11-13T13:26:07Z","UC3iNdSV_RQU7DHTGpqEW96w","Andrei Terbea","23","PT2M46S","2d","hd","True","2020-11-17T14:31:12Z","@andreiterbea|andrei terbea|andrei terbea animation|minecraft|dream|minecraft manhunt|george|georgenotfound|george not found|dream george|dream manhunt|dream minecraft|youtooz|animation|minecraft animation|minecraft animated|dream animated|dream animation","578162","55191","1196","2545","https://i.ytimg.com/vi/P0X42kFqCQU/default.jpg","False","False","Decided to animate an extended edition of the scene I included in my video on Dream from last month. Also, keep an eye out for a surprise announcement at the end. ------------------------------➤Follow me on INSTAGRAM:https://www.instagram.com/andreiterbea/➤Follow me on TWITTER: https://twitter.com/AndreiTerbea➤Follow WILFUR on Instagram: https://www.instagram.com/Wilfur➤Follow WILFUR on Twitter: https://twitter.com/WilfurTheGoose------------------------------CREDITS:Andrei Terbea - Lead AnimatorStefan Popa - Assistant Animatorhttps://www.instagram.com/jtefe.ro/Nicoleta Toader - Producer------------------------------MUSIC:Covert Affairs - Christoffer Moe DitlevsenSightless in Shadow - Sudden Death The Proving Grounds - Dragon Tamer------------------------------#Dream #GeorgeNotFound #Minecraft"
"5QcDiUgHttc","DeLuca Tells Meredith to Get Some Rest - Grey's Anatomy","2020-11-13T07:00:01Z","UC_IpSl6O_-IRAA6fiNs05Gg","ABC","24","PT3M19S","2d","hd","True","2020-11-17T14:31:12Z","hospital|patients|emergency|residents|doctors|career","526882","5380","180","539","https://i.ytimg.com/vi/5QcDiUgHttc/default.jpg","False","False","Catherine (Debbie Allen) fires Tom (Greg Germann) as Chief of Chiefs and gives the job to Richard (James Pickens Jr.) instead, leading them toward reconciling. Meanwhile, DeLuca (Giacomo Gianniotti) gives Meredith (Ellen Pompeo) some good advice about taking care of herself. Watch 'Grey's Anatomy' THURSDAY 9|8c on ABC."
"bNI1POQ9Nu8","Dan + Shay, Justin Bieber - 10,000 Hours (CMA Awards 2020)","2020-11-12T14:16:30Z","UCx8v-goujcpBVF7QKALgp3g","Dan And Shay","10","PT2M47S","2d","hd","True","2020-11-17T14:31:12Z","danandshay|dan n shay|dan + shay|dan and shay|country music|pop music|music|hit song|music video","722668","44703","306","1735","https://i.ytimg.com/vi/bNI1POQ9Nu8/default.jpg","False","False","LISTEN EVERYWHERE:http://wmna.sh/10kHours"
"m_2aSHgDxAw","TRYING TO COOK ENCHILADAS!! | Louie's Life","2020-11-11T23:30:02Z","UCZDdF_p-L88NWVpzF0vjvMQ","Louie's Life","24","PT16M39S","2d","hd","True","2020-11-17T14:31:13Z","trying to make|diy|cook|cocinar|trying to cook|cooking|cooking video|wife|wifey material|enchiladas|mexican dish|bomb|bomb af|delicious|easy|quick|fast|how to|how to make enchiladas|simple|recipe|ingrediants|race|vs|competition|the best enchiladas|deliciosas|cook off|funny|comedy|chistoso|laugh|spanglish|latino|latina|louie|castro|louies life|louie castro|quinceanera|the baddest perra|laura mellado|lauras boutique|louies boyfriend|couples|couple goals","980111","69266","1039","4516","https://i.ytimg.com/vi/m_2aSHgDxAw/default.jpg","False","False","For this weeks video we did a little compitioin with our hombres to see who could make the best enchiladas! We wanted to prove our selves to be wifey material!! We both had no idea how to make enchiladas so we had to work with our partner to make our own recipe! Let's just say, we did not expect the results.. Hope you guys enjoyed the video and got a good laugh!!———————————————————————————Watch my previous videos:-FUNNY AF HALLOWEEN COSTUMES!!:https://youtu.be/GPDJMbYF4fs-TAPATIO X HIPDOT HONEST REVIEW!!!:https://youtu.be/MG8TMtgLARc-MOVING IN TO OUR NEW HOME!!:https://youtu.be/Xdot3qTN864———————————————————————————Social Media:Instagram: @louiecasttroTwitter: @louiecasttroSnapchat: thehamielouie———————————————————————————Business Email: louiecasttro@yahoo.com———————————————————————————LOVE YOU PERRAS!"
"YYHGloAZXg8","Will It Clog? A Whole Head of Hair!","2020-11-14T14:00:14Z","UCDRbNGFusqlXX4a5vwi9ouQ","Vat19","24","PT7M45S","2d","hd","True","2020-11-17T14:31:13Z","vat19|vat 19|vat-19|vat19 will it clog|will it clog|liquid plumr|liquid plumber|liquid plumr will it clog|liquid plumber will it clog|liquid plumr test|liquid plumr challenge|liquid plumr clog challenge|sink clog challenge|unclog a sink|unclogging a sink|will it clog challenge|will it clog vat19|hair clog|food clog|bathroom clog","519669","16156","428","1904","https://i.ytimg.com/vi/YYHGloAZXg8/default.jpg","False","False","We’re putting @Liquid-Plumr  to the test in a game of clog roulette with an ending you won’t want to miss (and that Jamie might regret). This is our wildest Will It Clog yet! #WILLITCLOGMore Will It Clog: https://www.youtube.com/watch?v=-VGVsRoVuSY&list=PLSqiExuEA-REvnVy4Cugnqij90HL3-LLPSubscribe to Vat19: http://www.youtube.com/subscription_center?add_user=vat19comVisit the Vat19 Headquarters: https://www.vat19.com/tour****************** Follow Vat19:Facebook: https://facebook.com/vat19Instagram: https://instagram.com/vat19/Shop hundreds more curiously awesome products:https://www.vat19.com/?adid=youtubeWatch More Vat19:The White Elephant Gift Show: https://www.youtube.com/watch?v=rppcXroNgKI&list=PLSqiExuEA-RFpqW0Y3vn0pn8wDW_3LXAOLatest Uploads: https://www.youtube.com/user/vat19com/videos?shelf_id=1&view=0&sort=ddPopular Videos: https://www.youtube.com/user/vat19com/videos?shelf_id=7&view=0&sort=pFun Stuff to Eat: https://www.youtube.com/watch?v=7RXmNRr8x7I&list=PLSqiExuEA-REt5gzR0A9ernZNHlZ2glIlAbout Vat19:Vat19 is dedicated to curiously awesome gifts, candy, toys, gummy, putty, puzzles, games, and more! In addition to making funny commercials you'll actually want to watch, we produce amazing challenge videos, document our outrageous contraptions, and invite you to a front row seat for our silly stunts. Sometimes we blow things up, fill up a bathtub or pool with crazy stuff, dare each other to eat super spicy foods, and answer “burning questions” from our viewers."
"H5KCHzVnyFQ","Ariana Grande - R.E.M. Fragrance Commercial (Official Video)","2020-11-12T22:59:40Z","UC9CoOnJkIBMdeijd9qYoT_g","Ariana Grande","10","PT1M35S","2d","hd","True","2020-11-17T14:31:13Z","ariana grande|rem|r.e.m.|fragrance|commercial|ulta|beauty","1858420","337893","2268","19026","https://i.ytimg.com/vi/H5KCHzVnyFQ/default.jpg","False","False","The official R.E.M. fragrance commercial by Ariana Grandehttp://ArianaGrande.lnk.to/remfragrance Directed by OLIVIER LESCOT Ariana Grande R.E.M. fragrance is available at:Ulta Beauty (US)Shoppers Drug Mart (Canada)Boots (UK)Douglas (Germany)My Chemist Warehouse (Australia) Liverpool (Mexico)"
"3arkYqvD5q4","Nba YoungBoy - Around","2020-11-11T01:29:04Z","UClW4jraMKz6Qj69lJf-tODA","YoungBoy Never Broke Again","10","PT2M38S","2d","hd","True","2020-11-17T14:31:13Z","[none]","5268413","212769","7977","27861","https://i.ytimg.com/vi/3arkYqvD5q4/default.jpg","False","False","It’s a curse inside Vegas. Fuck these niggas stay strap down and prayed up love yourself"
"9mH-VPxKBs4","Rich The Kid & Young Boy Never Broke Again - Bankroll (Official Video)","2020-11-11T18:05:39Z","UCvTEOPrdg8f_mufsqH3VGQw","Rich The Kid","10","PT3M8S","2d","hd","True","2020-11-17T14:31:13Z","[none]","2166549","59021","777","2351","https://i.ytimg.com/vi/9mH-VPxKBs4/default.jpg","False","False","Listen to the single Bankroll. Out now!Stream: https://music.empi.re/bankroll.oydDirector: RambinoExecutive Producer: Chris ArguetaProduction: MirrorBoxLTD#RichTheKid #YoungBoyNBA #BankrollOfficial music video by Rich The Kid & Young Boy Never Broke Again - Bankroll © 2020 Rich Forever Music / EMPIRE"
"NB2rQvW3SCk","Life After Losing My Husband","2020-11-11T21:26:19Z","UCq3QBWXCKvMnltjwqWuB5bQ","Cam&Fam","22","PT20M35S","2d","hd","True","2020-11-17T14:31:13Z","cam and fam|camandfam|cam fam|teen mom|camfam|teen pregnancy|cam|teen parents|camily|teen moms|teenage pregnancy|teenage mom|moms|teen|teen mom vlog|teen mom vlogs|vlog|day in my life|motherhood|family|baby|family vlogers|family vlogs|family channel|teen mom of 2|pregnant teen mom|pregnant again at 18|16 and pregnant|Landon clifford|Landon clifford wife|camryn clifford","1805128","146214","1451","0","https://i.ytimg.com/vi/NB2rQvW3SCk/default.jpg","True","False","Shop Our Merch!https://teespring.com/stores/camandfamFollow Our Other Social Medias!My Instagram: https://www.instagram.com/camandfam/Collette's Instagram: https://www.instagram.com/collette_briar_clifford/Delilah's Instagram: https://www.instagram.com/baby.delilahrose/My Twitter: https://twitter.com/camandfam1Addi's Channel: https://www.youtube.com/channel/UCwErhojElMivMGP15wjL-TgAddi's Instagram: https://www.instagram.com/addidanielle/Contact Me! (Business Inquiries Only)Email: coastroadMGT@gmail.com"
"plE3Fw_p_bA","Sheff G - Lights On (Official Video)","2020-11-11T20:00:07Z","UCMMDLA6mpTI2R9S8uwoHz8w","SHEFFGVEVO","10","PT2M30S","2d","hd","True","2020-11-17T14:31:13Z","sheff g|winners circle|lights on|sheff g lights on|sleepy hallow|great john on the beat|tip toe|deep end|brooklyn drill 2020|tik tok songs of brooklyn|tik tok rap|no suburban|new york rap|lil tecca|polo g|eli fross|Hip Hop|Lights On|Sheff G|Winners Circle/RCA Records","599220","36908","432","2545","https://i.ytimg.com/vi/plE3Fw_p_bA/default.jpg","False","False","“Lights On” Available Now: https://smarturl.it/SheffGLightsOnSubscribe To Sheff G on YouTube: https://smarturl.it/SheffGYTSubDirected by Ryan LynchAdditional footage provided by @kirbykurve & @aylo_editFollow Sheff GInstagram: https://www.instagram.com/sheff_g/Twitter: https://twitter.com/SheffG83Facebook: https://www.facebook.com/OfficialSheffGSpotify: https://smarturl.it/SheffGSpPlaylistApple Music: https://smarturl.it/SheffGAMSoundCloud: https://soundcloud.com/sheffgofficial#SheffG #LightsOn #WinnersCircle"
"c43HnswBwA8","NLE Choppa - Done (Official Music Video) (From Dark To Light)","2020-11-11T17:11:03Z","UCWICXNlSLc7eeNazpzUZcLg","NLE CHOPPA","10","PT2M57S","2d","hd","True","2020-11-17T14:31:13Z","NLE Choppa|Bryson|From Dark To Light|Top Shotta|New Rap Music|New Hip Hop|XXL|Complex|Lyrical Lemonade|Rap Caviar|Tee Grizzley|Comethazine|Famous Dex|Roddy Ricch|Blueface|Mulatto|Chief Keef|Shotta Flow|Narrow Road|Walk Em Down|New Hip Hop Music|No Jumper|Adam 22|Top Shotta Don Dada|Big Sean|Moonlight|Picture Me|Body Catchers|Picture Me Grapin|2Pac|2pac sample|100 grapes|Done","1668573","123226","1618","13467","https://i.ytimg.com/vi/c43HnswBwA8/default.jpg","False","False","Listen to 'From Dark To Light':https://nlechoppa.lnk.to/fromdarktolightWatch “Bryson” Official Music Video:https://nlechoppa.lnk.to/brysonvideoMerch: https://warnerrecords.lnk.to/choppastore Txt: (901)245-5603https://nlechoppa.comhttps://nlechoppa.com/mailing-listhttps://instagram.com/nlechoppamusichttps://facebook.com/nlechoppamusichttps://twitter.com/nlechoppa1https://snapchat.com/add/nlechoppamusicTikTok: @NLEChoppaMusicTriller: @NLEChoppa#NLEChoppa #FromDarkToLight #BrysonLYRICS:Aye, done with the pills I throw away the roxiesDone with the bullshit I don't need nobodyI might just post up with a full clip right in front the projectsI seen the murder before it happened I'm a murder prophetI'm sitting, chillin, smokin, makin a killinTryna make sure they they listen but I don't think that they hearingEyes tearing, I'm not god fearing, I just hope that god's steeringDevil interfering but this glizzy in amiri’sThey won't kill me, they won't drill me, won't peel meSincerley, from a nigga with no pity, no biggieKillers killing without it wit me no MickeyIt aint no mouses that's runnin with meThey say Bryson trippin, say he changing, he acting differentKnow it's really fiction so I'm changing my chapter with youMight get in my feelings reminiscing bout past dealingsMeditating and infatuated with peace and real healingDrug dealing, real killing, we already witnessed itNew deal for a free mill, they asking how I'm feelingDont feel real, couple M's, she loving how I'm liveThe Shit unreal these hoes they fuccin on me just for thrillsI wish that I could get some time backMan I gotta rewind thatLotta shit that sent me back and knocked me off the wrong pathThuggin check my rough draftGive your ass a blood bathWe don't even play fairYou come here, you lay hereHard working young niggaThey don't understand I'm tired thoughBro like what you tired for you supposed to be alive broLotta shit that came to lightI was looking through blindfoldsLivin in the lies like we trapped up in a cycleTryna be rich like the white folks, my third eye wokethink I want a white ghost, matte black, or painted purpleGreen and blue cheese, geico, blue mike n ikes hoesOff white in the sunlight, can't forget the nikes thoughLiving on a tightrope, im balancing survivalThought the concrete grew a bright roseI'm on the right roadPotholes we dodge those and foreign whips not tahoesI'm in a rarri, rarri, goCalamari for the dish, while she give me deep throatLet me knowI'm in a rarri, rarri, goIn the car with this choppa and it came with a scopeThey like that's the boy from shotta flowAye, done with the pills I throw away the roxiesDone with the bullshit I don't need nobodyI might just post up with a full clip right in front the projectsI seen the murder before it happened I'm a murder prophetI'm sitting, chillin, smokin, makin a killinTryna make sure they they listen but I don't think that they hearingEyes tearing, I'm not god fearing, I just hope that god's steeringDevil interfering but this glizzy in amiri’s"
