video_id,title,publishedAt,channelId,channelTitle,categoryId,duration,dimension,definition,is_trending,time_retrieved,tags,view_count,likes,dislikes,comment_count,thumbnail_link,comments_disabled,ratings_disabled,description
"mAFv55o47ok","Barack Obama: The 2020 60 Minutes interview","2020-11-16T01:21:38Z","UCsN32BtMd0IoByjJRNF12cw","60 Minutes","25","PT27M2S","2d","sd","True","2020-11-17T14:31:11Z","60 Minutes|CBS News|2020 United States Presidential Election|Donald Trump|Barack Obama|Joe Biden","2494010","60615","6854","16900","https://i.ytimg.com/vi/mAFv55o47ok/default.jpg","False","False","The former president shares the advice he would give President Trump, his thoughts on the killing of George Floyd, and what's behind the divisions in Washington and across the U.S. Scott Pelley reports. https://cbsn.ws/3kyvQRGSubscribe to the 60 Minutes Channel HERE: http://bit.ly/1S7CLRuWatch Full Episodes of 60 Minutes HERE: http://cbsn.ws/1Qkjo1FGet more 60 Minutes from 60 Minutes: Overtime HERE: http://cbsn.ws/1KG3sdrRelive past episodes and interviews with 60 Minutes Rewind HERE: http://cbsn.ws/1PlZiGIFollow 60 Minutes on Instagram HERE: http://bit.ly/23Xv8RyLike 60 Minutes on Facebook HERE: http://on.fb.me/1Xb1DaoFollow 60 Minutes on Twitter HERE: http://bit.ly/1KxUsqXGet the latest news and best in original reporting from CBS News delivered to your inbox. Subscribe to newsletters HERE: http://cbsn.ws/1RqHw7TGet your news on the go! Download CBS News mobile apps HERE: http://cbsn.ws/1Xb1WC8Get new episodes of shows you love across devices the next day, stream local news live, and watch full seasons of CBS fan favorites anytime, anywhere with CBS All Access. Try it free! http://bit.ly/1OQA29B---60 Minutes, the most successful American television broadcast in history, began its 52nd season in September. Offering hard-hitting investigative reports, interviews, feature segments and profiles of people in the news, the broadcast began in 1968 is still a hit in 2020. 60 Minutes makes Nielsen’s weekly Top 10 nearly every week and was the #1 weekly television broadcast three times last season.The program still averages more than 10 million viewers, more than double the audience of its nearest network news magazine competitor. The average audience for a 60 Minutes broadcast is 150% higher than those of the network morning news programs; the audience dwarfs the number of viewers drawn by the most popular cable news programs.  About a million more people listen to the 60 Minutes radio simulcast in several major cities and on its companion podcast. Tens of thousands each week experience 60 Minutes online. The broadcast’s segments can be watched at 60Minutes.com and on the CBS All Access app. Its webcast, 60MinutesOvertime.com, offers content originally produced for the web, including behind-the-scenes video about the production of 60 Minutes stories and timely archival segments.60 Minutes has won every major broadcast award. Its 25 Peabody and 150 Emmy awards are the most won by any single news program. It has also won 20 duPont-Columbia University journalism awards. Other distinguished journalism honors won multiple times include the George Polk, RTDNA Edward R. Murrow, Investigative Reporters and Editors, RFK Journalism, Sigma Delta Chi and Gerald Loeb awards.60 Minutes premiered on CBS September 24, 1968. Bill Owens is the program’s executive producer. The correspondents and contributors of 60 Minutes are Sharyn Alfonsi, Anderson Cooper, John Dickerson, Norah O’Donnell, Scott Pelley, Lesley Stahl, Bill Whitaker and L. Jon Wertheim."
"IFXm5E27dlM","Exploring Dubai’s Empty $13 Billion Man-Made Islands","2020-11-15T18:03:01Z","UCvK4bOhULCpmLabd2pDMtnA","Yes Theory","24","PT17M8S","2d","hd","True","2020-11-17T14:31:11Z","yestheory|seek discomfort|yes theory strangers|yes theory travel|yes theory subscribers|getting out of your comfort zone|world islands|dubai world islands|dubai man-made islands|buying a private islands|Why Dubai's Man-Made Islands Are Still Empty|FBA|UAE|Dubai|dubai billionaire|amazing private islands|most expensive islands|maldives|dubai private islands|billionaire private island|empty private islands|private islands|world islands construction|Amazon FBA","1009294","65863","977","3788","https://i.ytimg.com/vi/IFXm5E27dlM/default.jpg","False","False","*SEEK CONNECTION Out Now*: http://seek-discomfort.com/yes-theory Join our Seek Discomfort Community with our First Holiday Drop SEEK CONNECTION and our Essentials out now for the next 7 days. On top of that, as a gift from us for the Holidays, any purchase above $35, we'll give you a Seek Discomfort Bracelet.  Thank you for the love and support :)The World Islands. A collection of 300 man-made islands built off the coast of Dubai to resemble an outline of the EARTH FROM THE SKY… Yet, after $13 billion was spent to complete them they’ve mostly been sitting there empty... I couldn’t believe this place actually existed.So as a first stop on my trip I flew to Dubai to understand what happened and what their future holds… What are your thoughts? Amazing or too crazy of an idea?Thank you to @MyDubai and @VisitDubai for helping us get in touch with the creators of these islands and for letting us go out to see the restricted areas.Who are we? We believe that life’s greatest moments and deepest connections exist outside of your comfort zone.We have a 2nd channel! Make sure to subscribe to it here:https://www.youtube.com/channel/UCTd7KzdwnFE3lm6LCfYDmUQhttps://www.instagram.com/yestheory/https://twitter.com/yestheoryhttps://www.facebook.com/yestheory/Join our texting community: +1 (323) 310-5420If you want to join the Yes Fam Facebook group which is 100,000+ of our most engaged and badass community members, you can apply here: https://www.facebook.com/groups/yesfam/Where we find our music:1- Epidemic Sound. Amazing royalty free music for YouTube. Free 30 day trial here: http://share.epidemicsound.com/wFFbr 2- Musicbed. Amazing label-quality cinematic music. 30-day free trial here:http://share.mscbd.fm/YesTheory3- Artlist. 2 Months Free High Quality Music: https://artlist.io/artlist-70446/?art...Our b-roll and stock footage:1- 2 Months Free Stock Footage Videos: https://artgrid.io/Artgrid-114820?art...2- For an amazing b-roll and footage library, checkout: http://storyblocks.com/YesTheoryBusiness Inquiries: zack@yestheory.comFor community inquiries: hello@yestheory.comHosts: Thomas Brag, Ammar Kandil, Matt Dajer and Thomas DajerEditors: Thomas Dajer, Cam Peddle, Bryce Perry, Tristan Kevitch and Thomas BragProduced by Alex SandstedtThank you to our amazing videographers that helped me shoot over the 2 separate trips we took!Cory Martin on videography and drone: https://www.instagram.com/cory.s.martinBishoy on Drone: https://www.instagram.com/bikooigAli Amar on videography: https://www.instagram.com/r1seMore videos on the World Islands & Dubai  Why Dubai's Man-Made Islands Are Still Emptyhttps://youtu.be/riETCR7FnZEDubai Evolution from 1960 to 2021 Time-lapsehttps://youtu.be/XPd5AmTEkdk"
"GLoeAJUcz38","Press This Button To Win $100,000!","2020-11-14T21:00:02Z","UCX6OQ3DkcsbYNE6H8uQQuVA","MrBeast","24","PT15M11S","2d","hd","True","2020-11-17T14:31:11Z","[none]","17848013","969956","15837","41693","https://i.ytimg.com/vi/GLoeAJUcz38/default.jpg","False","False","Push the red subscribe button and you could also win $100,000! (Seriously, we always fly subscribers down lol)New Merch - https://shopmrbeast.com/SUBSCRIBE OR I TAKE YOUR DOG╔═╦╗╔╦╗╔═╦═╦╦╦╦╗╔═╗║╚╣║║║╚╣╚╣╔╣╔╣║╚╣═╣ ╠╗║╚╝║║╠╗║╚╣║║║║║═╣╚═╩══╩═╩═╩═╩╝╚╩═╩═╝----------------------------------------------------------------follow all of these or i will kick you• Facebook - https://www.facebook.com/MrBeast6000/• Twitter - https://twitter.com/MrBeastYT•  Instagram - https://www.instagram.com/mrbeast--------------------------------------------------------------------"
"j0qfH4CKQa8","Kevin Gates - Give It All I Got (Prod by Drumma Boy)","2020-11-14T17:22:25Z","UCj2GTFekdV3EUsTVN8oaEqA","kevingatesTV","10","PT3M4S","2d","hd","True","2020-11-17T14:31:11Z","kevin gates|kevin|gates|atlantic|atlantic records|how we livin|2 phones|really really|by any means 2|BWA|BreadWinnersAssociation|OfficialBWA","1035905","44723","730","2720","https://i.ytimg.com/vi/j0qfH4CKQa8/default.jpg","False","False","Subscribe for more official content from Kevin Gates:https://kevingates.lnk.to/SubscribeFollow GatesInstagram: http://instagram.com/iamkevingatesTwitter: http://twitter.com/iamkevingatesFacebook: https://facebook.com/kvngatesSoundcloud: https://soundcloud.com/kevingatesWebsite: http://www.kvngates.comThe official YouTube channel of Atlantic Records artist Kevin Gates. Subscribe for the latest music videos, performances, and more."
"RI2szJL0jY0","$18 Oil Vs. $60 Oil","2020-11-15T16:00:06Z","UCpko_-a4wgz2u_DgDgd9fqA","BuzzFeedVideo","22","PT16M42S","2d","sd","True","2020-11-17T14:31:11Z","buzzfeed|buzzfeedvideo|buzzfeed video|Worth It|BuzzFeed Worth It|BuzzFeed Steven|BuzzFeed Adam|BuzzFeed Andrew|Steven Lim|Adam Bianchi|Cameraguy|andrew ilnyckyi|Food|Travel|Cheap vs. expensive|Lifestyle|BuzzFeed|BuzzFeedvideo|Experience|cheap oil vs expensive oil|cheap oil|expensive oil|oil|oil taste test","755247","25828","438","1434","https://i.ytimg.com/vi/RI2szJL0jY0/default.jpg","False","False","The episode you were probably never expecting.Credits: https://www.buzzfeed.com/bfmp/videos/113088Love Worth It? Get the merch! SHOP NOW: https://bzfd.it/3lizqAJSubscribe to BuzzFeedVideo: https://bzfd.it/2lVAsJ3BuzzFeedVideoBuzzFeed’s flagship channel. Sometimes funny, sometimes serious, always shareable. New videos posted daily!To see behind-the-scenes & more, follow us on Instagram @buzzfeedvideo http://bit.ly/2JRRkKUGET MORE BUZZFEED:https://www.buzzfeed.comhttps://www.buzzfeed.com/videoshttps://www.youtube.com/buzzfeedvideohttps://www.youtube.com/asishttps://www.youtube.com/buzzfeedmultiplayerhttps://www.youtube.com/buzzfeedunsolvednetworkhttp://youtube.com/buzzfeedcelebhttps://www.youtube.com/perolikehttps://www.youtube.com/buzzfeedviolethttps://www.youtube.com/goodfulhttps://www.youtube.com/niftyhttps://www.youtube.com/buzzfeedtastyhttps://www.youtube.com/bringmeSUBSCRIBE TO BUZZFEED NEWSLETTERS:https://www.buzzfeed.com/newslettersMUSICSpice It UpLicensed via Warner Chappell Production Music Inc.1St Day Funker_MainLicensed via Warner Chappell Production Music Inc.Banged Finger_MainMixLicensed via Warner Chappell Production Music Inc.Chi-Ki Cha_FullMixLicensed via Warner Chappell Production Music Inc.Piano Butterflies_MainLicensed via Warner Chappell Production Music Inc.Genesis_MainLicensed via Warner Chappell Production Music Inc.EmeraldsLicensed via Warner Chappell Production Music Inc.Let's BlowLicensed via Warner Chappell Production Music Inc.The PayoffLicensed via Warner Chappell Production Music Inc.Ella_InstLicensed via Warner Chappell Production Music Inc.Delta Blues Muffler_NoTubaLicensed via Warner Chappell Production Music Inc.I Spy Fly_fullmixLicensed via Warner Chappell Production Music Inc.Keep Pumping_InstrumentalLicensed via Warner Chappell Production Music Inc.Big RiffLicensed via Warner Chappell Production Music Inc.FunksterLicensed via Warner Chappell Production Music Inc.Swingin Whistle_MainLicensed via Warner Chappell Production Music Inc.Blue Horns Drive_MainLicensed via Warner Chappell Production Music Inc.La Furia_AltMixLicensed via Warner Chappell Production Music Inc.Licensed via Audio Network"
"2WkDviplN8Y","Villains with TRASH reasons on why they're evil.","2020-11-15T02:12:50Z","UCI1XS_GkLGDOgf8YLaaXNRA","CalebCity","23","PT3M26S","2d","hd","True","2020-11-17T14:31:11Z","[none]","1387611","182209","777","9938","https://i.ytimg.com/vi/2WkDviplN8Y/default.jpg","False","False","Villain: I fell on my way in the house from my car and I had food in my hands. This planet will know pain.MusicOddwin - 19King Kaiyo - Melodic"
"9aGR3PQz1Nw","Losers Shave Beards! Intense 2v2 Basketball Game!","2020-11-15T23:04:00Z","UCvyTdLw8SkVmUcHYXSDEGwA","CashNasty","24","PT18M40S","2d","hd","True","2020-11-17T14:31:11Z","losers shave beards basketball game|1v1 basketball game played|1v1 cash|intense basketball game|losers shave beards|no shave november|funny videos clean|basketball videos|2v2 basketball|cash and mal|2v2 mal and cash basketball|basketball game|basketball moves|basketball highlights|shave head|loser shaves hair|hooping videos|funny videos clean try not to laugh impossible|basketball videos 2020|basketball 1v1 ankle breakers|No shave november 2020","523501","27651","315","2307","https://i.ytimg.com/vi/9aGR3PQz1Nw/default.jpg","False","False","Check out Nelz channel here:https://www.youtube.com/channel/UC7BW5hjnmlrvAkb75b3vg6QMalcom's Channel:youtube.com/c/50KalMal/videosSUB TO MY NEW NBA REACTION CHANNEL!https://www.youtube.com/channel/UCMUN2v9GN0WtBxkbu_o8o2QPre-Workout I Use:I receive commission from purchases made through this link:https://t.co/q6oEqxDGLb?amp=1Use code CASH for 10% off your order!Pre-Workout I Use...GG!!I receive commission from purchases made through this link:https://t.co/q6oEqxDGLb?amp=1Use code CASH for 10% off your order!Gaming Channel: https://goo.gl/Se1qBH 2HYPE Channel: https://www.youtube.com/channel/UCY4AlDv6wL2qhrX29iwdqAgFollow me on Twitter: www.twitter.com/cashnastygamingInstagram: @cashnastyI livestream on Twitch! www.twitch.tv/cashnastygaming"
"Mb6Blx2HMIc","Your PS5 only does this one time.. You don't want to miss it","2020-11-15T18:00:04Z","UCbRlogwNj65Fhyq-wwiJpoQ","John Glasscock","28","PT3M33S","2d","hd","True","2020-11-17T14:31:11Z","ps5|playstation 5|playstation|tips|tricks","1066481","31475","957","2496","https://i.ytimg.com/vi/Mb6Blx2HMIc/default.jpg","False","False","Here's the PS5 first startup! This screen only happens when you turn on a new Playstation 5 for the first time.. It's beautiful! Also, for new users: I explain the basics of the PS5 Control Center / Quick Menu functions - for new PS5 owners. Thanks for watching!"
"HGetUf9cgzQ","Among Us But Its A Reality Show 4","2020-11-14T20:29:44Z","UC-pnSdXRsSi44apSO5RXjlw","Laugh Over Life","23","PT8M46S","2d","hd","True","2020-11-17T14:31:11Z","laugh over life|among us but its a reality show|among us|among us but its a reality show 4|among us memes|among us in real life|among us irl|among us tik tok|laugh over life among us|how to be an imposter|among us 2|among us update|among us parody|among us skit|reality tv show|among us tv show|among us mockumentary|among us short film|among us fan film|real life among us|funny among us|funny among us moments|among us compilation|among us red sus","1332823","66588","1031","6911","https://i.ytimg.com/vi/HGetUf9cgzQ/default.jpg","False","False","🎬BEHIND THE SCENES: https://youtu.be/bOOv5_lxhpkGET THE MERCH: https://teespring.com/stores/among-us-lolThere are two imposters among us again, and maybe one last imposter? After even more medbay visits, the space gang is back again for their fourth rodeo, and as usual they are flying dangerously through space to god knows where. You would think that by now they would stop flying with murderers, but they haven't. There are imposters on board and the crew mates need to snuff them out. Is red sus as usual? Who should be voted out? Which player is the imposter venting to kill? Will people be murdered by the imposter or by their beloved crewmates? Find out in this month's newest episode of Among Us but it's a Reality Show.Credits:Blue and Red- @Oddest of the Odd  Purple- Brantly: https://instagram.com/brantlycomptonLime- Michelle: http://www.instagram.com/mitch.elley/Black- Sergio: https://instagram.com/serg.boyYellow- Zach: https://www.instagram.com/the_bearded_bard_/?hl=enWhite- Jordyn: https://instagram.com/jbatchhhWhite Jr. - JerelOrange- Austin: https://instagram.com/austimistPink- Lauren: https://www.instagram.com/lauuuuurennn/?hl=enBTS- Zach: https://instagram.com/zachquintana►FOLLOW US:     🔹Discord Server - COME SAY HI: https://discord.com/invite/laughoverlife     🔹YouTube: https://www.youtube.com/laughoverlife/     🔹2nd Channel: https://tinyurl.com/jeyzos3     🔹Tik Tok: https://www.tiktok.com/@laughoverlife?lang=en     🔹Twitter: https://twitter.com/laughoverlife     🔹Facebook: https://www.facebook.com/LaughOverLife/     🔹Instagram: https://www.instagram.com/laughoverlife/►Equipment:     Camera: https://amzn.to/2on7GCb     Lens: https://amzn.to/2nq9mLp     Mic: https://amzn.to/2p6hxwO     Drone: https://amzn.to/2mLX2EQ     Stabilizer: https://amzn.to/2p8u2rP►SUPPORT USIf you're an awesome and loving person who's looking to support us, THANK YOU!!! Please check out these links if you WANT, we still love you if you don't :)     🔹Patreon - https://www.patreon.com/laughoverlife     🔹MERCH - https://www.teespring.com/stores/laugh-over-life/"
"bg3v8VKEtBc","2020 Turkish Grand Prix: Race Highlights","2020-11-15T14:10:21Z","UCB_qr75-ydFVKSF9Dmo6izg","FORMULA 1","17","PT7M","2d","hd","True","2020-11-17T14:31:11Z","F1|Formula One|Formula 1|Sports|Sport|Action|GP|Grand Prix|Auto Racing|Motor Racing|Lewis Hamilton|Lance Stroll|Turkey|Istanbul|istanbul Park|World Championship|Bottas|Verstappen|Sebastian Vettel|Ferrari|Racing Point|Sergio Perez|F1 2020 crash|F1 wet race","4347251","104988","2577","8569","https://i.ytimg.com/vi/bg3v8VKEtBc/default.jpg","False","False","A shock polesitter. Unpredictable conditions. And one man on the edge of securing a historic seventh world title. After a nine-year wait, Turkey delivered a classic race!For more F1® videos, visit http://www.Formula1.comFollow F1®:http://www.instagram.com/F1https://www.facebook.com/Formula1/http://www.twitter.com/F1https://www.twitch.tv/formula1https://www.tiktok.com/@f1#F1 #TurkishGP"
"UyJwfD0_1ng","Terence Crawford Highlight Reel Knockout of Kell Brook, Pacquiao Next | FULL FIGHT HIGHLIGHTS","2020-11-15T05:45:02Z","UCbzRzJNHx7ZLlJML9BjZQVQ","Top Rank Boxing","17","PT4M44S","2d","hd","True","2020-11-17T14:31:11Z","terence crawford|terence crawford highlights|terence crawford knockouts|terence crawford vs kell brook|terence crawford vs kell brook highlights|crawford vs brook|kell brook|kell brook vs terence crawford|#CrawfordBrook|brook vs crawford|terence crawford vs kell brook full fight|crawford vs brook highlights|kell brook vs terence crawford free fight|terence crawford vs kell brook free fight|brook vs crawford highlights|crawford knocks out brook","1294307","7717","622","3909","https://i.ytimg.com/vi/UyJwfD0_1ng/default.jpg","False","False","Watch highlights from the main event of #CrawfordBrook featuring #TerenceCrawford and #KellBrook. In the fight, Crawford knocks out Brook in the 4th round.Try ESPN+ For Free: https://watch.espnplus.com/toprank/Subscribe to our YouTube channel to get notified about the latest highlights, free full fights, and fight week content as it's posted.Follow Top Rank on Twitter: http://www.twitter.com/trboxingFollow Top Rank on Instagram: http://www.instagram.com/toprankLike Top Rank on Facebook: http://www.facebook.com/trboxing"
"PiIPCt2olcw","To Be Continued...","2020-11-16T21:00:05Z","UCY4AlDv6wL2qhrX29iwdqAg","2HYPE","24","PT8M32S","2d","hd","True","2020-11-17T14:31:11Z","2hype|lsk|kristopher london|jsr|jesser|cash|zackttg|mopi|jiedel|moochie|nadeshot|100 thieves","670049","62911","634","5843","https://i.ytimg.com/vi/PiIPCt2olcw/default.jpg","False","False","Stay tuned....Part 2: https://youtu.be/gtZv_7tkYNc⭐ 2HYPE Merch ⭐● https://2hype.com★Follow us on Socials!★●Instagram https://www.instagram.com/2hypehouse/●Twitter https://twitter.com/official2HYPEThanks @Nadeshot for being in the video★2HYPE MEMBERS★● JESSER -Channel: https://www.youtube.com/user/JesserPlaysInstagram https://www.instagram.com/jesser/● KRIS -Channel: https://www.youtube.com/KristopherLondonInstagram: https://www.instagram.com/iamkrislondon/● JAMES -Channel: https://www.youtube.com/user/JiedelPlaysInstagram: https://www.instagram.com/jiedel/● CASH -Channel: https://www.youtube.com/user/WhatChaMaCallingInstagram: https://www.instagram.com/cashnasty/● ZACK -Channel: https://www.youtube.com/channel/UCTs5PJGf9AwnA7mNV3ejNTQInstagram: https://www.instagram.com/zackttg/● MOPI -Channel: https://www.youtube.com/channel/UCOYSYNsxTfGTGbMu2c-kpfgInstagram: https://www.instagram.com/commonmopi/● MOOCHIE - Instagram - https://www.instagram.com/moochieyt/Channel - https://www.youtube.com/channel/UCY-BsNVd33_mzyXQzMorv1Q#2HYPE"
"QLEDRiPD63g","I Won’t Lose - Jake Paul Vs Nate Robinson (Episode 2)","2020-11-16T19:41:10Z","UCcgVECVN4OKV6DH1jLkqmcA","Jake Paul","22","PT8M2S","2d","hd","True","2020-11-17T14:31:11Z","jake paul","519446","36033","2880","3179","https://i.ytimg.com/vi/QLEDRiPD63g/default.jpg","False","False","I Won’t Lose gives viewers a look inside our lives during boxing camp as Nate and I train and prepare for battle on November 28thEPISODE 3 NEXT MONDAY, STAY TUNED.PPV for sale now on TysonOnTriller.com (http://tysonontriller.com/)Tune in 11. 28 at 9 pm ET#JakevsNate #TysonJones#Trillertext me im bored - 310-870-3349🔴SUBSCRIBE ➤ http://bit.ly/SUB2JAKEPAUL ↪ watch sum mo stuff➤  LINK HEREINSTAGRAM ➤  https://www.instagram.com/JakePaul TWITTER ➤  http://twitter.com/JakePaul ⚠ WARNING ⚠Please be warned (and we cannot possibly stress this enough); under no circumstances should any challenges, stunts, or pranks be attempted by any of our viewers. All challenges, stunts, and pranks are performed by trained professionals in a controlled environment and are for entertainment purposes only. Again, do not try anything you see in this content at home and always consult a parent or adult with any questions or concerns."
"T7CmQOaniwE","Asking Charly The Question","2020-11-15T20:00:11Z","UCSdkYFmjUv1duOKorLjPh-w","Tayler Holder","1","PT5M32S","2d","hd","True","2020-11-17T14:31:11Z","tayler holder|Taylor holder|Charly jordan|asking out|girlfriend|Jason derulo|helicopter|wolfs|love|Bryce hall|viral|the compound|hype house|tik tok|triller house|asking to be my girlfriend","665283","49303","474","1393","https://i.ytimg.com/vi/T7CmQOaniwE/default.jpg","False","False","THANK YOU SO MUCH FOR WATCHING!!!SUBSCRIBE FOR WEEKLY VIDEOS![ FOLLOW MY SOCIAL MEDIA!  ]Triller: Taylerholderhttps://instagram.com/taylerholderhttps://twitter.com/taylerholderTikTok: @itstaylerholderSnapchat: @taylerEdited by: @seankennedytv"
"AWXvClaRtsI","Celebrating Maria Tallchief","2020-11-14T22:39:13Z","UCdq61m8s_48EhJ5OM_MCeGw","GoogleDoodles","10","PT1M16S","2d","hd","True","2020-11-17T14:31:11Z","[none]","0","0","0","0","https://i.ytimg.com/vi/AWXvClaRtsI/default.jpg","True","True","In honor of Native American Heritage Month in the U.S., today’s video Doodle—created in partnership with Native American guest artists Lydia Cheshewalla, Chris Pappan, and Yatika Starr Fields— celebrates Maria Tallchief, member of the Osage Nation who was America’s first, major prima ballerina. Not only a trailblazer for Native American dancers, Tallchief is widely considered one of the country’s most influential ballerinas of all time. On this day in 2007, a bronze sculpture of Tallchief and four other Native American ballerinas was unveiled in Oklahoma at the Tulsa Historical Society in a piece titled “The Five Moons” by artist Gary Henson. Learn more: http://www.google.com/doodles/celebrating-maria-tallchief-------Quote by Maria Tallchief is an excerpt of Bruce Duffie's published interview with Maria Tallchief: Conversation Piece: Prima Ballerina MARIA TALLCHIEF © Bruce Duffie The Firebird, Swan Lake and The Nutcracker: Dance of the Sugar Plum Fairy, Choreography by George Balanchine © The George Balanchine Trust-------To follow Google Doodles on YouTube, subscribe to:  @GoogleDoodles  Follow Google Doodles on Twitter at: https://twitter.com/GoogleDoodles"
"c-Nz-Jxbpgc","Souping up my shiny new Knee Scooter!","2020-11-15T18:47:43Z","UCOpP5PqrzODWpFU961acUbg","Berm Peak Express","26","PT10M21S","2d","hd","True","2020-11-17T14:31:11Z","do it yourself|diy|tools|home|backyard|mountain biking|cycling|outdoors","356865","25635","282","2606","https://i.ytimg.com/vi/c-Nz-Jxbpgc/default.jpg","False","False","A few weeks ago I broke some bones in my leg, and now I can't use my right foot for a bit. The doc gave me the okay to hobble around, so I'm adding this knee scooter to the fleet. Today we'll fix up this knee scooter and maybe even give it some parts bin upgrades!New merch and jerseys! https://cognativemtb.com/collections/seths-bike-hacks-collectionWant us to review your unique mountain bike or outdoor product? https://www.sethsbikehacks.com/product-review/Check out our main channel https://youtube.com/c/sethsbikehacksFollow me on Instagram https://instagram.com/sethsbikehacksBerm Peak Merch https://cognativemtb.com/collections/seths-bike-hacks-collectionMusic in this video is from http://share.epidemicsound.com/trQSgand https://soundstripe.com?fpr=seth20#mountainbikingI'm also working on a long-term moonshot project: Building a free public bike park in the Asheville metro area. Join my Patreon and 100% of the proceeds go towards funding this. https://www.patreon.com/sethsbikehacksAdvertising disclosure: All of these videos contain products, logos, or mentions associated with Diamondback Bicycles. Whether or not the video itself was sponsored by Diamondback, they do support this channel, and by extension, every video on it."
