video_id,title,publishedAt,channelId,channelTitle,categoryId,duration,dimension,definition,is_trending,time_retrieved,tags,view_count,likes,dislikes,comment_count,thumbnail_link,comments_disabled,ratings_disabled,description
"Wq5S8Dt_HQE","BTS (방탄소년단) 'Life Goes On' Official Teaser 1","2020-11-17T15:00:01Z","UC3IZKseVpdzPSBaWxBxundA","Big Hit Labels","10","PT27S","2d","hd","True","2020-11-17T14:31:10Z","BIGHIT|빅히트|방탄소년단|BTS|BANGTAN|방탄|BTS BE|Life Goes On|라이프 고즈 온|뮤비 티져|BE 앨범 타이틀곡","7052186","2347852","4916","271488","https://i.ytimg.com/vi/Wq5S8Dt_HQE/default.jpg","False","False","BTS (방탄소년단) 'Life Goes On' Official Teaser 1BTS (방탄소년단) 'Life Goes On' Official MV will be released at 2PM(KST), 12AM(EST) on Nov 20, 2020Credits:Director: Jeon Jung KookAssistant Director: Yong Seok Choi, Jihye Yoon (Lumpens)Director of Photography: Hyunwoo Nam (GDW)Focus Puller: Sangwoo Yun2nd AC: Eunki Kim3rd AC: Kyuwon SeoGaffer: Choi Doo Soo (DS LIGHT)Lighting Crew: Jung Yu Jin, Kim Jun O, Lee Seong Min, Kim Sung Wook, Lee HyunsuArt Director: Bona Kim, Jinsil Park (MU:E)Assistant Art Team: Yeri Kang, Minjung Kim (MU:E)Art-team Manager: ilho Heo (MU:E)Visual Creative: Nu Kim, Sabinne Cheon, Lee Sun Kyoung, Kim Ga Eun, Cha Yeon HwaArtist Management: Kim Shin Gyu, Kim Su Bin, Kim Dae Young, Park Jun Tae, An Da Sol, Ahn Jong Hun, Yun Tae Woong, Lee Seung Byeong, Lee Jung Min, Lee Hyeon KiBig Hit Entertainment. Rights are reserved selectively in the video. Unauthorized reproduction is a violation of applicable laws. Manufactured by Big Hit Entertainment, Seoul, Korea.Connect with BTS: https://ibighit.com/bts http://twitter.com/BTS_bighithttp://twitter.com/BTS_twt http://www.facebook.com/bangtan.official https://www.youtube.com/user/BANGTANTV http://instagram.com/BTS.bighitofficial https://channels.vlive.tv/FE619 https://www.tiktok.com/@bts_official_bighithttps://weverse.onelink.me/qt3S/94808190https://www.weibo.com/BTSbighithttps://www.weibo.com/BTSmembers http://i.youku.com/btsofficial http://btsblog.ibighit.com#BTS #방탄소년단 #LifeGoesOn #BTS_BE #Teaser"
"eiOKp2RAcvs","Our First Mystery Guest | Dinner With The D'Amelios","2020-11-16T17:30:10Z","UCIoBuVIZ9F30lmZ4ddTGnzw","The D'Amelio Family","22","PT16M14S","2d","hd","True","2020-11-17T14:31:10Z","d'amelio|damelio|marc|marc d'amelio|marc damelio|heidi|heidi d'amelio|heidi damelio|dixie|dixie d'amelio|dixie damelio|charli|charli d'amelio|charli damelio|tik tok|tiktok|influencer|family|fun|sisters|mom|dad|mother|father|questions|answers|the damelios|the d'amelios|the damelio family|the d'amelio family|youtube|charlie|charlie damelio|charlie d'amelio|james charles","4474421","162887","14298","14085","https://i.ytimg.com/vi/eiOKp2RAcvs/default.jpg","False","False","For our first guest on Dinner with the D'Amelio's, we have... wait... we can't tell you that, we didn't even know who was coming. Make sure you watch to see who joined us for dinner in the first episode of our new series, Dinner With the D'Amelios.Make sure to subscribe to our channel so that you don't miss out on upcoming videos!https://www.youtube.com/thedamelios?sub_confirmation=1Follow our friend and favorite chef, Aaron Mayhttps://instagram.com/chefaaronmayDixie's Channelhttps://www.youtube.com/dixiedamelio?sub_confirmation=1Charli's Channelhttps://www.youtube.com/charlidamelio?sub_confirmation=1#dinnerwiththedamelios"
"B6_iQvaIjXw","Ariana Grande - 34+35 (official video)","2020-11-17T17:00:03Z","UC0VOyT2OCBKdQhF3BAbZ-1g","ArianaGrandeVevo","10","PT3M41S","2d","sd","True","2020-11-17T14:31:10Z","Ariana|Grande|34+35|Republic|Records|Pop|positions lyrics|positions lyrics ariana grande|ariana grande lyrics|lyrics ariana grande|lyrics ariana|ariana grande positions|positions ariana grande|ariana grande|grande ariana|ariana grande positions album|positions album ariana grande|ariana|positions|ariana positions|positions ariana|ariana grande ag6|ag6|ariana grande positions leak|positions countdown|ariana grande album","3038879","777388","7108","57218","https://i.ytimg.com/vi/B6_iQvaIjXw/default.jpg","False","False","The official “34+35” music video by Ariana Grande. Listen & download Positions (the album) here: http://arianagrande.lnk.to/positions►Subscribe to Ariana Grande: https://arianagrande.lnk.to/subscribe►Shop Exclusive Merch: https://arianagrande.lnk.to/shop►Follow Ariana Grande:https://www.arianagrande.comhttps://instagram.com/arianagrandehttps://twitter.com/arianagrandehttps://facebook.com/arianagrandeDirected by Director XOfficial “34+35” Lyrics:You might think I’m crazyThe way I been cravingIf I put it quite plainlyJust gimme them babiesSo what you doing tonight? Better say doing you rightWatching movies but we aint seen a thing tonightI don’t wanna keep you upBut show me can you keep it up ‘Cause then I’ll have to keep you upShit maybe I’mma keep you up, boyI been drinking coffee And I been eating healthy You know I keep it squeaky Saving up my energy Can you stay up all nightFuck me til the daylight 34 35Can you stay up all nightFuck me til the daylight 34 35You drink it just like water You say it taste like candySo what you doing tonight? Better say doing you rightWatching movies but we aint seen a thing tonightI don’t wanna keep you upBut show me can you keep it up ‘Cause then I’ll have to keep you upShit maybe I’mma keep you up, boyI been drinking coffeeAnd I been eating healthyYou know I keep it squeakySaving up my energyCan you stay up all nightFuck me til the daylight 34 35Can you stay up all nightFuck me til the daylight 34 35Baby you might need a seatbelt when I ride itI’mma leave it open like a door, come inside itEven though I’m wifey you can hit it like a side chickDon’t need no side dick, noGot the neighbors yelling earthquake4.5 when I make the bed shakePut it down heavy even though it’s lightweightYeah we started at midnightGo til the sunriseDone at the same timeBut who’s counting the time when we got it for lifeI know all your favorite spotsWe can take it from the topYou such a dream come true trueMake a bitch wanna hit snooze oohCan you stay up all nightFuck me til the daylight 34 35Can you stay up all nightFuck me til the daylight 34 35Means I wanna 69 witchaAww shit#ArianaGrande #positions #34+35Music video by Ariana Grande performing 34+35. © 2020 Republic Records, a division of UMG Recordings, Inc."
"AQuucamIYjQ","Animal Crossing: New Horizons - Free Winter Update - Nintendo Switch","2020-11-17T14:00:01Z","UCGIY_O-8vW4rfX98KlMkvRg","Nintendo","20","PT2M1S","2d","hd","True","2020-11-17T14:31:10Z","nintendo|play|play nintendo|game|gameplay|fun|video game|kids|action|adventure|rpg|Animal Crossing|ACNH|Nintendo Switch|Franklin|Jingle|Toy Day|Turkey Day|holidays|winter|fall|update","573239","48437","244","6563","https://i.ytimg.com/vi/AQuucamIYjQ/default.jpg","False","False","New seasonal events, Reactions, hairstyles, save data transfer, and more! Get ready to celebrate the heartwarming holiday festivities with the free Winter update, coming to Animal Crossing: New Horizons on November 19! Learn more: https://www.nintendo.com/games/detail/animal-crossing-new-horizons-switch/#AnimalCrossing #ACNH #NintendoSwitchSubscribe for more Nintendo fun! https://goo.gl/HYYsotVisit Nintendo.com for all the latest! http://www.nintendo.com/Like Nintendo on Facebook: http://www.facebook.com/NintendoFollow us on Twitter: http://twitter.com/NintendoAmericaFollow us on Instagram: http://instagram.com/NintendoFollow us on Pinterest: http://pinterest.com/Nintendo"
"3hK540tMmvw","Crew-1 Mission | Rendezvous and Docking","2020-11-17T07:26:36Z","UCtI0Hodo5o5dUb67FeUjDeA","SpaceX","28","PT10H47M15S","2d","hd","True","2020-11-17T14:31:10Z","SpaceX|Space|Crew-1|Crew|Dragon|Crew Dragon|Commercial Crew|Elon Musk|Musk|Falcon 9|Victor Glover|Mike Hopkins|Michael Hopkins|Shannon Walker|Soichi Noguchi|NASA|JAXA|Astronaut|Crew-1 Mission|Astronauts|Rendezvous and Docking","3078167","65002","1445","1042","https://i.ytimg.com/vi/3hK540tMmvw/default.jpg","False","False","SpaceX and NASA are targeting Sunday, November 15 for Falcon 9’s launch of Dragon’s first operational crew mission (Crew-1) to the International Space Station (ISS) from historic Launch Complex 39A (LC-39A) at NASA’s Kennedy Space Center in Florida. The instantaneous launch window opens at 7:27 p.m. EST on November 15, 00:27 UTC on November 16. Following stage separation, SpaceX will attempt to land Falcon 9’s first stage on the “Just Read the Instructions” droneship, which will be stationed in the Atlantic Ocean. The launch webcast will go live about 4 hours before liftoff. Tune in here to watch live."
"ARoQMFC4ROc","WE ARE PREGNANT !!!","2020-11-17T02:30:02Z","UCTvgnaLSfM5nqrabqrRJXMg","LVE FAMILY","1","PT25M15S","2d","hd","True","2020-11-17T14:31:10Z","PregNant|Pregnancy announcement|Lauramellado|Lauras-Boutique.com|Emotional|Victootall|Baby|Gender reveal|Wearepregnant|Announcement|Pregnancy|Lvefamily|Elliott Hallman|Friends|Family","505549","52533","517","8217","https://i.ytimg.com/vi/ARoQMFC4ROc/default.jpg","False","False","OUTFIT IM WEARING :https://lauras-boutique.com/products/elsie-3-piece-cognac-1?_pos=1&_sid=8b7d1fc6c&_ss=r USE CODE lblovesyou for 25% !SONG IS CALLED : SAPPHEIROS - PASSION LVE FAM WERE HAVING ANOTHER BABY!!!!!! We will never be able to put into words how thankful we are for all you! You guys show so much love on a daily basis,  we hope you guys wanna follow along on our journey because we have so much to share! Cant wait for you guys to see it all ! WE LOVE YOU!!!!!!!!!!USE CODE lblovesyou for 25 % off website !***FOLLOW US ON SOCIAL MEDIA***BUSINESS INQUIRIES : Laura@revel-mgmt.com ❤️LAURA'S SOCIAL MEDIA https://www.instagram.com/lauramellado/SNAPCHAT : lauramelladoTIK TOK : @LAURASMELLADOTWITTER : @LAURASMELLADOVICTOR'S SOCIAL MEDIAhttps://www.instagram.com/victootall/...Snapchat : victootallTIKTOK : @VICTOOTALL"
"JPZBiGdQs7o","DABABY - BLIND ft. YOUNG THUG (Official Video)","2020-11-16T13:35:50Z","UC2CCXzC56k0b8L49R_iW-Yw","DaBaby","10","PT3M42S","2d","hd","True","2020-11-17T14:31:10Z","DaBaby|Baby Jesus|Charlotte|Hip Hop|Rap","2177756","170882","2559","10885","https://i.ytimg.com/vi/JPZBiGdQs7o/default.jpg","False","False","Directed By: Motion Family"
"aT4rITutAwA","Watch NASA's SpaceX Crew-1 Mission Arrive at the International Space Station","2020-11-17T07:16:06Z","UCLA_DiR1FfKNvjuUpBHmylQ","NASA","28","PT3H31M12S","2d","hd","True","2020-11-17T14:31:10Z","[none]","988151","24288","456","0","https://i.ytimg.com/vi/aT4rITutAwA/default.jpg","True","False","Tune in live as the Crew Dragon Resilience spacecraft docks to the International Space Station with astronauts Michael Hopkins, Shannon Walker, and Victor Glover of NASA and Soichi Noguchi of JAXA (Japan Aerospace Exploration Agency) aboard. The four astronauts will begin a six-month science mission on the station. Docking is scheduled at 11 p.m. EST (4 a.m. UTC), Monday, Nov. 16 followed by the hatch opening at 1:10 a.m. EST (6:30 a.m. UTC), and a welcome ceremony at 1:40 a.m. EST (6:40 a.m. UTC) Tuesday, Nov. 17.Download Link: https://images.nasa.gov/details-Crew-1%20Docking,%20Hatch%20Opening%20and%20Welcoming%20Ceremony"
"f_Xa3yozQvE","Dre SMP","2020-11-16T17:27:16Z","UCv3Kk__aFcKKx_o2686uQcw","SAD-ist","20","PT26S","2d","hd","True","2020-11-17T14:31:10Z","[none]","1669286","238211","1466","18193","https://i.ytimg.com/vi/f_Xa3yozQvE/default.jpg","False","False","Youre welcome, Karl"
"0xrIoYlJWNo","Ultimate Balance","2020-11-16T19:00:01Z","UCSUf5_EPEfl4zlBKZHkZdmw","Danny Gonzalez","23","PT21M3S","2d","hd","True","2020-11-17T14:31:10Z","danny gonzalez|funny|commentary|comedy|react|reaction|reacting|awful|humor","1135212","121027","656","11270","https://i.ytimg.com/vi/0xrIoYlJWNo/default.jpg","False","False","Use code TRULYGREG90 to get $90 off your first five HelloFresh boxes including free shipping on your first box at https://bit.ly/3jVVdg1. Offer may vary by subscription sizecheck it out Support MeMERCH ► http://dannygonzalez.storeFollow MeINSTAGRAM ► https://www.instagram.com/dannygonzalez/TWITTER ► https://twitter.com/dannygonzalezSECOND CHANNEL ► https://www.youtube.com/c/2Danny2FuriousSPOTIFY ► https://open.spotify.com/artist/6pDkmNhHCLh7YEb3sXceOs?si=8ZpMgF41SoufOS1UZ4vbkgWHY DO I CALL MY FANS GREG?Greg is the strongest family on the internet, we're the fastest growing channel on Youtube, and we make fire content. So, instead of making up some pun using my name and calling my fans that, I decided to use a different name entirely. A name so strong, haters tremble when it is spoken. WE ARE GREG. AND WE ARE TAKING OVER THE INTERNET. And all you have to do to join is hit subscribe and turn on notifications. #dannygonzalez"
"yHlCtUjf_AI","Ken Block’s 1,400hp AWD Ford Mustang Hoonicorn vs. a McLaren Senna Merlin // Hoonicorn Vs the World","2020-11-16T17:00:15Z","UCXlfi8sf6cKGQ8sOd0-yRuw","Hoonigan","2","PT16M","2d","hd","True","2020-11-17T14:31:10Z","Ken Block|Ken Block Mustang|Ken Block Ford Mustang|Hoonicorn|Hoonicorn RTR|Ken Block AWD Mustang|twin turbu Mustang|Ford Mustang Racing|Hoonicorn drag race|Forza|Forza Horizon|McLaren|McLaren Senna|Hoonigan This vs. That|Hoonigan Drag race show|McLaren Senna Merlin|Forza Horizon 4","1358757","44344","1018","4476","https://i.ytimg.com/vi/yHlCtUjf_AI/default.jpg","False","False","Welcome to Hoonicorn vs. the World: a show inspired by gameplay from Forza Horizon, brought to real life! Today’s matchup? Hoonicorn vs. hypercar. This 1 of 1 McLaren Senna Merlin edition is one of the fastest hypercars around right now, so we line it up with the Hoonicorn to see what happens in a straight line race against the two. Will light weight, a bunch of technology, and lightning fast shifts help this Senna eke out a victory over the monstrous Hoonicorn?Hoonicorn vs. the World is brought to you by:Forza https://forzamotorsport.net/IG: https://www.instagram.com/forzahorizonofficial/FB: https://www.facebook.com/ForzaHorizonToyo Tireshttps://www.toyotires.comIG: https://www.instagram.com/toyotires/FB: https://www.facebook.com/ToyoTiresFord Performancehttp://www.fordperformance.com/IG: https://www.instagram.com/fordperformance/FB: https://www.facebook.com/FordPerformanceMcLaren Driver- @nickiannotti /  @klingdogMcLaren Senna sales inquires- @amber_blonigan Do you want one of the cleanest 1JZ swapped 240SXs (that we) ever built? Now YOU have a chance at taking it home. Get all the details here: http://www.hoonigan.com/giveaway We’ve got channels for all your car content needs. Subscribe, nerds.The Hoonigans: https://www.youtube.com/user/TheHoonigans?sub_confirmation=1Project Cars: https://www.youtube.com/c/HooniganProjectCars??sub_confirmation=1Daily Transmission: http://www.youtube.com/c/HooniganDailyTransmission?sub_confirmation=1Ken Block: https://www.youtube.com/KenBlockHHIC?sub_confirmation=1AutoFocus: https://www.youtube.com/channel/UCuGuOqcXsgzL3YrguODoGXw?sub_confirmation=1Bonus: https://www.youtube.com/channel/UCFhUumuHyYL-mAXSeZVbqMg?sub_confirmation=1Stay fresh with the latest apparel: https://www.hoonigan.com/thenewnewFacebook: https://www.facebook.com/TheHoonigans/Instagram: https://www.instagram.com/thehoonigans/Follow Our Crew:@brianscotto@hertlife@vin_tra@dangerdan3@mister_zachary@jchase7452@nadsynads@larry_chen_foto@suppymk4@amezcua_fs1@roncarAnd don’t forget to turn on notifications so you don’t miss out on our latest uploads!https://www.hoonigan.com/"
"ZeerrnuLi5E","aespa 에스파 'Black Mamba' MV","2020-11-17T09:00:22Z","UCEf_Bc-KVd7onSeifS3py9g","SMTOWN","10","PT3M50S","2d","hd","True","2020-11-17T14:31:10Z","에스파뮤비|SM신인걸그룹|KPOP|SM New Girl Group","12263423","1133292","20057","219469","https://i.ytimg.com/vi/ZeerrnuLi5E/default.jpg","False","False","aespa's debut single Black Mamba is Out!🎧Listen and download on your favorite platform: https://smarturl.it/aespa_BlackMamba🐍Black Mamba MV: https://youtu.be/ZeerrnuLi5ESubscribe to aespa Official YouTube Channel!https://www.youtube.com/aespa?sub_confirmation=1aespa officialhttps://www.youtube.com/c/aespahttps://www.instagram.com/aespa_officialhttps://twitter.com/aespa_Officialhttps://www.facebook.com/aespa.officialhttps://weibo.com/aespa#aespa #æspa #BlackMamba #블랙맘바 #에스파aespa 에스파 'Black Mamba' MV ℗ SM Entertainment"
"kP9TfCWaQT4","TOM & JERRY - Official Trailer","2020-11-17T17:00:04Z","UCjmJDM5pRKbUlVIzDYYWb6g","Warner Bros. Pictures","24","PT2M25S","2d","hd","True","2020-11-17T14:31:10Z","chloe grace moretz|michael pena|ken jeong|nicky jam|colin jost|tom and jerry|cartoon|cat|mouse","456175","57571","3742","0","https://i.ytimg.com/vi/kP9TfCWaQT4/default.jpg","False","False","Tom and Jerry take their cat-and-mouse game to the big screen. Watch the trailer for the new #TomAndJerryMovie now – coming to theaters 2021.One of the most beloved rivalries in history is reignited when Jerry moves into New York City’s finest hotel on the eve of “the wedding of the century,” forcing the event’s desperate planner to hire Tom to get rid of him, in director Tim Story’s “Tom & Jerry.”  The ensuing cat and mouse battle threatens to destroy her career, the wedding and possibly the hotel itself. But soon, an even bigger problem arises: a diabolically ambitious staffer conspiring against all three of them. An eye-popping blend of classic animation and live action, Tom and Jerry’s new big-screen adventure stakes new ground for the iconic characters and forces them to do the unthinkable… work together to save the day.    “Tom & Jerry” stars Chloë Grace Moretz (“Neighbors 2: Sorority Rising,” “The Addams Family”), Michael Peña (“Cesar Chavez,” “American Hustle,” “Ant-Man”), Rob Delaney (“Deadpool 2,” “Fast & Furious Presents: Hobbs & Shaw”), Colin Jost (“How to be Single,” “Saturday Night Live”), and Ken Jeong (“Crazy Rich Asians,” “The Hangover,” “Transformers: Dark of the Moon”).  The film is directed by Tim Story (“Fantastic Four,” “Think Like a Man,” “Barbershop”) and produced by Chris DeFaria (“The LEGO Movie 2,” “Ready Player One,” “Gravity”).  It is written by Kevin Costello, based on characters created by William Hanna and Joseph Barbera.  Serving as executive producers are Tim Story, Adam Goodman, Steven Harding, Sam Register, Jesse Ehrman, and Allison Abbate. The creative filmmaking team includes director of photography Alan Stewart, production designer James Hambidge, editor Peter S. Elliot, and costume designer Alison McCosh.  The music is composed by Christopher Lennertz.  A Warner Bros. Pictures and Warner Animation Group presentation, a Tim Story Film, “Tom & Jerry” will be distributed worldwide by Warner Bros. Pictures. The film is rated PG for cartoon violence, rude humor and brief language."
"q9o53c0pc5k","Finding Out I'm Pregnant + Telling My Husband","2020-11-17T03:26:11Z","UCcCLyk1Te4ioNycEoKdunbg","Karina Bear Vlogs","22","PT16M40S","2d","hd","True","2020-11-17T14:31:10Z","[none]","241251","22352","365","1472","https://i.ytimg.com/vi/q9o53c0pc5k/default.jpg","False","False","we are thrilled to announce we are having our Rainbow Baby coming 2021! WE ARE SO HAPPY AND I CANT WAIT!!! Thank you so much for all your well wishes, we are overjoyed. I love you guys so much and can't wait to share this journey with you.Announcement Photographer & Cinimatic Shots Announcement Video: Instagram: @joelfilms"
"bnChQbxLkkI","Crew-1 Mission | Launch","2020-11-16T01:06:24Z","UCtI0Hodo5o5dUb67FeUjDeA","SpaceX","28","PT4H33M15S","2d","hd","True","2020-11-17T14:31:10Z","SpaceX|Space|Crew-1|Crew-1 Mission|Launch|Dragon|Crew Dragon|Commercial Crew|Elon Musk|Musk|Astronaut|Astronauts|Victor Glover|Mike Hopkins|Michael Hopkins|Shannon Walker|Soichi Noguchi|NASA|JAXA|ISS|International Space Station","4664128","122872","2245","3649","https://i.ytimg.com/vi/bnChQbxLkkI/default.jpg","False","False","Coast Phase: https://youtu.be/eVB02SSeqgQSpaceX and NASA are targeting Sunday, November 15 for Falcon 9’s launch of Dragon’s first operational crew mission (Crew-1) to the International Space Station (ISS) from historic Launch Complex 39A (LC-39A) at NASA’s Kennedy Space Center in Florida. The instantaneous launch window opens at 7:27 p.m. EST on November 15, 00:27 UTC on November 16. Following stage separation, SpaceX will attempt to land Falcon 9’s first stage on the “Just Read the Instructions” droneship, which will be stationed in the Atlantic Ocean. The launch webcast will go live about 4 hours before liftoff. Tune in here to watch live."
"2qN7TkyoH4E","10 Games That COPIED Among Us","2020-11-15T22:40:54Z","UCYBetkejPxK8t_41zueazcA","T5G","20","PT8M44S","2d","hd","True","2020-11-17T14:31:10Z","among us|10 Games That COPIED Among Us|among us ripoff|among us ripoffs|among us copy|among us 2|fake among us|among us new|new among us|among us new update|new among us update|among us updates|update among us|ripoff among us|among us ripped off|among us secrets|among|us|new|update|video","2899850","155713","5254","9609","https://i.ytimg.com/vi/2qN7TkyoH4E/default.jpg","False","False","10 Games That COPIED Among UsVideo Sources (Go Subscribe)https://pastebin.com/FgnM9BVhFollow us on Instagram & Twitter to be informed when we post:https://twitter.com/Top5Gamingxhttps://www.instagram.com/top5gamingx/Check out Other Among Us Videos Here15 AMONG US Tips & Tricks EVERYONE Should Know (1000 IQ)https://www.youtube.com/watch?v=29_8bhzjTqI15 Among Us SECRETS You MISSED!https://www.youtube.com/watch?v=TyahPGDr4-E10 SECRET Among Us Easter Eggshttps://www.youtube.com/watch?v=nzo9MBH91k8AMONG US, but with 99 IMPOSTORShttps://www.youtube.com/watch?v=YTZ-GZPTND8This Among Us Video is based around the 10 Games That COPIED Among Us, For more among us tips & tricks, among us secrets, among us best moments & more subscribe."
"Scl5NRK7hu8","FaZe Adapt vs FaZe Rug - $10,000 1v1","2020-11-16T22:26:03Z","UCi87kxosIT3wrnEA-mv4jWA","FaZe Adapt","22","PT11M26S","2d","hd","True","2020-11-17T14:31:10Z","Adapt|FaZeClan|FaZe Gaming","442459","34944","393","2085","https://i.ytimg.com/vi/Scl5NRK7hu8/default.jpg","False","False","Playing FaZe Rug for $10,0000 (1v1)....Let me know what video you guys wanna see next in the comments! Leave a like if you enjoyed!👉 SUBSCRIBE ► http://bit.ly/SubAdapt ► Instagram: http://instagr.am/TheFaZeAdapt► Twitter: https://twitter.com/FaZeAdapt► Snapchat: https://www.snapchat.com/add/AdaptAlexEdited by Waff: https://twitter.com/coL_Waffster"
"DJiUZYy9Bf4","Category 5 Hurricane Iota packing 195 mph wind gusts","2020-11-16T17:28:25Z","UCjpzEgbbDUg4YC6vpSrzsyg","WKMG News 6 ClickOrlando","25","PT1M5S","2d","hd","True","2020-11-17T14:31:10Z","central america|hurricane iota|hurricane season|weather|tropics","440326","1048","138","424","https://i.ytimg.com/vi/DJiUZYy9Bf4/default.jpg","False","False","Hurricane Iota rapidly strengthened Monday into a Category 5 storm that is likely to bring catastrophic damage to the same part of Central America already battered by a powerful Hurricane Eta less than two weeks ago."
"rbtybA7xT2M","Pokémon: Twilight Wings—The Gathering of Stars","2020-11-17T15:01:10Z","UCFctpiB_Hnlk3ejWfHqSm6Q","The Official Pokémon YouTube channel","20","PT6M26S","2d","hd","True","2020-11-17T14:31:10Z","[none]","231456","25833","175","0","https://i.ytimg.com/vi/rbtybA7xT2M/default.jpg","False","False","Big plans and bigger adventures unfold in the newest Pokémon: Twilight Wings episode! 🌟🌠 Travel with Leon to the Isle of Armor as he gathers the best Trainers from Galar in the newest episode of Pokémon: Twilight Wings—The Gathering of Stars!Official site: https://www.pokemon.comShop: http://www.pokemoncenter.comFacebook: http://www.facebook.com/Pokemon Twitter: http://www.twitter.com/Pokemon Instagram: http://www.instagram.com/pokemon"
"LqYsc7Wm0Bc","Red VS Blue (Rooster Teeth) | DEATH BATTLE!","2020-11-16T18:00:09Z","UCB9_VH_CNbbH4GfKu8qh63w","DEATH BATTLE!","24","PT20M18S","2d","hd","True","2020-11-17T14:31:10Z","DEATH BATTLE|Rooster Teeth|RT|DBX|DEATH BATTLE Cast|screwattack|red vs blue|redvsblue|rvb|sarge|caboose|church|tex|grif|donut|simmons|lopez|tucker|red vs blue zero|rvb zero|freelancer|project freelancer|leonard church|roosterteeth|burnie burns|matt hullum|gus sorola|geoff ramsey|deathbattle|ben singer|chad james|machinima|animated battle|3D animation|animated fight|animation|versus|who would win|comedy|halo|xbox|series x|halo infinite|combat evolved","572275","34424","1554","7238","https://i.ytimg.com/vi/LqYsc7Wm0Bc/default.jpg","False","False","A 17-year-long rivalry comes to an end! Who would really win Blood Gulch?Go to http://harrys.com/death and redeem your trial offer today!Go to http://keeps.com/death to receive your first month of treatment for FREE!Check out Episode 1 of RvB Zero for free at https://roosterteeth.com/series/red-vs-blue Get the MUSIC: - “Wiz & Boomstick – Death Battle ThemeDownload Link: http://www.bit.ly/DeathBattleTheme- Blood Gulch Bedlam - Battle MusicDownload Link: https://bit.ly/BloodGulchBedlamOFFICIAL DEATH BATTLE SUGGESTION FORM: http://bit.ly/DBRequestFormClick to SUBSCRIBE: http://bit.ly/SubToDeathBattle►Our Twitter: https://twitter.com/DEATHBATTLE►Our Store: http://bit.ly/DeathBattleStore►Watch our stuff early: http://bit.ly/2m9WLsZ►Follow the hosts on Twitter:Ben - https://twitter.com/BenBSingerChad - https://twitter.com/ChadJamesRT"
