video_id,title,publishedAt,channelId,channelTitle,categoryId,duration,dimension,definition,is_trending,time_retrieved,tags,view_count,likes,dislikes,comment_count,thumbnail_link,comments_disabled,ratings_disabled,description
"GLoeAJUcz38","Push This Red Button For $100,000","2020-11-14T21:00:02Z","UCX6OQ3DkcsbYNE6H8uQQuVA","MrBeast","24","PT15M24S","2d","hd","True","2020-11-14T18:20:21Z","[none]","3964325","425461","3574","23804","https://i.ytimg.com/vi/GLoeAJUcz38/default.jpg","False","False","Push the red subscribe button and you could also win $100,000! (Seriously, we always fly subscribers down lol)New Merch - https://shopmrbeast.com/SUBSCRIBE OR I TAKE YOUR DOG╔═╦╗╔╦╗╔═╦═╦╦╦╦╗╔═╗║╚╣║║║╚╣╚╣╔╣╔╣║╚╣═╣ ╠╗║╚╝║║╠╗║╚╣║║║║║═╣╚═╩══╩═╩═╩═╩╝╚╩═╩═╝----------------------------------------------------------------follow all of these or i will kick you• Facebook - https://www.facebook.com/MrBeast6000/• Twitter - https://twitter.com/MrBeastYT•  Instagram - https://www.instagram.com/mrbeast--------------------------------------------------------------------"
"AWXvClaRtsI","Celebrating Maria Tallchief","2020-11-14T22:39:13Z","UCdq61m8s_48EhJ5OM_MCeGw","GoogleDoodles","10","PT1M16S","2d","hd","True","2020-11-14T18:20:21Z","[none]","0","0","0","0","https://i.ytimg.com/vi/AWXvClaRtsI/default.jpg","True","True","In honor of Native American Heritage Month in the U.S., today’s video Doodle—created in partnership with Native American guest artists Lydia Cheshewalla, Chris Pappan, and Yatika Starr Fields— celebrates Maria Tallchief, member of the Osage Nation who was America’s first, major prima ballerina. Not only a trailblazer for Native American dancers, Tallchief is widely considered one of the country’s most influential ballerinas of all time. On this day in 2007, a bronze sculpture of Tallchief and four other Native American ballerinas was unveiled in Oklahoma at the Tulsa Historical Society in a piece titled “The Five Moons” by artist Gary Henson. Learn more: http://www.google.com/doodles/celebrating-maria-tallchief-------Quote by Maria Tallchief is an excerpt of Bruce Duffie's published interview with Maria Tallchief: Conversation Piece: Prima Ballerina MARIA TALLCHIEF © Bruce Duffie The Firebird, Swan Lake and The Nutcracker: Dance of the Sugar Plum Fairy, Choreography by George Balanchine © The George Balanchine Trust-------To follow Google Doodles on YouTube, subscribe to:  @GoogleDoodles  Follow Google Doodles on Twitter at: https://twitter.com/GoogleDoodles"
"c_OrdkJQJX0","Donald Trump motorcade drives by supporters protesting US election results","2020-11-14T17:28:34Z","UCIRYBXDze5krPDzAEOxFGVA","Guardian News","25","PT57S","2d","sd","True","2020-11-14T18:20:21Z","donald trump|world|gdnpfpnewsworld|trump|news|maga|maga rally|maga protest|maga demonstration|trump protest|trump demonstration|biden|joe biden|us president|us president-elect|washington dc|washington|republican|pro-trump|pro-trump demonstration|pro-trump protest|pro-trump washington|election|us election|us election result|result|trumper|trumpers|pro-trumpers|trump news|motorcade|trump motorcade","482337","9776","1565","3564","https://i.ytimg.com/vi/c_OrdkJQJX0/default.jpg","False","False","Donald Trump's motorcade drove past supporters protesting the US election results on Saturday. Trump was on his way to a nearby golf course in northern Virginia when he reportedly intentionally chose the route. He passed his supporters in Washington DC demonstrating against the results of the presidential election, which Joe Biden won. Pro-Trump demonstrations are scheduled to take place across the US on 14 November, with counter protests also planned"
"3Kz2vYa5ZPA","The Fresh Prince of Bel-Air Reunion Trailer","2020-11-13T13:00:02Z","UCKuHFYu3smtrl2AwwMOXOlg","Will Smith","24","PT2M24S","2d","hd","True","2020-11-14T18:20:21Z","comedy|entertainment|will smith|will|smith|smiths|willsmith|will smith youtube|youtube will smith|will smith channel|channel will smith|will youtube|youtube will|smith youtube|youtube smith|will smith vlogs|vlogs will smith|vlogs|vlog|will smith youtube channel|fresh prince|the fresh prince of bel air|bel air|bel-air|fresh prince of bel air|fresh prince of bel-air|dance|carlton|theme song","3994596","112403","2977","6888","https://i.ytimg.com/vi/3Kz2vYa5ZPA/default.jpg","False","False","30 years later, we're bringing the Banks family back together! Join Will and Tatyana Ali, Karyn Parsons, Joseph Marcell, Daphne Maxwell Reid, Alfonso Ribeiro and DJ Jazzy Jeff, for a funny and heartfelt night full of music and dancing in honor of the show that ran for six seasons and 148 episodes. Streaming November 19 on @HBO Max.► SUBSCRIBE: https://goo.gl/BUjQW8________________________► WATCH MOREMost Recent Videos: https://goo.gl/pqjbrRBest Of Will Smith: https://goo.gl/P3jjA3► FOLLOW WILLInstagram: https://instagram.com/willsmithFacebook: https://facebook.com/willsmithTikTok: https://tiktok.com/@willsmith________________________◈ Channel Managed by Westbrook Mediahttp://westbrookentertainment.com#FreshPrince #FreshPrinceReunion #WillSmith"
"j0qfH4CKQa8","Kevin Gates - Give It All I Got (Prod by Drumma Boy)","2020-11-14T17:22:25Z","UCj2GTFekdV3EUsTVN8oaEqA","kevingatesTV","10","PT3M4S","2d","hd","True","2020-11-14T18:20:21Z","kevin gates|kevin|gates|atlantic|atlantic records|how we livin|2 phones|really really|by any means 2|BWA|BreadWinnersAssociation|OfficialBWA","250923","25492","196","1807","https://i.ytimg.com/vi/j0qfH4CKQa8/default.jpg","False","False","Subscribe for more official content from Kevin Gates:https://kevingates.lnk.to/SubscribeFollow GatesInstagram: http://instagram.com/iamkevingatesTwitter: http://twitter.com/iamkevingatesFacebook: https://facebook.com/kvngatesSoundcloud: https://soundcloud.com/kevingatesWebsite: http://www.kvngates.comThe official YouTube channel of Atlantic Records artist Kevin Gates. Subscribe for the latest music videos, performances, and more."
"RWn2geHzfVM","Nba YoungBoy -Thrasher (music video)","2020-11-14T09:22:50Z","UClW4jraMKz6Qj69lJf-tODA","YoungBoy Never Broke Again","10","PT2M49S","2d","hd","True","2020-11-14T18:20:21Z","[none]","989810","86411","1041","6034","https://i.ytimg.com/vi/RWn2geHzfVM/default.jpg","False","False",""
"5fJfBJN-cnQ","food fight","2020-11-14T16:25:25Z","UCOsATJw-IZgqGT8MFrHjKGg","Ice Cream Sandwich","23","PT5M8S","2d","hd","True","2020-11-14T18:20:21Z","icecreamsandwich|ice cream sandwich|animation|story|food fight|youtooz","491466","87997","294","5381","https://i.ytimg.com/vi/5fJfBJN-cnQ/default.jpg","False","False","juicy youtooz giveaway: http://icecreamsandwich.youtooz.com/ OOOOHHHH 2 VIDEOS IN LESS THAN 28 DAYS????HOW DID HE DO IT??? ˢˡᵉᵉᵖ ᵈᵉᵖʳᶦᵛᵃᵗᶦᵒⁿThis video was about a food fight I experienced back in jr high school. It was uneventful but eventful at the same time. More chaos than food fight if I'm honest. But you probably already know that because who reads the description before watching the video am I right.It was a bad time because we got punished in an intense way, but it was also a good time because it was really crazy to be a part of. School isn't always that great so to be able to spice things up with U̴̡̧̕N̵̩̠̓́R̶̰̪̒Ė̶̘̟L̸̙̤̿E̸̜͖͌N̴̦̪̈́T̵͗̔͜Ĩ̷͙͊N̸͍̞̎G̴͉̯̊̑ ̶̣̈́D̷͉͐Ĕ̴̱͋S̸̨̰̿̋T̴̙̲̋R̵̮̩̐̓Ú̸͕̊C̴͇̹̓T̶̙̏̔ͅĬ̷̤Ô̵̡̰͘N̸̞̊ ̶̝̦͆́Â̵̮͚͋N̷͉̓D̷̳͉̏ ̷̡̿C̷̘̿H̵̘̖̐A̶̠̅O̷̧̓S̶͔̽ is a fun way to keep things interesting. If you're in high school or whatever try D̷͕̒I̵̡͙̎S̷̳̝̐M̸̤͕̆A̴̟̙̒͑N̷̐̍ͅT̸͓̽̈L̴̞̜̔Ị̷̾͊Ņ̷̌͝ͅḠ̵̣̱ ̴͈̠͒̇T̵̬̳̽͘H̷̦͗̃Ë̶͎̣́̽ ̴̭̹̒S̸̖͑Y̸̳͋̈S̴̺̳̾̿T̸̢̲̓E̴̯̒M̶͖̙̍͝ to get through the day it might be fun.I also partnered with youtooz to create a little icecreamsandwich figurine. I talk about it at the end of the video. If you follow me outside of youtube you probably know that by know. It's exciting actually it turned out great. I hope you like it too!Oh also I am starting another channel to put my short animations on. Usually I post them to tiktok or instagram or twitter but I think putting them on youtube. It might be the main home for them in the future. I'm still working on setting it up so things might change. Check it out here if you're in to that kind of thing: https://www.youtube.com/channel/UC6KVHFHpCwujbw2TfKnQ3uQthanks for watching ❤️ see you next video.👕 merch:https://crowdmade.com/collections/icecreamsandwich📱 twitter:https://twitter.com/ICSandwichGuy📷 instagram:https://www.instagram.com/icecreamsandwichguy/DISCLAIMER: Ice Cream Sandwich content is inappropriate for children under 13 years old. For children over 13 years old, parental discretion is advised. Ice Cream Sandwich does not control the comments produced by third-party users. By watching, reading, or otherwise consuming Ice Cream Sandwich content, you agree that (1) you are over the age of 13 years, (2) you agree to abide by Youtube's Terms of Service, and (3) you agree you have read and accept the disclaimer available at https://www.youtube.com/icecreamsandwich/about"
"9vMLTcftlyI","Lil Nas X - HOLIDAY (Official Video)","2020-11-13T05:00:28Z","UCtTfSyci2urfwXXu_eRpNRA","LilNasXVEVO","10","PT2M48S","2d","sd","True","2020-11-14T18:20:21Z","Lil Nas X Holiday Song|Lil Nas X Holiday|Old Town Road|Lil Nas X Old Town Road|Holiday Lil Nas X|Nas X|Nas|Alternative Music|X Nas Lil Holiday|Rodeo|Panini|ATL Artist|Atlanta|Lil Nas New Music|Lil Nas New Video|Rap|Gen Z Artist|Nas X Holiday|Aye Its A Holiday|Mariah Carey|Christmas|Christmas Song|Holiday Song|Xmas Song|Saint Nick|Chrome Nas X|Santa Nas X|Chrome Santa|SantaNasX|Lil Nas X Santa|Santa Claus|Columbia","9000709","340558","10292","37854","https://i.ytimg.com/vi/9vMLTcftlyI/default.jpg","False","False","Official video for Holiday by Lil Nas X.Listen & Download Holiday by Lil Nas X out now: https://LilNasX.lnk.to/Holiday Amazon Music - https://lilnasx.lnk.to/Holiday/amazonmusicApple Music - https://LilNasX.lnk.to/Holiday/applemusiciTunes - https://LilNasX.lnk.to/Holiday/itunesRoblox - https://LilNasX.lnk.to/Holiday/robloxPandora – https://LilNasX.lnk.to/Holiday/pandoraSpotify - https://lilnasx.lnk.to/Holiday/spotifySoundcloud - https://LilNasX.lnk.to/Holiday/soundcloudYouTube Music - https://LilNasX.lnk.to/Holiday/youtubemusicLimited edition Santa Nas X chrome hat from the video available at: https://LilNasX.lnk.to/Holiday/amazonDirected by Gibson Hazard & Lil Nas X Follow Lil Nas XFacebook - https://www.facebook.com/LilNasXInstagram - https://www.instagram.com/lilnasx/Twitter - https://twitter.com/LilNasX https://www.santanasx.com #LilNasX #Holiday #SantaNasX"
"Ge4AKbnr6ME","Christian Nodal, Ángela Aguilar - Dime Cómo Quieres","2020-11-13T05:00:09Z","UC8BcjeZ5Iz5hgmb_QgLRapQ","ChristianNodalVEVO","10","PT3M2S","2d","hd","True","2020-11-14T18:20:21Z","Christian|Nodal|Ángela|Aguilar|Dime|Cómo|Quieres|Universal|Music|Mexico|Latin|Regional|Mexican","8922900","558855","12586","17147","https://i.ytimg.com/vi/Ge4AKbnr6ME/default.jpg","False","False","Music video by Christian Nodal, Ángela Aguilar performing Dime Cómo Quieres. Fonovisa; © 2020 Universal Music Mexico S.A. de C.V.http://vevo.ly/NBDwML"
"hafxbLTr3M4","Making Charli D'Amelio A Skin Care Routine","2020-11-13T17:31:06Z","UC2sYit3cZ2CuD_8FHYH7O_Q","Hyram","26","PT12M39S","2d","sd","True","2020-11-14T18:20:21Z","skin care|moisturize|tone|product|review|#SkinCareJunkie|#Honolulu|#Hawaii|Charli|Charli D'Amelio|damelio|tiktok|tik tok|tik|tok|collab|collaboration|skin care routine|reacts|reaction|reaction video|funny|Hyram|made a skin care routine|bashing|roasting|dragging|Hyram Approved|neutrogena|cleanser|makeup wipes|serum|moisturizer|sunscreen|herbivore|inkey list|versed|teen acne|teenage|teen|acne scar|scarring|dark spots|sensitive","1270550","65711","2306","3522","https://i.ytimg.com/vi/hafxbLTr3M4/default.jpg","False","False","Subscribe to learn how to perfect YOUR skin care routine! 😄✨WATCH ME REACT TO CHARLI'S ROUTINE HERE: https://youtu.be/dXjvk4N-bsMDon't forget to subscribe to Charli! ✨ https://www.youtube.com/charlidamelio✨ PRODUCTS MENTIONED ✨🐋 Neutrogena Makeup Removing Balm*: https://bit.ly/2Ukvofa🌸 Herbivore Pink Cloud Cleanser*: https://bit.ly/2IEA7Wk🖋️ The Inkey List Niacinamide Serum*: https://bit.ly/3lxA4dy🌿 Versed Dew Point Gel Cream*: https://bit.ly/30Ebvn1🌤️ Tarte Sea Set & Go Powder SPF 30*: https://bit.ly/3eVQQRf✨ VIDEOS MENTIONED ✨Reacting to Charli D'Amelio's Skin Care Routine: https://www.youtube.com/watch?v=qHAtpeNuzLQ*I took an appropriate test and tested negative shortly before meeting up with Charli to film. I self quarantined for two weeks after we met up*Be sure to SUBSCRIBE to my channel to learn how to perfect your skin care routine every week! :)_______________________________________________________________FOLLOW MEInstagram (@SkinCarebyHyram): https://bit.ly/362vLzHTwitter (@SkinCarebyHyram): https://bit.ly/2JfRM4nTikTok: (@skincarebyhyram): https://bit.ly/3aphjDLBUSINESS/PR INQUIRIES: info@skincarebyhyram.com*These are affiliate links that help me earn a small commission from your purchase. Each purchase supports me to keep working as hard as I can to make videos for you guys! Thank you for the support :)"
"PmQsZNery80","Future & Lil Uzi Vert - That's It [Official Music Video]","2020-11-13T05:00:03Z","UCqwxMqUcL-XC3D9-fTP93Mg","LIL UZI VERT","10","PT3M43S","2d","hd","True","2020-11-14T18:20:21Z","Lil|Uzi|Vert|Lil Uzi Vert|Money Longer|LUV|Futsal Shuffle|That Way|Sanguine Paradise|XO Tour Life|XO Tour Llif3|Luv Is Rage|Luv is Rage 2|The Perfect LUV Tape|Rap|Hip Hop|Atlantic Records|Roc Nation|nwE_BsjBSUw|Je2OItlb4pY/edit|PLUTO X BABY PLUTO|PLUTO|Lil Uzi Vert Future|Lil Uzi Vert Future Pluto x Baby Pluto|Future|Future Pluto|Lil Uzi Pluto x Baby Pluto|Baby Pluto|Lil Uzi Vert Future That's It|That's It|Lil Uzi Future That's It|Future That's It","2690680","200069","3718","14147","https://i.ytimg.com/vi/PmQsZNery80/default.jpg","False","False","Future & Lil Uzi Vert - That's It'Pluto x Baby Pluto' OUT NOW!Stream/Download - https://Uzi.lnk.to/PlutoxBabyPlutoIDDirected by Hype WilliamsConnect with Lil Uzi Vert:https://twitter.com/LILUZIVERThttps://www.instagram.com/liluzivert/https://www.facebook.com/LilUziVert/https://www.youtube.com/user/LILUZIVERThttp://liluziofficial.com/#LilUziVert #Future #PlutoxBabyPlutoSubscribe for more official content from Lil Uzi Vert ➤ https://Uzi.lnk.to/YouTubeSubscribe   Listen to Best of Lil Uzi Vert playlist ➤ https://bit.ly/2U6weNsWatch Lil Uzi Vert’s Official Music Videos ➤ https://bit.ly/2UuvH6M"
"LN9UeCVl7p8","Trying Clothing Hacks To See If They Work","2020-11-13T17:05:00Z","UC2hFZwNM71iOOCY3guLE7KQ","Little Lia","26","PT9M10S","2d","sd","True","2020-11-14T18:20:21Z","sssniperwolf|little lia|life hacks|lifehacks|clothing hacks|diy|do it yourself","1232881","41042","1959","3587","https://i.ytimg.com/vi/LN9UeCVl7p8/default.jpg","False","False","Trying Clothing Hacks To See If They Work! Leave a Like if you enjoyed these DIY life hacks! https://www.ridge.com/WOLF Use Code WOLF for 10% off your order ! Video Sponsored by Ridge Wallet Subscribe so you don’t miss videos!Main Channel: https://www.youtube.com/user/sssniperwolfTikTok: http://tiktok.com/@sssniperwolfInstagram: http://instagram.com/sssniperwolfTwitter: http://www.twitter.com/sssniperwolfFacebook: https://www.facebook.com/sssniperwolfOfficial Merch: https://ogwolfpack.com/"
"9Ag-s1c7R0E","My first haircut after the Nba Bubble | Jimmy Butler Vlog","2020-11-14T19:45:33Z","UCcnjp8J9f_ZfwbNoldrUe-w","Jimmy Butler","17","PT8M12S","2d","hd","True","2020-11-14T18:20:21Z","nba bubble vlog|jimmy butler vlog|miami heat|nba bubble|jimmy butler|jimmybutler|jimmy buckets|jimmybuckets|entertainment|comedy|jimmyyoutube|jimmyvlog|darryl omar|darrylomar|nba|jimmy butler youtube|vlogs jimmy|jimmy vlogs|jimmy youtube|jimmy butler story|jimmy butler heat|jimmy butler interview|how to cut hair at home|justin timberlake|los angeles lakers","219117","23471","65","1889","https://i.ytimg.com/vi/9Ag-s1c7R0E/default.jpg","False","False","I had almost gone a year without a cut, that's crazy. Man it felt good to finally get a cut.All Covid-19 Protocols were followed before shooting this video.► SUBSCRIBE: https://goo.gl/ab17aV► WATCH MOREMost Recent Video: https://www.youtube.com/watch?v=v5MGjDHVO68&t=19s► FOLLOW JIMMYInstagram: https://instagram.com/jimmybutlerFacebook: https://goo.gl/GhSdUvExecutive Producers: Jimmy Butler, Darryl OmarDirector/Editor: Darryl Omar. https://instagram.com/darrylomar"
"RUQl6YcMalg","Billie Eilish - Therefore I Am (Official Music Video)","2020-11-12T18:00:11Z","UCDGmojLIoWpXok597xYo8cg","BillieEilishVEVO","10","PT4M59S","2d","hd","True","2020-11-14T18:20:21Z","Billie|Eilish|Therefore|Darkroom/Interscope|Records|Alternative","22880074","2470530","50681","190976","https://i.ytimg.com/vi/RUQl6YcMalg/default.jpg","False","False","Listen to “Therefore I Am”, out now: https://smarturl.it/ThereforeIAm Directed by Billie Eilish Follow Billie Eilish:Facebook: https://www.facebook.com/billieeilishInstagram: https://www.instagram.com/billieeilishTwitter: https://twitter.com/billieeilishYouTube: https://www.youtube.com/BillieEilishEmail: http://smarturl.it/BillieEilishEmailStore: http://smarturl.it/BillieEilishStoreMusic video by Billie Eilish performing Therefore I Am. © 2020 Darkroom/Interscope Records"
"ZpYuL4ZIh-Q","CLAN WARS 2 IMPROVEMENTS & FIXES! 🛠️ Clash Royale Update TV Royale","2020-11-14T12:54:43Z","UC_F8DoJf9MZogEOU51TpTbQ","Clash Royale","20","PT4M58S","2d","sd","True","2020-11-14T18:20:21Z","Clash Royale|Clash Royale Game|Supercell|Supercell Game|Clash Royale Supercell|Mobile Game","695849","37531","1691","2736","https://i.ytimg.com/vi/ZpYuL4ZIh-Q/default.jpg","False","False","We heard your Clan Wars 2 feedback! We're adding a number of new changes and improvements to the Clan Wars experience in our next update. Follow Drew on Twitter: https://twitter.com/drewbianSubscribe for more! ►► http://supr.cl/SubRoyale00:00 TIME ZONE ISSUE00:47 PARTICPATION CAP01:05 CLAN MATCHMAKING01:44 NEW RIVER LENGTHS02:07 FAME BOOST02:21 GAME MODES02:31 NEW LEGENDARY LEAGUES02:47 CLAN UI CHANGES03:22 NEW MINIMUM MEMBER CAP03:36 SUPERCELL ID FRIENDS03:57 OTHER FIXES & IMPROVEMENTSEnter the Arena! From the creators of Clash of Clans comes a real-time multiplayer game starring the Royales, your favorite Clash characters and much, much more.Collect and upgrade dozens of cards featuring the Clash of Clans troops, spells and defenses you know and love, as well as the Royales: Princes, Knights, Baby Dragons and more. Knock the enemy King and Princesses from their towers to defeat your opponents and win Trophies, Crowns and glory in the Arena. Form a Clan to share cards and build your very own battle community.Lead the Clash Royale Family to victory!FEATURES• Duel players from around the world in real-time in both 1v1 and 2v2 Battles• Earn chests to unlock rewards, collect powerful new cards and upgrade existing ones• Destroy opponent's towers and win Crowns to earn epic Crown chests• Build and upgrade your card collection with the Clash Royale Family along with dozens of your favorite Clash troops, spells and defenses• Construct your ultimate Battle Deck to defeat your opponents• Progress through multiple Arenas all the way to the top• Form a Clan to share cards and build your very own battle community• Challenge your Clanmates and friends to a private duel, or play side-by-side in a 2v2 Battle• Work together with your Clan to unlock Clan Chests• Play new events every week• Learn different battle tactics by watching the best duels on TV RoyalePLEASE NOTE! Clash Royale is free to download and play, however, some game items can also be purchased for real money. If you don't want to use this feature, please disable in-app purchases in your device's settings. Also, under our Terms of Service and Privacy Policy, you must be at least 13 years of age to play or download Clash Royale. A network connection is also required.Support:Are you having problems? Visit http://supercell.helpshift.com/a/clash-royale/ or contact us in-game by going to Settings, Help and support.Privacy Policy:http://supercell.com/en/privacy-policy/Terms of Service:http://supercell.com/en/terms-of-service/Parent's Guide:http://supercell.com/en/parents/#ClashRoyale #Update #ClanWars2"
"lLy_eCjfzG0","Gordon Served Filet Mignon Fondue | Kitchen Nightmares","2020-11-14T17:00:13Z","UCUZzyuAlhHNP3oiuMjn7RfQ","Kitchen Nightmares","24","PT4M3S","2d","hd","True","2020-11-14T18:20:21Z","Gordon Ramsay kitchen nightmares|Gordon Ramsay best insults|kitchen nightmares full episodes|kitchen nightmares online|kitchen nightmares watch online|kitchen nightmares HD|kitchen nightmares best moments|Gordon Ramsay|Kitchen Nightmares|kitchen nightmares funniest moments|kitchen nightmares fridges|kitchen nightmares worst food|kitchen nightmares worst fridges|kitchen nightmares argument|kitchen nightmares food","344573","9488","121","625","https://i.ytimg.com/vi/lLy_eCjfzG0/default.jpg","False","False","Comes out looking like dog foodIf you liked this clip check out the rest of Gordon's channels:http://www.youtube.com/gordonramsayhttp://www.youtube.com/thefwordhttp://www.youtube.com/kitchennightmaresMore Gordon Ramsay:Website: http://www.gordonramsay.comFacebook: http://www.facebook.com/GordonRamsay01Twitter: http://www.twitter.com/GordonRamsay"
"udukDC0LFFQ","Future & Lil Uzi Vert - Stripes Like Burberry [Official Audio]","2020-11-13T05:00:09Z","UCqwxMqUcL-XC3D9-fTP93Mg","LIL UZI VERT","10","PT4M35S","2d","hd","True","2020-11-14T18:20:21Z","Lil|Uzi|Vert|Lil Uzi Vert|Eternal Atake|Money Longer|LUV|Futsal Shuffle|That Way|XO Tour Life|XO Tour Llif3|Luv Is Rage|The Perfect LUV Tape|Akadmiks|Philly|Rap|Hip Hop|Atlantic Records|Generation Now|Roc Nation|nwE_BsjBSUw|New Patek|Je2OItlb4pY/edit|PLUTO X BABY PLUTO|PLUTO|Lil Uzi Vert Future|Lil Uzi Vert Future Pluto x Baby Pluto|Future|Future Pluto|Lil Uzi Pluto x Baby Pluto|Baby Pluto|Lil Uzi Vert Future Stripes Like Burberry|Stripes Like Burberry","948415","50542","649","3734","https://i.ytimg.com/vi/udukDC0LFFQ/default.jpg","False","False","Future & Lil Uzi Vert - Stripes Like Burberry'Pluto x Baby Pluto' OUT NOW!Stream/Download - https://Uzi.lnk.to/PlutoxBabyPlutoIDConnect with Lil Uzi Vert:https://twitter.com/LILUZIVERThttps://www.instagram.com/liluzivert/https://www.facebook.com/LilUziVert/https://www.youtube.com/user/LILUZIVERThttp://liluziofficial.com/#LilUziVert #Future #PlutoxBabyPlutoSubscribe for more official content from Lil Uzi Vert ➤ https://Uzi.lnk.to/YouTubeSubscribe   Listen to Best of Lil Uzi Vert playlist ➤ https://bit.ly/2U6weNsWatch Lil Uzi Vert’s Official Music Videos ➤ https://bit.ly/2UuvH6M"
