video_id,title,publishedAt,channelId,channelTitle,categoryId,duration,dimension,definition,is_trending,time_retrieved,tags,view_count,likes,dislikes,comment_count,thumbnail_link,comments_disabled,ratings_disabled,description
"vMrxul4DMEo","ARK: Genesis Part 2 Teaser Trailer!","2020-11-07T19:30:52Z","UCEYfsfyne69mFfNTcZeZ6gw","ARK: Survival Evolved","20","PT2M24S","2d","hd","True","2020-11-14T18:20:25Z","ark|ark survival evolved|survival evolved|dinosaur game|xbox one|pc|steam","1092259","51171","698","4999","https://i.ytimg.com/vi/vMrxul4DMEo/default.jpg","False","False","ARK: Genesis Part 2 introduces a vast contiguous world filled with strange new biomes, story missions, and exotic creatures! The final confrontation between the spritely HLN-A and the villainous Sir Edmund Rockwell occurs on a gigantic colony ship traveling through deep space. Players will need to draw on all their ARK experience to succeed. ARK's largest Expansion Pack yet has game-changing additions for every kind of Survivor: whether it's taking possession of enemies via brain-controlling Noglin creatures, zooming around doing radical tricks on the skateboard-like Hoversail, or managing and viewing your base remotely with security cameras, among tons of other new items and creatures!   This expansion pack also introduces new voiceover talent to the ARK universe with David Tennant (Doctor Who, Good Omens) playing the villainous Sir Edmund Rockwell, and Madeleine Madden (The Wheel of Time, Picnic at Hanging Rock, Dora and the Lost City of Gold) taking on the in-game robotic AI companion HLN-A/Helena Walker.But even with HLN-A's help, will your powerful skills, gear, and tames be sufficient to put a stop to Rockwell's demented plans once and for all? We're about to find out because The End is Near!Get a hold of the Genesis Season Pass today! http://playark.com/For the latest updates follow us on:Tweet us at https://www.twitter.com/survivethearkLike us on Facebook https://www.facebook.com/survivetheark/Visit the Website: http://playark.com Community Hub: http://www.survivetheark.comSubreddit: https://www.reddit.com/r/playarkInstagram: https://www.instagram.com/survivethearkPlus watch us tame and train leviathan creatures: https://www.twitch.tv/survivetheark"
"CrsOl5EW740","Donald Trump poses with bride at golf course after losing election to Joe Biden","2020-11-07T21:35:42Z","UCshwRhftzkiov5wKR7M_LsQ","The Independent","25","PT1M46S","2d","hd","True","2020-11-14T18:20:25Z","donald trump|joe biden|us election|2020 election","586084","4715","2310","3704","https://i.ytimg.com/vi/CrsOl5EW740/default.jpg","False","False","Donald Trump posed with a bride at his Virginia golf club on Saturday shortly after it was declared that he had lost the presidential election.The president got off his golf cart and stood for a photo with the wedding party, saying afterwards, “Have a great life”. He did not offer any comment on the election result.The president has refused to concede the election despite being soundly beaten by Joe Biden once Pennsylvania — and its 20 electoral college votes — was called for the Democrat on Saturday morning.Read the full story: https://www.independent.co.uk/news/world/americas/us-election-2020/trump-golf-biden-election-lose-b1678731.htmlLike us on Facebook: https://www.facebook.com/TheIndependentOnlineFollow us on Twitter: https://twitter.com/IndependentFollow us on Instagram: https://www.instagram.com/the.independentSubscribe to Independent Premium for exclusive content and live events: https://bit.ly/2MiOONB"
"kUok7mvWgjk","PS5 & Xbox Series X Unboxing! (it's my birthday..)","2020-11-08T18:17:11Z","UCS5Oz6CHmeoF7vSad0qqXfw","DanTDM","20","PT12M7S","2d","hd","True","2020-11-14T18:20:25Z","dantdm|dan tdm|gaming|ps5|xbox series x|unboxing","2270830","341741","2443","100356","https://i.ytimg.com/vi/kUok7mvWgjk/default.jpg","False","False","sub pls : http://bit.ly/TxtGm8Twitch : http://www.twitch.tv/dantdmNEW MERCH : http://www.dantdmshop.comFollow Me : 🐦 http://www.twitter.com/DanTDM 📷 http://www.instagram.com/DanTDMUnboxing starts: 0:00PS5 Unboxing: 1:13Xbox Series X Unboxing: 4:32Comparison: 8:25Massive thanks to Playstation and Xbox for sending these to me."
"vEGQFBzTgH4","HOLO TACO FROSTED METALS COLLECTION REVEAL❄️😱","2020-11-07T16:29:52Z","UCGCVyTWogzQ4D170BLy2Arw","Simply Nailogical","24","PT13M4S","2d","hd","True","2020-11-14T18:20:25Z","nails|nail art|nail tutorial|beauty tutorial|nail art tutorial|diy nails|diy nail art|simply nailogical|cristine|holoday|holodays|holiday nails|holo taco|frosted metals|metallic|metal|metallic nails|foil|reflection|reflective nails|mirror nails|frosted nail|frosted tips|medal|collection box|holiday collection|rose gold|metallic mint|silver nails","773153","51186","533","4460","https://i.ytimg.com/vi/vEGQFBzTgH4/default.jpg","False","False","You've been good... your nails deserve a metal😏🏅 NEW HOLO TACO FROSTED METALS collection just dropped❄️➡️ http://holota.co/simplyfrosty♡ Subscribe to never miss n̶e̶w̶ ̶n̶a̶i̶l̶ ̶a̶r̶t̶ ̶t̶u̶t̶o̶r̶i̶a̶l̶s̶! http://bit.ly/subsimply♡ Subscribe to Holo Taco (for nail videos lol): http://bit.ly/SubHoloTaco♡ Subscribe to the Podcast to hear me have adult conversations: http://bit.ly/SubSimplyPodLogical_ _ _ _ _ _ _ _ _ _ _ _ _ _ _ _ _ _ _ _ _ _ _ _ _ _ _ _ _ _ _ _ _ _💿🌮💅❄️H O L O  T A C O  F R O S T E D  M E T A L S  C O L L E C T I O NNOW AVAILABLE: http://holota.co/simplyfrosty🎅❄️This is our annual Holodays collection!❄️📦Holo Taco Frosted Metals Collection Box set (includes 5 polishes) - $65 (USD) ***LIMITED QUANTITIES of box***  http://holota.co/simplyfrosty❄️💅 5 new metallic foil polishes  - $13 each http://holota.co/simply-frosty  Note: The Collection Box set is limited edition and there will not be a restock of boxes. The individual polishes are not limited edition, and will restock if sold out so long as supplies are available. Make sure to grab your fave shades! #HoloTacoDon't forget to pick up the following to complete the perfect mani!💅 Smoothing Base coat: http://holota.co/simplysmoothingbase💅 Long-Lasting Base coat: https://www.holotaco.com/products/long-lasting-base💦🌮 Glossy Taco or Super Glossy Taco, for that super smooth glossy quick-dry finish and to make your nail polish last longer without chipping: http://holota.co/sosoglossy💿🌮 A Holo Taco or Unicorn Skin to top it off and make it your own #HoloTacoComboFollow the holo:https://www.instagram.com/holotaco/https://twitter.com/holotacohttps://www.facebook.com/holotaco/_ _ _ _ _ _ _ _ _ _ _ _ _ _ _ _ _ _ _ _ _ _ _ _ _ _ _ _ _ _ _ _ _ _Stalk me on all the social medias!http://instagram.com/simplynailogicalhttps://www.snapchat.com/add/simplynailogicahttps://twitter.com/nailogicalhttps://www.facebook.com/simplynailogicalhttp://www.simplynailogical.com (archival materials)My other YouTube channels:https://www.youtube.com/simplypodlogicalhttps://www.youtube.com/holotacohttps://www.youtube.com/simplynotlogical_ _ _ _ _ _ _ _ _ _ _ _ _ _ _ _ _ _ _ _ _ _ _ _ _ _ _ _ _ _ _ _ _ _I film my nail videos with this camera: http://amzn.to/1MgznhtThis 105mm macro lens: http://amzn.to/1Pi8PM3I filmed my face in this video with this camera: https://amzn.to/327OB7bThis lens: https://amzn.to/38HnBgUVoiceover mic: http://amzn.to/1MefGpGAudio recorder: https://amzn.to/3dbtg1wExternal mic: https://amzn.to/32AnO3gRing light for face-cams: http://amzn.to/2cU7cNOI edit my videos with: http://bit.ly/videoeditor1I get some cool editing filters from: https://motionvfx.sjv.io/Ze3bRCheck out my personalized Amazon page with stuff I like! https://www.amazon.com/shop/simplynailogicalMusic: http://share.epidemicsound.com/SIMPLY_ _ _ _ _ _ _ _ _ _ _ _ _ _ _ _ _ _ _ _ _ _ _ _ _ _ _ _ _ _ _ _ _ _Disclaimer cause I love you guys: I didn't pay myself specifically to make this video for Holo Taco but I do benefit from Holo Taco sales😊 Some other links above are affiliate links."
"LIU-tAquSnI","Joe Biden Wins 2020 Presidential Election: Watch His Road to Victory | WSJ","2020-11-07T17:53:35Z","UCK7tptUDHh-RYDsdxO1-5QQ","Wall Street Journal","25","PT9M14S","2d","hd","True","2020-11-14T18:20:25Z","Election results|Donald Trump|Joe Biden|2020 election|Florida|Pennsylvania|winner|polls|arizona|nevada|georgia|delaware|scranton|vice president|president|white house|electoral college|associated press|voting|senate|iowa|caucuses|south carolina|primaries|healthcare|supreme court|criminal justice|immigration|democrat|Kamala Harris|Barack Obama|Hillary Clinton|Beau Biden|Bernie Sanders|Jim Clyburn|George Floyd|Amy Coney Barrett|president-elect|transition","964533","16447","5396","13675","https://i.ytimg.com/vi/LIU-tAquSnI/default.jpg","False","False","Joe Biden, on his third run for the presidency, defeated President Donald Trump, the Associated Press reports. WSJ’s Jason Bellini reports on his path to victory. Photo: Rick Loomis/Getty ImagesMore from the Wall Street Journal:Visit WSJ.com: http://www.wsj.comVisit the WSJ Video Center: https://wsj.com/videoOn Facebook: https://www.facebook.com/pg/wsj/videos/On Twitter: https://twitter.com/WSJOn Snapchat: https://on.wsj.com/2ratjSM#WSJ #Biden #Election2020"
"OtLoI4Z3QKI","Customizing 1,000 Phone Cases, Then Giving Them Away!! 📱📞 (Giveaway) | ZHC","2020-11-06T17:00:05Z","UClQubH2NeMmGLTLgNdLBwXg","ZHC","24","PT12M8S","2d","hd","True","2020-11-14T18:20:25Z","[none]","4423271","222637","5038","33395","https://i.ytimg.com/vi/OtLoI4Z3QKI/default.jpg","False","False","I can't believe we customized 1,000 phone cases and gave them to subscribers lolDownload Lords Mobile to win BIG prizes here: https://igg.com/event/ZHC10 MACBOOK PROS, $25,000 CASH GIVEAWAY and a $350 gift pack for everyone! Sponsored by Lords MobileHope you enjoyed! Thanks for watching:)SUBSCRIBE And I'll Giveaway More Stuff To YouFollow my socials! Instagram: @ zhcomicartTikTok: @ zhcyt"
"91vECNhvmMY","Maluma & The Weeknd - Hawái Remix (Official Video)","2020-11-05T17:00:02Z","UClZuKq2m0Qu-HkopkSBLpEw","Maluma","10","PT3M44S","2d","hd","True","2020-11-14T18:20:25Z","maluma|the weeknd|maluma hawai remix|hawai remix|hawai remix video|hawai remix video oficial|hawai remix official video|hawai remix letra|hawai remix lyrics|hawai remix maluma letra|maluma hawai remix letra|maluma hawai remix lyrics|maluma 2020|hawai de vacaciones|muy lindo en instagram maluma|the weekend maluma|maluma weekend|weeknd|Hawaii|the weeknd blinding lights|the weeknd too late|the weeknd hawaii|the weekend blinding lights|the weekend hawaii","38104482","1509221","46949","68198","https://i.ytimg.com/vi/91vECNhvmMY/default.jpg","False","False","Maluma & The Weeknd - Hawái Remix (Official Video)Top Hits: https://smarturl.it/malumatophitsMusic:Apple Music: https://smarturl.it/HawaiRemix/applemusic Spotify: https://smarturl.it/HawaiRemix/spotify Amazon: https://smarturl.it/HawaiRemix/az YouTube: https://smarturl.it/HawaiRemix/youtube iTunes: https://smarturl.it/HawaiRemix/itunes Deezer: https://smarturl.it/HawaiRemix/deezerFollow Maluma:https://maluma.online/http://www.facebook.com/MALUMAMUSIKhttp://www.twitter.com/malumahttp://www.instagram.com/maluma Follow The Weeknd:https://twitter.com/theweekndhttps://www.facebook.com/theweekndhttps://www.instagram.com/theweekndhttps://www.theweeknd.comLyrics: (The Weeknd)So now he’s your heaven You’re lying to yourself and him to make me jealous You put on such an act when you’re sleeping together All this cause I said I don’t want marriage, I don’t want marriage I rather go half on a babyCause at least I know that it’s not temporary And at least we’ll share something that’s real I can tell that you’re just tryna feel(The Weeknd)Puede que no te haga falta na', aparentemente na'Hawái de vacaciones, mis felicitacionesMuy lindo en Instagram lo que posteasPa' que yo vea cómo te va, pa' que yo vea(Maluma) Puede que no te haga falta na', aparentemente na'Hawái de vacaciones, mis felicitacionesMuy lindo en Instagram lo que posteasPa' que yo vea como te va de bien, pero te haces malPorque el amor no se compra na'Miéntele a todos tus seguidoresDile que los tiempos de ahora son mejoresNo creo que cuando te llame me ignoresSi después de mí ya no habrán más amoresTú y yo fuimos unoLo hacíamos en ayuna antes del desayunoFumábamos la hookah y te pasaba el humoY ahora en esta guerra no gana ningunoSi me preguntas, nadie tiene culpaA veces los problemas a uno se le juntanDéjame hablar, porfa, no me interrumpasSi te hice algo malo, entonces discúlpameLa gente te lo va a creer, actúas bien ese papelBaby, pero no eres feliz con él(The Weeknd)Puede que no te haga falta na', aparentemente na'Hawái de vacaciones, mis felicitacionesMuy lindo en Instagram lo que posteasPa' que yo vea cómo te va, pa' que yo vea(Maluma) Puede que no te haga falta na', aparentemente na'Hawái de vacaciones, mis felicitacionesMuy lindo en Instagram lo que posteasPa' que yo vea como te va de bien, pero te haces malPorque el amor no se compra na'(The Weeknd)So now he’s your heaven You’re lying to yourself and him to make me jealous You put on such an act when you’re sleeping together All this cause I said I don’t want marriage, I don’t want marriage#Maluma #TheWeeknd #HawáiRemix Official Music Video by Maluma & The Weekend performing “Hawái Remix” (C) 2020 Sony Music Entertainment US Latin LLC"
"4vScGuhHimQ","Among Us: The MedBay Scan","2020-11-07T14:45:11Z","UCJ3QmQIXK1EnEskKnqzyHew","Flash in Rahul","20","PT1M37S","2d","hd","True","2020-11-14T18:20:25Z","among us|among us medbay scan animation|medbay scan animation|among us animation|among us 3d animation|among us animation meme|animation|among us animations|among us impostor|among us medbay|among us memes|among us imposter|medbay scan among us|among us medbay scan imposter|among us meme|among us medbay scan|medbay scan glitch in among us|medbay scan|among us gameplay|among us medbay scan sound|medbay|2d animation|when you werent in medbay donig scans","2695299","75399","2026","3433","https://i.ytimg.com/vi/4vScGuhHimQ/default.jpg","False","False","Subscribe for more!"
"tZsia6-aBZM","The Kid LAROI - ALWAYS DO (Official Video)","2020-11-06T05:00:11Z","UC6G2vAJrt407lwiynW116Eg","The Kid LAROI.","10","PT2M49S","2d","sd","True","2020-11-14T18:20:25Z","The Kid LAROI|Juice WRLD|Grade A|Lil Bibby|Savage|Fuck Love Savage|Fuck Love|Always Do|The Kid LAROI Always Do|The Kid LAROI Video|TikTok Rap|Soundcloud Rap|Lyrical Lemonade","3185740","206711","3351","13950","https://i.ytimg.com/vi/tZsia6-aBZM/default.jpg","False","False","Official video for ALWAYS DO by The Kid LAROI. Listen & Download F*CK LOVE (SAVAGE) out now: https://TheKidLaroi.lnk.to/Savage Amazon Music - https://TheKidLaroi.lnk.to/Savage/amazonmusicApple Music - https://TheKidLaroi.lnk.to/Savage/applemusic  iTunes - https://TheKidLaroi.lnk.to/Savage/itunesSpotify - https://TheKidLaroi.lnk.to/Savage/spotifyYouTube Music - https://TheKidLaroi.lnk.to/Savage/youtubemusic  Executive Produced By: Grade A Productions, Brandon “Bibby” Dickinson, George “G Money” Dickinson & Peter Pete JideonwoDirector: Steve CannonExecutive Producer: Nolan RiddleProducer: Max McGuireDir. of Photography: Logan MeisEditor: Steve Cannon, Griffin Olis Colorist: Loren WhiteCreative Direction: Steve Cannon , Damien O DeAnda, Jacob Santiago Production Coordinator: nocrdntlsAssistant Director: Amanjah AnthonySteadicam: Aser Santos Jr1st AC: Aaron Kohn2nd AC: Spencer WoodKey Grip: Edward Karl RodriguezGaffer: Kevin ChoSwing: Ciara Lea Claudio BraganzoDrone: Will MarkQuartLead Actress: Pelin Ufuktepe Stylist: Jenna DemaioH/MU: Cynthia DiazCasting: Ariona BeninatoPA: Ariel DyrekPA: Gabriel PelluzoPA: Christian PelluzoFollow The Kid LAROIFacebook - https://www.facebook.com/thekidlaroi/Instagram -https://www.instagram.com/thekidlaroi/Twitter - https://twitter.com/thekidlaroi #TheKidLAROI #ALWAYSDO #SAVAGE"
"ECQ7ynk59uU","The Kid LAROI - TRAGIC (Official Audio) ft. Youngboy Never Broke Again, Internet Money","2020-11-06T05:00:01Z","UCqPbkJrjrsQb_RGlC_4HEgg","TheKidLAROIVEVO","10","PT2M35S","2d","hd","True","2020-11-14T18:20:25Z","The Kid LAROI New song|TheKidLAROI|Grade A|JuiceWRLD|Juice World|LAROI|The Kid|Rap Music|TikTok|Viral Rap|Soundcloud Rap|lyrical lemonade|cole bennett|the kid laroi so done|so done laroi|laroi so done|fuck love|fvck love|savage|the kid laroi done|Tragic|Tragic The Kid LAROI|Tragic LAROI|Columbia|Rap|TRAGIC|The Kid LAROI feat. YoungBoy Never Broke Again & Internet Money","1990983","73289","1317","5133","https://i.ytimg.com/vi/ECQ7ynk59uU/default.jpg","False","False","Official audio for TRAGIC by The Kid LAROI featuring YoungBoy Never Broke Again & Internet Money Listen & Download F*CK LOVE (SAVAGE) out now: https://TheKidLaroi.lnk.to/Savage Amazon Music - https://TheKidLaroi.lnk.to/Savage/amazonmusicApple Music - https://TheKidLaroi.lnk.to/Savage/applemusic  iTunes - https://TheKidLaroi.lnk.to/Savage/itunesSpotify - https://TheKidLaroi.lnk.to/Savage/spotifyYouTube Music - https://TheKidLaroi.lnk.to/Savage/youtubemusic   Follow The Kid LaroiFacebook - https://www.facebook.com/thekidlaroi/Instagram -https://www.instagram.com/thekidlaroi/Twitter - https://twitter.com/thekidlaroi #TheKidLAROI #TRAGIC #YoungBoyNeverBrokeAgain #InternetMoney"
"WVv0kolFzQI","Toosii - Pain & Problems (Official Video)","2020-11-06T01:00:02Z","UCUtmzHuW43bFbUP-Xl0TTKA","Toosii 2x","20","PT3M40S","2d","sd","True","2020-11-14T18:20:25Z","[none]","1469520","62897","503","2533","https://i.ytimg.com/vi/WVv0kolFzQI/default.jpg","False","False","Watch Toosii's official video for Pain and ProblemsFollow Toosii Everywhere:Facebook: https://www.facebook.com/Toosii2x/Twitter: https://twitter.com/toosii2xInstagram: https://www.instagram.com/toosii2x/TikTok: https://vm.tiktok.com/ZMJDUjWwW/ Stream Toosii Everywhere:Spotify: https://toosii.lnk.to/SpotifyIDApple Music: https://toosii.lnk.to/AppleIDSoundcloud: https://toosii.lnk.to/SoundcloudIDSubscribe to Toosii's YouTube here: https://toosii.lnk.to/YTSubscriptionIDGet Poetic Pain Merch here: https://toosii.lnk.to/ShopID"
"f3DSeEEz5ko","Farruko, Sech, Myke Towers - La Tóxica (Remix - Official Video) ft. Jay Wheeler, Tempo","2020-11-05T23:00:11Z","UC46TVKqBkiTT85ddkJDdK3w","FARRUKOVEVO","10","PT5M3S","2d","hd","True","2020-11-14T18:20:25Z","Farru|Farruko 2020|Farruko La Toxica|La toxica remix|Farruko letra|La toxica remix letra|La toxica remix Lyrics|Video oficial La Toxica remix|Official audio La toxica remix|Farruko sech myke|sech la toxica remix|myke towers la toxica|myke towers 2020|sech 2020|jay wheeler|tempo|la toxica remix official video|Farruko|Sech|Myke Towers feat. Jay Wheeler & Tempo|La Tóxica|Latin Urban|Sony Music Latin","14455304","342625","7843","10722","https://i.ytimg.com/vi/f3DSeEEz5ko/default.jpg","False","False","Farruko, Sech & Myke Towers feat. Jay Wheeler & Tempo - La Toxica (Remix) (Official Video)Música:Apple Music: https://smarturl.it/LaToxicaRemix/applemusic Spotify: https://smarturl.it/LaToxicaRemix/applemusic Amazon: https://smarturl.it/LaToxicaRemix/az YouTube: https://smarturl.it/LaToxicaRemix/youtube iTunes: https://smarturl.it/LaToxicaRemix/itunes Deezer: https://smarturl.it/LaToxicaRemix/deezerLetra:[Sech]Ella tiene to’ sus puntos clarosPrimero la calle, luego sus amigas, Botellas arriba y un phillie a la salidaAhora nadie la impide salirAhora se ríe de ese pobre infeliz[Jay Wheeler]De una relación tóxicaAcaba de salir la convencieron Y se arreglo para ir   [Farruko]Lara Mercy Gang Farru y se va para la calle En busca de un jangueo Pi ri ya ya [ Myke Towers]En donde haya músicaHaya hookah y botelleo ey [Jay Wheeler]Y se va pa la calle En busca de un jangueo [Sech]Ella no quiere amor ella está puesta Pal perreo [ Myke Tower]Ella lo que quiere es es despejar la mente En donde haya ambiente independiente Desde que cumplio los veinte Va para la calle con las misma de siempre A borrar la depresión sienten la presiónPonen su canción, llama la atenciónHecha perfección  yo siento que lo nuestro Ya es una obsesión dicen que de su bloque Ella es la sensaciónElla le da hasta abajoAl ritmo del bajo Y lo que hablen de ella le importa un carajo Un par de phillies para olvidarse Del jevo ella no quiere enamorarse de nuevo [Farruko]Pi ri ya ya ya Le da hasta abajo Al ritmo del bajo Lo que hablen de ella Le importa un carajo Esta puesta para romper La carreta y ahora más Que está de moda estar soltera [Tempo]Oh oh Quienes son los que mandan aquí La mujeres o los hombres ah One , two , one , two Si es lo que quiere toma, toma Bailale de frente y dile tra tra Con las manos arriba grita tra tra Así es que mi corillo grita pum pum pum Ahora tu mami dile Pal piso pal piso pal piso Tu eres la que manda dile tra tra Yo hice esto pa ti grita tra tra Y todos los envidioso que [Farruko]Y se va para la calle En busca de un jangueo, un jangueo [Myke Tower]En donde haya música, haya hookah y botelleo [Jay Wheeler]Y se va pa la calle En busca de un jangueo [Sech]Ella no quiere amor ella está puesta para el perreo Pi ri Ya yaOfficial Website: https://farruko.com/Facebook: https://www.facebook.com/FarrukoOfficialTwitter: https://twitter.com/farrukoofficialInstagram: https://www.instagram.com/farrukoofficial/#Farruko #LaTóxicaRemixOfficial Music Video by Farruko, Sech & Myke Towers feat. Jay Wheeler & Tempo performing La Tóxica (Remix) (C) 2020 Sony Music Entertainment LLChttp://vevo.ly/zIH5Ko"
"8hsGL3EpO40","America Votes 2020: Joe Biden wins U.S. presidential election","2020-11-07T20:20:41Z","UCuFFtHWoLl5fauMMD5Ww2jA","CBC News","25","PT3H10M51S","2d","hd","True","2020-11-14T18:20:25Z","Joe Biden wins|Joe Biden|U.S. election winner|U.S. election|U.S. election result|2020 U.S. election|Donald Trump|Biden|Trump|CBC|CBC News|U.S. president","838177","8210","3793","3245","https://i.ytimg.com/vi/8hsGL3EpO40/default.jpg","False","False","Joe Biden has won the U.S. presidential election. President Donald Trump is contesting some state results.To read more: http://www.cbc.ca/1.5793885»»» Subscribe to CBC News to watch more videos: http://bit.ly/1RreYWSConnect with CBC News Online:For breaking news, video, audio and in-depth coverage: http://bit.ly/1Z0m6iXFind CBC News on Facebook: http://bit.ly/1WjG36mFollow CBC News on Twitter: http://bit.ly/1sA5P9HFor breaking news on Twitter: http://bit.ly/1WjDyksFollow CBC News on Instagram: http://bit.ly/1Z0iE7OSubscribe to CBC News on Snapchat: https://bit.ly/3leaWsrDownload the CBC News app for iOS: http://apple.co/25mpsUzDownload the CBC News app for Android: http://bit.ly/1XxuozZ»»»»»»»»»»»»»»»»»»For more than 75 years, CBC News has been the source Canadians turn to, to keep them informed about their communities, their country and their world. Through regional and national programming on multiple platforms, including CBC Television, CBC News Network, CBC Radio, CBCNews.ca, mobile and on-demand, CBC News and its internationally recognized team of award-winning journalists deliver the breaking stories, the issues, the analyses and the personalities that matter to Canadians."
